8478554948	Bill Gates Ethnicity Scottish American	2.5319148936170213	94	0.821287619814	3	3	3	3	2	3	3	3	3	2	0	3	3	3	3	3	3	3	3	3	2	2	1	2	3	3	3	3	0	2	0	3	2	2	3	3	3	3	2	2	3	3	3	3	3	2	3	3	3	3	3	2	3	3	3	3	2	0	3	3	3	3	3	3	3	3	3	2	2	1	2	3	3	3	3	0	2	0	3	2	2	3	3	3	3	2	2	3	3	3	3	3	2	3
8478554948	Bill Gates Episode appearances  Appearance type Him/Herself	0.30952380952380953	84	0.462297329499	1	0	0	0	0	0	0	0	1	0	0	1	1	0	1	1	0	0	1	1	0	0	0	0	1	0	0	0	0	0	1	1	0	0	0	0	0	1	0	0	1	0	1	0	0	0	0	0	0	0	1	0	0	1	1	0	1	1	0	0	1	1	0	0	0	0	1	0	0	0	0	0	1	1	0	0	0	0	0	1	0	0	1	0
8478554948	Bill Gates Influenced Naveen Jain	0.6428571428571429	84	0.781373289592	1	0	0	0	1	0	0	1	0	0	0	1	1	1	1	0	2	0	2	2	0	0	0	2	2	0	0	0	0	0	1	2	2	0	2	0	1	1	0	1	0	0	1	0	0	0	1	0	0	1	0	0	0	1	1	1	1	0	2	0	2	2	0	0	0	2	2	0	0	0	0	0	1	2	2	0	2	0	1	1	0	1	0	0
8478554948	Bill Gates Films On This Subject Pirates of Silicon Valley	0.2765957446808511	94	0.534038314809	1	0	0	0	0	0	0	0	1	0	0	0	0	0	0	0	1	0	0	1	1	0	0	1	2	0	0	0	0	0	0	0	0	0	1	1	2	0	0	0	0	0	0	0	1	0	0	1	0	0	0	0	0	0	0	1	0	0	0	0	0	0	0	1	0	0	1	1	0	0	1	2	0	0	0	0	0	0	0	0	0	1	1	2	0	0	0	0	0	0	0	1	0	0
8478554948	Bill Gates Spouse (or domestic partner)  Spouse Melinda Gates	2.760869565217391	92	0.558911310095	3	3	3	3	1	3	3	3	1	3	3	3	3	3	3	3	3	3	3	3	2	3	2	3	3	3	3	3	3	3	3	3	3	3	3	3	3	2	2	1	3	3	3	2	3	3	3	3	3	3	1	3	3	3	1	3	3	3	3	3	3	3	3	3	3	3	2	3	2	3	3	3	3	3	3	3	3	3	3	3	3	3	3	2	2	1	3	3	3	2	3	3
8478554948	Bill Gates Employment history  Employer Microsoft Corporation	1.0212765957446808	94	1.0208332371	1	0	1	2	2	0	2	1	0	1	1	0	0	1	0	2	1	0	0	3	0	0	2	2	3	3	1	1	0	1	0	0	0	0	2	2	1	1	0	3	0	1	3	0	2	2	0	1	0	1	2	2	0	2	1	0	1	1	0	0	1	0	2	1	0	0	3	0	0	2	2	3	3	1	1	0	1	0	0	0	0	2	2	1	1	0	3	0	1	3	0	2	2	0
8478554948	Bill Gates Parents William H. Gates, Sr.	2.774193548387097	93	0.588948986565	3	3	3	3	0	3	3	3	1	2	3	3	3	3	3	3	3	3	3	3	3	2	2	3	3	3	3	3	2	3	3	3	3	3	3	3	3	3	2	3	3	3	3	3	3	3	3	3	3	3	0	3	3	3	1	2	3	3	3	3	3	3	3	3	3	3	3	2	2	3	3	3	3	3	2	3	3	3	3	3	3	3	3	3	2	3	3	3	3	3	3	3	2
8478554948	Bill Gates Siblings  Sibling Kristi Gates	2.652173913043478	92	0.66650911812	2	3	3	3	0	3	3	3	1	2	3	3	3	3	3	3	3	3	3	3	3	2	2	3	3	3	3	3	2	3	3	3	2	3	3	3	3	3	2	1	3	3	2	2	3	3	2	3	3	3	0	3	3	3	1	2	3	3	3	3	3	3	3	3	3	3	3	2	2	3	3	3	3	3	2	3	3	3	2	3	3	3	3	3	2	1	3	3	2	2	3	3
8478554948	Bill Gates Organizations founded Microsoft Corporation	0.7692307692307693	91	1.00631984382	1	0	0	2	2	0	0	1	0	0	0	1	0	1	1	0	0	2	0	0	0	1	2	3	1	0	0	3	0	0	0	0	1	2	2	0	0	3	0	1	3	0	2	0	0	1	0	0	2	2	0	0	1	0	0	0	1	0	1	1	0	0	2	0	0	0	1	2	3	1	0	0	3	0	0	0	0	1	2	2	0	0	3	0	1	3	0	2	0	0	0
8478554948	Bill Gates Children Phoebe Adele Gates	2.642857142857143	28	0.717848258651	3	3	3	3	1	3	3	3	1	2	3	3	3	3	3	3	3	3	1	3	3	3	1	2	3	3	3	3
8478554948	Bill Gates Education  Institution Harvard College	2.230769230769231	26	0.890448992522	2	3	3	3	1	2	3	2	3	2	0	2	3	2	3	3	3	1	2	3	2	3	2	0	2	3
8478554948	Bill Gates Place of birth Seattle	2.6363636363636362	22	0.77138921584	3	3	3	3	1	3	3	3	1	3	3	3	3	3	3	1	3	3	3	1	3	3
8478554948	Bill Gates Awards Won  Award winner Melinda Gates	0.6888888888888889	90	0.914627361211	1	1	0	2	1	0	1	0	0	0	1	2	0	2	1	0	0	3	0	0	0	0	1	0	0	0	0	3	0	0	0	2	1	1	1	0	0	2	0	1	1	0	3	0	0	1	1	0	2	1	0	1	0	0	0	1	2	0	2	1	0	0	3	0	0	0	0	1	0	0	0	0	3	0	0	0	2	1	1	1	0	0	2	0	1	1	0	3	0	0
8772815348	Poland Contains major portion of Barkocin	0.0	12	0.0	0	0	0	0	0	0	0	0	0	0	0	0
8772815348	Poland Coat of Arms used  Coat of Arms Coat of arms of Poland	0.0	12	0.0	0	0	0	0	0	0	0	0	0	0	0	0
8772815348	Poland Multi-event tournaments participated in 2012 World Mountain Running Championships	0.0	12	0.0	0	0	0	0	0	0	0	0	0	0	0	0
8772815348	Poland Currency Used Polish złoty	0.16666666666666666	12	0.37267799625	0	0	0	0	0	1	0	0	0	0	0	1
8772815348	Poland Flag  Flag Flag of Poland	0.0	12	0.0	0	0	0	0	0	0	0	0	0	0	0	0
8772815348	Poland National anthem  Anthem Mazurek Dąbrowskiego	0.0	12	0.0	0	0	0	0	0	0	0	0	0	0	0	0
8772815348	Poland Festivals with this focus Polish Film Festival in America	0.16666666666666666	12	0.37267799625	0	1	0	0	0	0	0	1	0	0	0	0
8772815348	Poland Capital Warsaw	0.3076923076923077	13	0.461538461538	0	1	0	0	0	1	0	1	0	0	0	1	0
8772815348	Poland Force Deployments  Military Conflict War in Afghanistan (2001–present)	0.16666666666666666	12	0.37267799625	0	0	0	0	0	1	0	0	0	0	0	1
8772815348	Poland Things named after this Polonium	0.0	4	0.0	0	0	0	0
8772815348	Poland Partially contained by North European Plain	0.0	6	0.0	0	0	0	0	0	0
8772815348	Poland Partially contained by  Partially contained by North European Plain	0.0	6	0.0	0	0	0	0	0	0
8772815348	Poland Internet TLD pl	0.0	12	0.0	0	0	0	0	0	0	0	0	0	0	0	0
8772815348	Poland GDP (nominal per capita)  Currency United States Dollar	0.8333333333333334	12	0.687184270936	0	1	1	0	1	2	0	1	1	0	1	2
8772815348	Poland Official Language Polish Language	1.1666666666666667	12	0.897527467856	1	2	0	2	0	2	1	2	0	2	0	2
8772815348	Poland Athletes  Sports Figure skating	0.4	20	0.663324958071	0	2	0	0	0	0	0	0	1	1	0	2	0	0	0	0	0	0	1	1
8772815348	Poland Form of Government Democracy	1.0	6	0.816496580928	1	2	0	1	2	0
8772815348	Poland Religions  Religion Catholicism	1.6666666666666667	6	0.471404520791	1	2	2	1	2	2
8772815348	Poland Government positions Marshal of the Sejm	0.4	10	0.8	0	2	0	0	0	0	2	0	0	0
8772815348	Poland Government bodies National Assembly	0.8	10	0.748331477355	0	2	0	1	1	0	2	0	1	1
9078665448	Russia Belongs To Combatant Group Allies of World War II	0.06666666666666667	30	0.249443825785	0	0	1	0	0	0	0	0	0	0	0	0	0	0	0	0	0	1	0	0	0	0	0	0	0	0	0	0	0	0
9078665448	Russia Coat of Arms used  Coat of Arms Coat of arms of Russia	0.0	24	0.0	0	0	0	0	0	0	0	0	0	0	0	0	0	0	0	0	0	0	0	0	0	0	0	0
9078665448	Russia Contains major portion of Karelia	2.8333333333333335	24	0.552770798393	3	3	3	3	3	1	3	3	3	3	3	3	3	3	3	3	3	1	3	3	3	3	3	3
9078665448	Russia Multi-event tournaments participated in 2012 World Mountain Running Championships	0.0	30	0.0	0	0	0	0	0	0	0	0	0	0	0	0	0	0	0	0	0	0	0	0	0	0	0	0	0	0	0	0	0	0
9078665448	Russia Athlete Olimpiada Ivanova	0.0	14	0.0	0	0	0	0	0	0	0	0	0	0	0	0	0	0
9078665448	Russia Subject of TelecomConsulting	0.0	14	0.0	0	0	0	0	0	0	0	0	0	0	0	0	0	0
9078665448	Russia Partially contained by Europe	2.6666666666666665	6	0.471404520791	3	2	3	3	2	3
9078665448	Russia Partially contained by  Partially contained by Europe	2.6666666666666665	6	0.471404520791	3	2	3	3	2	3
9078665448	Russia Currency Used Russian ruble	0.4166666666666667	24	0.953793595188	0	0	0	0	0	0	2	0	0	0	0	3	0	0	0	0	0	0	2	0	0	0	0	3
9078665448	Russia Force Deployments  Resource Infantry	0.25	24	0.829156197589	0	0	0	0	0	0	0	0	0	0	0	3	0	0	0	0	0	0	0	0	0	0	0	3
9078665448	Russia Casualties  Military Conflict Battle of Kulikovo	0.08333333333333333	24	0.276385399196	0	0	1	0	0	0	0	0	0	0	0	0	0	0	1	0	0	0	0	0	0	0	0	0
9078665448	Russia Flag  Flag Flag of Russia	0.4166666666666667	24	0.953793595188	0	0	0	0	0	0	2	0	0	0	0	3	0	0	0	0	0	0	2	0	0	0	0	3
9078665448	Russia Capital Moscow	2.25	24	0.721687836487	2	3	2	1	3	2	3	1	3	2	2	3	2	3	2	1	3	2	3	1	3	2	2	3
9078665448	Russia Internet TLD ru	0.09090909090909091	22	0.287479787288	0	0	1	0	0	0	0	0	0	0	0	0	0	1	0	0	0	0	0	0	0	0
9078665448	Russia National anthem  Anthem National Anthem of Russia	0.3333333333333333	24	0.7453559925	0	0	0	0	0	0	2	0	0	0	0	2	0	0	0	0	0	0	2	0	0	0	0	2
9078665448	Russia GDP (nominal per capita)  Currency United States Dollar	0.16666666666666666	24	0.552770798393	0	0	0	0	0	0	0	0	0	0	0	2	0	0	0	0	0	0	0	0	0	0	0	2
9078665448	Russia Places exported to  Exported to Uzbekistan	0.75	24	0.829156197589	0	0	1	0	1	1	2	0	0	2	0	2	0	0	1	0	1	1	2	0	0	2	0	2
9078665448	Russia Places imported from  Imported from Uzbekistan	0.75	24	0.829156197589	0	0	1	0	1	1	2	0	0	2	0	2	0	0	1	0	1	1	2	0	0	2	0	2
9078665448	Russia Official Language Russian Language	0.75	24	1.08972473589	0	0	2	0	0	0	2	0	2	0	0	3	0	0	2	0	0	0	2	0	2	0	0	3
9078665448	Russia Athletes  Competitor Russia national football team	0.0	24	0.0	0	0	0	0	0	0	0	0	0	0	0	0	0	0	0	0	0	0	0	0	0	0	0	0
538284665548	Salesforce.com Cash  Currency United States Dollar	0.4186046511627907	86	0.618796962588	0	2	0	0	0	1	1	0	0	0	2	0	0	2	0	0	0	1	0	1	0	1	1	0	1	0	1	1	0	0	0	0	0	0	1	0	1	0	0	0	0	0	1	0	2	0	0	0	1	1	0	0	0	2	0	0	2	0	0	0	1	0	1	0	1	1	0	1	0	1	1	0	0	0	0	0	0	1	0	1	0	0	0	0	0	1
538284665548	Salesforce.com Retained Earnings  Currency United States Dollar	0.4186046511627907	86	0.618796962588	0	2	0	0	0	1	1	0	0	0	2	0	0	2	0	0	0	1	1	0	0	1	1	0	1	0	1	1	0	0	0	0	0	0	1	0	1	0	0	0	0	0	1	0	2	0	0	0	1	1	0	0	0	2	0	0	2	0	0	0	1	1	0	0	1	1	0	1	0	1	1	0	0	0	0	0	0	1	0	1	0	0	0	0	0	1
538284665548	Salesforce.com Current Liabilities  Currency United States Dollar	0.425531914893617	94	0.610011539865	0	2	0	0	0	1	1	0	1	0	0	0	0	0	1	0	0	2	0	0	0	1	0	0	0	1	1	0	1	0	1	1	1	0	2	0	0	0	1	0	1	0	0	0	0	0	1	0	2	0	0	0	1	1	0	1	0	0	0	0	0	1	0	0	2	0	0	0	1	0	0	0	1	1	0	1	0	1	1	1	0	2	0	0	0	1	0	1	0	0	0	0	0	1
538284665548	Salesforce.com Current Assets  Currency United States Dollar	0.40425531914893614	94	0.607035856072	0	2	0	0	0	1	1	0	1	0	0	0	0	0	2	0	0	2	0	0	0	1	0	0	0	1	1	0	1	0	1	1	0	0	1	0	0	0	1	0	1	0	0	0	0	0	1	0	2	0	0	0	1	1	0	1	0	0	0	0	0	2	0	0	2	0	0	0	1	0	0	0	1	1	0	1	0	1	1	0	0	1	0	0	0	1	0	1	0	0	0	0	0	1
538284665548	Salesforce.com Total Liabilities  Currency United States Dollar	0.40425531914893614	94	0.607035856072	0	2	0	0	0	1	1	0	1	0	0	0	0	0	2	0	0	2	0	0	0	1	0	0	0	1	1	0	1	0	1	1	0	0	1	0	0	0	1	0	1	0	0	0	0	0	1	0	2	0	0	0	1	1	0	1	0	0	0	0	0	2	0	0	2	0	0	0	1	0	0	0	1	1	0	1	0	1	1	0	0	1	0	0	0	1	0	1	0	0	0	0	0	1
538284665548	Salesforce.com Total Assets  Currency United States Dollar	0.3404255319148936	94	0.556455184282	0	2	0	0	0	1	1	0	1	0	0	0	0	0	0	0	0	2	0	0	0	1	0	1	0	1	1	0	1	0	1	0	0	0	0	0	0	0	1	1	0	0	0	0	0	0	1	0	2	0	0	0	1	1	0	1	0	0	0	0	0	0	0	0	2	0	0	0	1	0	1	0	1	1	0	1	0	1	0	0	0	0	0	0	0	1	1	0	0	0	0	0	0	1
538284665548	Salesforce.com Venture Investors  Investor Globespan Capital Partners	0.5263157894736842	95	0.844076639862	0	0	0	0	0	2	0	0	2	0	1	2	0	0	0	0	0	2	0	0	0	0	1	0	2	2	0	0	1	0	2	0	0	0	1	0	0	2	1	1	3	0	0	0	0	0	0	0	0	0	0	0	2	0	0	2	0	1	2	0	0	0	0	0	2	0	0	0	0	1	0	2	2	0	0	1	0	2	0	0	0	1	0	0	2	1	1	3	0	0	0	0	0	0	0
538284665548	Salesforce.com Place founded California	1.6631578947368422	95	1.0916961821	0	0	2	2	2	3	2	0	3	0	2	1	1	3	3	0	2	2	3	2	0	2	2	3	2	3	2	2	2	0	1	3	1	1	0	2	0	3	3	2	0	3	0	3	1	2	2	0	0	2	2	2	3	2	0	3	0	2	1	1	3	3	0	2	2	3	2	0	2	2	3	2	3	2	2	2	0	1	3	1	1	0	2	0	3	3	2	0	3	0	3	1	2	2	2
538284665548	Salesforce.com Issue SALESFORCE.COM INC Common Stock	0.1411764705882353	85	0.410249312333	0	0	0	0	0	0	0	0	1	0	1	0	2	0	0	0	0	0	0	0	0	0	0	0	0	1	0	0	0	1	0	0	0	0	0	0	0	0	0	0	0	0	0	0	0	0	0	0	0	0	1	0	1	0	2	0	0	0	0	0	0	0	0	0	0	0	0	1	0	0	0	1	0	0	0	0	0	0	0	0	0	0	0	0	0
538284665548	Salesforce.com Operating Income  Currency United States Dollar	0.42105263157894735	95	0.704555811818	0	2	0	0	0	1	1	0	1	0	0	0	0	0	2	0	0	2	3	0	0	1	0	0	0	1	1	0	1	0	1	0	0	0	0	0	0	0	1	0	0	1	0	0	0	0	1	0	2	0	0	0	1	1	0	1	0	0	0	0	0	2	0	0	2	3	0	0	1	0	0	0	1	1	0	1	0	1	0	0	0	0	0	0	0	1	0	0	1	0	0	0	0	1	0
538284665548	Salesforce.com Net profit  Currency United States Dollar	0.3617021276595745	94	0.598776479977	0	2	0	0	0	1	1	0	1	0	0	0	0	0	2	0	0	2	0	0	0	1	0	0	0	1	1	0	1	0	1	0	0	0	0	0	0	0	1	0	1	0	0	0	0	0	1	0	2	0	0	0	1	1	0	1	0	0	0	0	0	2	0	0	2	0	0	0	1	0	0	0	1	1	0	1	0	1	0	0	0	0	0	0	0	1	0	1	0	0	0	0	0	1
538284665548	Salesforce.com Founders Marc Benioff	0.18947368421052632	95	0.442355818725	0	0	0	0	0	1	0	0	0	0	1	1	0	0	0	0	0	2	1	0	0	0	0	0	0	0	0	0	0	0	1	0	1	0	0	0	0	1	0	0	0	0	0	0	0	0	0	0	0	0	0	0	1	0	0	0	0	1	1	0	0	0	0	0	2	1	0	0	0	0	0	0	0	0	0	0	0	1	0	1	0	0	0	0	1	0	0	0	0	0	0	0	0	0	0
538284665548	Salesforce.com Headquarters  State/Province/Region California	2.3636363636363638	22	1.14991914915	0	3	3	3	3	3	2	3	3	0	3	0	3	3	3	3	3	2	3	3	0	3
538284665548	Salesforce.com Revenue  Currency United States Dollar	0.3404255319148936	94	0.593460667276	0	2	0	0	0	1	1	0	1	0	0	0	0	0	2	0	0	2	0	0	0	1	0	0	0	1	1	0	1	0	1	0	0	0	0	0	0	0	1	0	0	0	0	0	0	0	1	0	2	0	0	0	1	1	0	1	0	0	0	0	0	2	0	0	2	0	0	0	1	0	0	0	1	1	0	1	0	1	0	0	0	0	0	0	0	1	0	0	0	0	0	0	0	1
538284665548	Salesforce.com Appears in ranked lists  List Fortune 100 Best Companies to Work For	0.2553191489361702	94	0.482373789309	0	0	0	0	0	1	0	0	0	0	1	1	0	0	0	0	0	2	0	0	0	0	0	0	1	0	0	0	0	0	1	0	0	1	1	0	0	1	0	1	1	0	0	0	0	0	0	0	0	0	0	0	1	0	0	0	0	1	1	0	0	0	0	0	2	0	0	0	0	0	0	1	0	0	0	0	0	1	0	0	1	1	0	0	1	0	1	1	0	0	0	0	0	0
538284665548	Salesforce.com Industry Software	0.14736842105263157	95	0.458106424147	0	0	0	0	0	0	0	0	0	0	0	0	0	0	0	0	0	2	2	0	0	0	0	0	1	0	0	0	0	0	1	0	0	0	0	0	0	1	0	0	0	0	0	0	0	0	0	0	0	0	0	0	0	0	0	0	0	0	0	0	0	0	0	0	2	2	0	0	0	0	0	1	0	0	0	0	0	1	0	0	0	0	0	0	1	0	0	0	0	0	0	0	0	0	0
538284665548	Salesforce.com Leadership  Person Marc Benioff	0.1276595744680851	94	0.392321040736	0	0	0	0	0	0	0	0	0	0	0	1	0	0	0	0	0	2	1	0	0	0	0	0	0	0	0	0	0	0	1	0	0	0	0	0	0	1	0	0	0	0	0	0	0	0	0	0	0	0	0	0	0	0	0	0	0	0	1	0	0	0	0	0	2	1	0	0	0	0	0	0	0	0	0	0	0	1	0	0	0	0	0	0	1	0	0	0	0	0	0	0	0	0
538284665548	Salesforce.com Websites Owned Data.com	0.5473684210526316	95	0.764590307256	0	0	0	0	0	2	0	2	1	0	0	2	0	0	0	1	2	2	2	0	0	1	1	0	1	1	0	2	0	1	1	0	0	0	2	0	0	1	0	0	1	0	0	0	0	0	0	0	0	0	0	0	2	0	2	1	0	0	2	0	0	0	1	2	2	2	0	0	1	1	0	1	1	0	2	0	1	1	0	0	0	2	0	0	1	0	0	1	0	0	0	0	0	0	0
538284665548	Salesforce.com Organizations acquired  Organization acquired Buddy Media	0.425531914893617	94	0.736428438293	0	0	0	0	0	2	0	0	1	0	0	1	0	0	0	0	0	2	2	0	0	1	1	0	1	0	0	1	0	0	1	0	0	0	1	0	0	0	0	1	3	0	0	2	0	0	0	0	0	0	0	0	2	0	0	1	0	0	1	0	0	0	0	0	2	2	0	0	1	1	0	1	0	0	1	0	0	1	0	0	0	1	0	0	0	0	1	3	0	0	2	0	0	0
538284665548	Salesforce.com Board members  Person Marc Benioff	0.19148936170212766	94	0.531489191353	0	0	0	0	0	0	0	0	0	0	2	2	0	0	0	0	0	2	1	0	0	0	0	0	0	0	0	0	0	0	1	0	0	0	0	0	0	1	0	0	0	0	0	0	0	0	0	0	0	0	0	0	0	0	0	0	0	2	2	0	0	0	0	0	2	1	0	0	0	0	0	0	0	0	0	0	0	1	0	0	0	0	0	0	1	0	0	0	0	0	0	0	0	0
546675674948	Boris Becker Sexual orientation  Sexual orientation Heterosexuality	0.0	108	0.0	0	0	0	0	0	0	0	0	0	0	0	0	0	0	0	0	0	0	0	0	0	0	0	0	0	0	0	0	0	0	0	0	0	0	0	0	0	0	0	0	0	0	0	0	0	0	0	0	0	0	0	0	0	0	0	0	0	0	0	0	0	0	0	0	0	0	0	0	0	0	0	0	0	0	0	0	0	0	0	0	0	0	0	0	0	0	0	0	0	0	0	0	0	0	0	0	0	0	0	0	0	0	0	0	0	0	0	0
546675674948	Boris Becker Hall of fame inductions  Hall of fame International Tennis Hall of Fame	2.2280701754385963	114	0.675837202956	2	2	3	2	2	2	3	1	2	2	2	3	2	2	2	2	2	3	2	2	2	2	2	3	2	3	2	2	2	2	2	3	3	3	0	3	3	3	3	3	2	2	2	3	2	3	2	1	2	2	2	3	2	0	2	3	3	2	2	3	2	2	2	3	1	2	2	2	3	2	2	2	2	2	3	2	2	2	2	2	3	2	3	2	2	2	2	2	3	3	3	0	3	3	3	3	3	2	2	2	3	2	3	2	1	2	2	2	3	2	0	2	3	3
546675674948	Boris Becker Leader of  Role Owner	0.24561403508771928	114	0.469441689834	0	0	0	0	0	0	0	0	0	1	0	0	1	0	0	1	1	0	0	0	0	0	0	0	0	0	1	0	0	1	0	0	0	0	0	0	1	1	0	1	0	0	0	2	0	1	0	0	0	0	1	1	0	0	0	0	0	0	0	0	0	0	0	0	0	0	1	0	0	1	0	0	1	1	0	0	0	0	0	0	0	0	0	1	0	0	1	0	0	0	0	0	0	1	1	0	1	0	0	0	2	0	1	0	0	0	0	1	1	0	0	0	0	0
546675674948	Boris Becker Romantic relationships (with celebrities)  Celebrity Sandy Meyer-Wölden	0.0	114	0.0	0	0	0	0	0	0	0	0	0	0	0	0	0	0	0	0	0	0	0	0	0	0	0	0	0	0	0	0	0	0	0	0	0	0	0	0	0	0	0	0	0	0	0	0	0	0	0	0	0	0	0	0	0	0	0	0	0	0	0	0	0	0	0	0	0	0	0	0	0	0	0	0	0	0	0	0	0	0	0	0	0	0	0	0	0	0	0	0	0	0	0	0	0	0	0	0	0	0	0	0	0	0	0	0	0	0	0	0	0	0	0	0	0	0
546675674948	Boris Becker TV regular appearances  Program Piers Morgan's Life Stories	0.017543859649122806	114	0.131286224097	0	0	0	0	0	0	0	0	0	0	0	0	0	0	0	0	0	0	0	0	0	0	0	0	0	0	0	0	0	0	0	0	0	0	0	0	0	0	0	0	0	0	0	0	0	0	0	0	0	1	0	0	0	0	0	0	0	0	0	0	0	0	0	0	0	0	0	0	0	0	0	0	0	0	0	0	0	0	0	0	0	0	0	0	0	0	0	0	0	0	0	0	0	0	0	0	0	0	0	0	0	0	0	0	0	0	1	0	0	0	0	0	0	0
546675674948	Boris Becker Matches Lost  Event Wimbledon	2.4695652173913043	115	0.794784511462	3	3	2	3	3	3	3	3	0	1	1	3	3	2	2	3	2	3	3	2	2	3	1	3	1	2	3	3	3	3	2	3	3	3	3	3	3	3	3	3	3	3	2	0	3	3	3	3	2	3	2	2	2	1	2	3	3	3	3	2	3	3	3	3	3	0	1	1	3	3	2	2	3	2	3	3	2	2	3	1	3	1	2	3	3	3	3	2	3	3	3	3	3	3	3	3	3	3	3	2	0	3	3	3	3	2	3	2	2	2	1	2	3	3	2
546675674948	Boris Becker Starring TV roles  Series They Think It's All Over	0.0	114	0.0	0	0	0	0	0	0	0	0	0	0	0	0	0	0	0	0	0	0	0	0	0	0	0	0	0	0	0	0	0	0	0	0	0	0	0	0	0	0	0	0	0	0	0	0	0	0	0	0	0	0	0	0	0	0	0	0	0	0	0	0	0	0	0	0	0	0	0	0	0	0	0	0	0	0	0	0	0	0	0	0	0	0	0	0	0	0	0	0	0	0	0	0	0	0	0	0	0	0	0	0	0	0	0	0	0	0	0	0	0	0	0	0	0	0
546675674948	Boris Becker Sports played  Sport Tennis	2.508771929824561	114	0.678564196695	3	3	2	3	3	3	3	3	1	3	2	3	2	3	3	3	3	3	3	3	2	1	2	3	2	3	3	3	3	1	3	3	3	3	3	2	3	3	3	2	2	2	3	3	3	2	2	1	2	2	3	3	1	2	2	3	1	3	3	2	3	3	3	3	3	1	3	2	3	2	3	3	3	3	3	3	3	2	1	2	3	2	3	3	3	3	1	3	3	3	3	3	2	3	3	3	2	2	2	3	3	3	2	2	1	2	2	3	3	1	2	2	3	1
546675674948	Boris Becker Spouse (or domestic partner)  Type of union Marriage	0.0	114	0.0	0	0	0	0	0	0	0	0	0	0	0	0	0	0	0	0	0	0	0	0	0	0	0	0	0	0	0	0	0	0	0	0	0	0	0	0	0	0	0	0	0	0	0	0	0	0	0	0	0	0	0	0	0	0	0	0	0	0	0	0	0	0	0	0	0	0	0	0	0	0	0	0	0	0	0	0	0	0	0	0	0	0	0	0	0	0	0	0	0	0	0	0	0	0	0	0	0	0	0	0	0	0	0	0	0	0	0	0	0	0	0	0	0	0
546675674948	Boris Becker Children Amadeus Benedict Edley Luis Becker	0.0	115	0.0	0	0	0	0	0	0	0	0	0	0	0	0	0	0	0	0	0	0	0	0	0	0	0	0	0	0	0	0	0	0	0	0	0	0	0	0	0	0	0	0	0	0	0	0	0	0	0	0	0	0	0	0	0	0	0	0	0	0	0	0	0	0	0	0	0	0	0	0	0	0	0	0	0	0	0	0	0	0	0	0	0	0	0	0	0	0	0	0	0	0	0	0	0	0	0	0	0	0	0	0	0	0	0	0	0	0	0	0	0	0	0	0	0	0	0
546675674948	Boris Becker Parents Karl-Heinz	0.0	115	0.0	0	0	0	0	0	0	0	0	0	0	0	0	0	0	0	0	0	0	0	0	0	0	0	0	0	0	0	0	0	0	0	0	0	0	0	0	0	0	0	0	0	0	0	0	0	0	0	0	0	0	0	0	0	0	0	0	0	0	0	0	0	0	0	0	0	0	0	0	0	0	0	0	0	0	0	0	0	0	0	0	0	0	0	0	0	0	0	0	0	0	0	0	0	0	0	0	0	0	0	0	0	0	0	0	0	0	0	0	0	0	0	0	0	0	0
546675674948	Boris Becker Places lived  Location London	0.0	114	0.0	0	0	0	0	0	0	0	0	0	0	0	0	0	0	0	0	0	0	0	0	0	0	0	0	0	0	0	0	0	0	0	0	0	0	0	0	0	0	0	0	0	0	0	0	0	0	0	0	0	0	0	0	0	0	0	0	0	0	0	0	0	0	0	0	0	0	0	0	0	0	0	0	0	0	0	0	0	0	0	0	0	0	0	0	0	0	0	0	0	0	0	0	0	0	0	0	0	0	0	0	0	0	0	0	0	0	0	0	0	0	0	0	0	0
546675674948	Boris Becker Country of nationality Germany	0.06956521739130435	115	0.315449689517	0	0	0	0	1	0	0	0	0	0	0	0	0	0	0	0	0	0	1	0	0	0	0	0	0	0	0	0	0	0	0	0	0	0	0	0	0	0	0	0	0	0	0	0	2	0	0	0	0	0	0	0	0	0	0	0	0	0	0	0	0	1	0	0	0	0	0	0	0	0	0	0	0	0	0	1	0	0	0	0	0	0	0	0	0	0	0	0	0	0	0	0	0	0	0	0	0	0	0	0	0	2	0	0	0	0	0	0	0	0	0	0	0	0	0
546675674948	Boris Becker Place of birth Leimen	0.0	107	0.0	0	0	0	0	0	0	0	0	0	0	0	0	0	0	0	0	0	0	0	0	0	0	0	0	0	0	0	0	0	0	0	0	0	0	0	0	0	0	0	0	0	0	0	0	0	0	0	0	0	0	0	0	0	0	0	0	0	0	0	0	0	0	0	0	0	0	0	0	0	0	0	0	0	0	0	0	0	0	0	0	0	0	0	0	0	0	0	0	0	0	0	0	0	0	0	0	0	0	0	0	0	0	0	0	0	0	0
546675674948	Boris Becker Tennis Titles  Tournament The US Open (Tennis)	2.8596491228070176	114	0.436838582386	3	3	3	2	3	3	3	3	3	3	1	3	3	3	3	3	2	3	3	2	3	3	3	3	1	3	3	3	3	3	3	3	3	3	3	3	3	3	3	3	3	3	3	3	3	3	3	3	3	3	3	3	3	2	3	3	3	3	3	3	2	3	3	3	3	3	3	1	3	3	3	3	3	2	3	3	2	3	3	3	3	1	3	3	3	3	3	3	3	3	3	3	3	3	3	3	3	3	3	3	3	3	3	3	3	3	3	3	3	3	2	3	3	3
546675674948	Boris Becker Gender Male	0.0	115	0.0	0	0	0	0	0	0	0	0	0	0	0	0	0	0	0	0	0	0	0	0	0	0	0	0	0	0	0	0	0	0	0	0	0	0	0	0	0	0	0	0	0	0	0	0	0	0	0	0	0	0	0	0	0	0	0	0	0	0	0	0	0	0	0	0	0	0	0	0	0	0	0	0	0	0	0	0	0	0	0	0	0	0	0	0	0	0	0	0	0	0	0	0	0	0	0	0	0	0	0	0	0	0	0	0	0	0	0	0	0	0	0	0	0	0	0
546675674948	Boris Becker Profession Businessperson	0.1391304347826087	115	0.435130295763	0	0	0	0	0	0	0	0	0	0	0	0	0	0	0	0	0	0	0	0	0	0	0	0	0	0	0	2	0	0	0	0	0	0	1	0	1	0	0	0	0	0	0	0	1	1	0	0	0	0	0	2	0	0	0	0	0	0	0	0	0	0	0	0	0	0	0	0	0	0	0	0	0	0	0	0	0	0	0	0	0	0	0	0	2	0	0	0	0	0	0	1	0	1	0	0	0	0	0	0	0	1	1	0	0	0	0	0	2	0	0	0	0	0	0
546675674948	Boris Becker Works written The player	0.41904761904761906	105	0.7142222194	0	1	0	2	0	0	0	0	0	2	0	0	0	1	1	0	0	0	0	1	2	1	2	0	0	0	0	0	0	0	0	2	1	0	0	0	0	1	2	0	2	0	0	0	0	0	1	0	0	0	0	0	0	1	0	2	0	0	0	0	0	2	0	0	0	1	1	0	0	0	0	1	2	1	2	0	0	0	0	0	0	0	0	2	1	0	0	0	0	1	2	0	2	0	0	0	0	0	1	0	0	0	0	0	0
546675674948	Boris Becker Film performances  Film Coach: Nick Bollettieri	0.017543859649122806	114	0.131286224097	0	0	0	0	0	0	0	0	0	0	0	0	0	0	0	0	0	0	0	0	0	0	0	0	0	0	0	0	0	0	0	0	0	0	0	0	0	0	0	0	0	0	0	0	0	1	0	0	0	0	0	0	0	0	0	0	0	0	0	0	0	0	0	0	0	0	0	0	0	0	0	0	0	0	0	0	0	0	0	0	0	0	0	0	0	0	0	0	0	0	0	0	0	0	0	0	0	0	0	0	0	0	1	0	0	0	0	0	0	0	0	0	0	0
546675674948	Boris Becker Awards Won  Award category BBC Overseas Sports Personality of the Year	2.1228070175438596	114	0.879995523087	2	2	3	3	3	3	3	3	1	2	1	3	2	3	2	3	2	3	3	2	2	0	1	2	1	3	2	3	2	2	2	3	2	2	0	2	3	2	0	2	3	2	2	3	3	3	3	1	2	1	2	2	2	0	3	3	1	2	2	3	3	3	3	3	3	1	2	1	3	2	3	2	3	2	3	3	2	2	0	1	2	1	3	2	3	2	2	2	3	2	2	0	2	3	2	0	2	3	2	2	3	3	3	3	1	2	1	2	2	2	0	3	3	1
706888504948	Shaquille O'Neal Celebrity rivals  Rival Kobe Bryant	1.3846153846153846	26	1.00295421619	2	2	1	0	2	2	3	0	0	2	0	2	2	2	2	1	0	2	2	3	0	0	2	0	2	2
706888504948	Shaquille O'Neal Drafted  School/Institution Louisiana State University	1.1538461538461537	26	1.16659622216	2	2	3	0	2	1	0	0	0	3	0	0	2	2	2	3	0	2	1	0	0	0	3	0	0	2
706888504948	Shaquille O'Neal Events Competed In  Medal Gold medal	1.3076923076923077	26	1.13575562002	2	0	2	0	2	1	3	0	0	2	0	3	2	2	0	2	0	2	1	3	0	0	2	0	3	2
706888504948	Shaquille O'Neal TV programs Created Love Shaq	0.5384615384615384	26	0.842650088469	2	0	2	0	1	0	0	0	0	2	0	0	0	2	0	2	0	1	0	0	0	0	2	0	0	0
706888504948	Shaquille O'Neal Position(s) Center	1.9230769230769231	26	1.07141448286	2	2	3	2	3	1	3	0	0	3	1	3	2	2	2	3	2	3	1	3	0	0	3	1	3	2
706888504948	Shaquille O'Neal Country  Sport Basketball	1.5384615384615385	26	0.929465074892	2	2	3	2	1	1	1	0	0	3	1	2	2	2	2	3	2	1	1	1	0	0	3	1	2	2
706888504948	Shaquille O'Neal TV programs produced  Program Shaq Vs.	0.46153846153846156	26	0.842650088469	2	0	2	0	0	0	0	0	0	2	0	0	0	2	0	2	0	0	0	0	0	0	2	0	0	0
706888504948	Shaquille O'Neal Things named after this Shaq Fu	0.46153846153846156	26	0.842650088469	2	0	2	0	0	0	0	0	0	2	0	0	0	2	0	2	0	0	0	0	0	0	2	0	0	0
706888504948	Shaquille O'Neal Religion Islam	0.6666666666666666	18	0.942809041582	2	0	2	0	2	0	0	0	0	2	0	2	0	2	0	0	0	0
706888504948	Shaquille O'Neal TV regular appearances  Appearance type Him/Herself	0.46153846153846156	26	0.842650088469	2	0	2	0	0	0	0	0	0	2	0	0	0	2	0	2	0	0	0	0	0	0	2	0	0	0
706888504948	Shaquille O'Neal Awards  Team Los Angeles Lakers	1.7142857142857142	14	1.16057691495	2	2	0	3	0	3	2	2	2	0	3	0	3	2
706888504948	Shaquille O'Neal Quotations It's just something to have on my resume for when I go back into reality. Someday I might have to put down a basketball and have a regular 9-to-5 like everybody else.	0.6666666666666666	18	0.816496580928	1	0	2	1	2	0	0	0	0	1	0	2	1	2	0	0	0	0
706888504948	Shaquille O'Neal Ethnicity African American	0.7142857142857143	28	0.880630571853	2	0	2	0	2	0	0	0	0	2	1	1	0	0	2	0	2	0	2	0	0	0	0	2	1	1	0	0
706888504948	Shaquille O'Neal Sports played  Sport Basketball	1.875	16	1.16592238164	2	2	3	2	3	0	3	0	2	2	3	2	3	0	3	0
706888504948	Shaquille O'Neal Starring TV roles  Series NBA on TNT	0.6666666666666666	12	0.942809041582	2	0	0	2	0	0	2	0	0	2	0	0
706888504948	Shaquille O'Neal Player Statistics  Team Los Angeles Lakers	1.8666666666666667	15	0.95684667296	2	2	0	3	1	3	2	2	2	0	3	1	3	2	2
706888504948	Shaquille O'Neal Teams  Team Boston Celtics	2.0	12	1.0	2	2	0	3	2	3	2	2	0	3	2	3
706888504948	Shaquille O'Neal Spouse (or domestic partner)  Type of union Marriage	0.4444444444444444	18	0.831479419283	2	0	2	0	0	0	0	0	0	2	0	2	0	0	0	0	0	0
706888504948	Shaquille O'Neal Parents Lucille O'Neal	0.5	16	0.866025403784	2	0	2	0	0	0	0	0	2	0	2	0	0	0	0	0
706888504948	Shaquille O'Neal Siblings  Sibling Jamal O'Neal	0.5714285714285714	28	0.728431359085	2	0	2	0	1	0	0	0	0	1	1	1	0	0	2	0	2	0	1	0	0	0	0	1	1	1	0	0
57865383535048	Michelle Obama Animals owned  Animal Bo	0.014084507042253521	142	0.117839440357	0	0	0	0	0	0	0	0	0	0	0	0	0	0	0	0	1	0	0	0	0	0	0	0	0	0	0	0	0	0	0	0	0	0	0	0	0	0	0	0	0	0	0	0	0	0	0	0	0	0	0	0	0	0	0	0	0	0	0	0	0	0	0	0	0	0	0	0	0	0	0	0	0	0	0	0	0	0	0	0	0	0	0	0	0	0	0	1	0	0	0	0	0	0	0	0	0	0	0	0	0	0	0	0	0	0	0	0	0	0	0	0	0	0	0	0	0	0	0	0	0	0	0	0	0	0	0	0	0	0	0	0	0	0	0	0	0	0	0	0	0	0
57865383535048	Michelle Obama Family Family of Barack Obama	0.15384615384615385	143	0.431418092733	0	0	0	0	0	0	0	0	0	0	0	0	0	0	1	0	0	0	1	0	0	0	0	0	1	0	0	1	0	0	2	0	0	0	0	1	1	0	0	0	0	0	0	0	0	0	0	0	0	0	0	0	0	0	0	0	0	2	0	1	0	0	0	0	0	0	0	0	0	0	0	0	0	0	0	0	0	0	0	0	0	0	0	0	0	1	0	0	0	1	0	0	0	0	0	1	0	0	1	0	0	2	0	0	0	0	1	1	0	0	0	0	0	0	0	0	0	0	0	0	0	0	0	0	0	0	0	0	2	0	1	0	0	0	0	0	0	0	0	0	0	0	0
57865383535048	Michelle Obama Member of  Organization Alpha Phi Omega	1.4533333333333334	150	0.868613198661	2	0	3	1	2	2	3	0	1	2	2	3	1	1	2	0	0	1	1	1	2	0	1	1	2	1	2	2	1	3	3	2	1	1	1	1	1	2	1	3	1	1	1	0	2	3	1	2	3	1	2	2	2	3	1	2	2	0	2	0	2	1	2	1	1	2	1	1	0	2	2	2	1	0	1	2	0	3	1	2	2	3	0	1	2	2	3	1	1	2	0	0	1	1	1	2	0	1	1	2	1	2	2	1	3	3	2	1	1	1	1	1	2	1	3	1	1	1	0	2	3	1	2	3	1	2	2	2	3	1	2	2	0	2	0	2	1	2	1	1	2	1	1	0	2	2	2	1	0	1
57865383535048	Michelle Obama Party  Party Democratic Party	0.04225352112676056	142	0.261986975179	0	0	0	0	0	0	0	0	0	0	0	0	0	0	0	0	1	0	0	0	0	0	0	0	0	2	0	0	0	0	0	0	0	0	0	0	0	0	0	0	0	0	0	0	0	0	0	0	0	0	0	0	0	0	0	0	0	0	0	0	0	0	0	0	0	0	0	0	0	0	0	0	0	0	0	0	0	0	0	0	0	0	0	0	0	0	0	1	0	0	0	0	0	0	0	0	2	0	0	0	0	0	0	0	0	0	0	0	0	0	0	0	0	0	0	0	0	0	0	0	0	0	0	0	0	0	0	0	0	0	0	0	0	0	0	0	0	0	0	0	0	0
57865383535048	Michelle Obama Appears in ranked lists  List Time 100	0.11267605633802817	142	0.395370953454	0	0	0	0	0	0	0	0	0	0	0	0	0	2	0	0	0	0	0	0	0	0	0	0	0	0	0	0	0	0	0	0	0	0	0	0	0	0	0	0	0	0	0	0	0	0	0	0	0	0	0	0	0	0	1	0	0	1	0	1	0	1	0	0	0	0	2	0	0	0	0	0	0	0	0	0	0	0	0	0	0	0	0	0	2	0	0	0	0	0	0	0	0	0	0	0	0	0	0	0	0	0	0	0	0	0	0	0	0	0	0	0	0	0	0	0	0	0	0	0	0	0	0	0	0	1	0	0	1	0	1	0	1	0	0	0	0	2	0	0	0	0
57865383535048	Michelle Obama Religion Protestantism	0.1986754966887417	151	0.540049881798	0	0	0	0	0	2	0	0	0	1	0	0	0	0	0	0	0	0	0	1	2	1	0	0	0	0	1	0	0	2	0	0	0	0	0	0	0	0	0	0	0	1	0	0	0	0	0	0	2	0	0	0	0	0	0	0	0	0	0	0	0	0	2	0	0	0	0	0	0	0	0	0	0	0	0	0	0	0	0	0	2	0	0	0	1	0	0	0	0	0	0	0	0	0	1	2	1	0	0	0	0	1	0	0	2	0	0	0	0	0	0	0	0	0	0	0	1	0	0	0	0	0	0	2	0	0	0	0	0	0	0	0	0	0	0	0	0	2	0	0	0	0	0	0	0	0	0	0	0	0	0
57865383535048	Michelle Obama Government Positions Held  Basic title First Lady	0.22666666666666666	150	0.623395718803	0	0	0	0	0	0	0	0	1	0	0	0	0	0	0	0	0	0	0	0	3	1	0	0	0	0	0	0	0	3	0	1	0	0	1	0	0	0	0	0	0	0	0	0	0	0	0	0	0	0	0	0	0	1	2	0	0	0	0	0	0	1	0	1	0	2	0	0	0	0	0	0	0	0	0	0	0	0	0	0	0	0	0	1	0	0	0	0	0	0	0	0	0	0	0	3	1	0	0	0	0	0	0	0	3	0	1	0	0	1	0	0	0	0	0	0	0	0	0	0	0	0	0	0	0	0	0	0	1	2	0	0	0	0	0	0	1	0	1	0	2	0	0	0	0	0	0	0	0	0
