5167788848	Charles, Prince of Wales Places lived  Location London	2.1470588235294117	68	1.03276763918	3	3	0	1	0	3	2	3	3	3	2	3	2	2	0	2	2	0	3	0	3	3	2	2	3	3	3	2	3	3	3	2	2	2	3	3	0	1	0	3	2	3	3	3	2	3	2	2	0	2	2	0	3	0	3	3	2	2	3	3	3	2	3	3	3	2	2	2
5167788848	Charles, Prince of Wales Parents Elizabeth II	2.4050632911392404	79	0.893279937437	3	3	3	1	1	3	3	3	3	3	3	3	3	3	1	1	3	3	2	1	3	3	0	3	0	3	3	2	3	3	3	2	2	3	3	2	2	2	3	3	3	3	1	1	3	3	3	3	3	3	3	3	3	1	1	3	3	2	1	3	3	0	3	0	3	3	2	3	3	3	2	2	3	3	2	2	2	3	2
5167788848	Charles, Prince of Wales Siblings  Sibling Anne, Princess Royal	2.4358974358974357	78	0.841088177788	3	3	3	1	1	3	3	3	3	2	3	3	3	3	1	1	3	3	2	1	3	3	1	3	0	3	3	2	2	3	3	3	3	3	3	2	2	2	3	3	3	3	1	1	3	3	3	3	2	3	3	3	3	1	1	3	3	2	1	3	3	1	3	0	3	3	2	2	3	3	3	3	3	3	2	2	2	3
5167788848	Charles, Prince of Wales Education  Institution University of Cambridge	2.0833333333333335	24	1.03749163317	3	3	3	2	0	2	2	3	2	3	2	0	3	3	3	2	0	2	2	3	2	3	2	0
5167788848	Charles, Prince of Wales Children Prince Harry	2.5063291139240507	79	0.744148782618	3	3	3	1	2	3	3	3	3	2	3	3	3	3	1	2	3	3	2	2	3	3	1	3	0	3	3	2	3	3	3	2	3	3	3	2	2	2	3	3	3	3	1	2	3	3	3	3	2	3	3	3	3	1	2	3	3	2	2	3	3	1	3	0	3	3	2	3	3	3	2	3	3	3	2	2	2	3	2
5167788848	Charles, Prince of Wales Country of nationality United Kingdom	2.272727272727273	22	0.962091385842	3	3	3	1	0	3	2	2	3	3	2	3	3	3	1	0	3	2	2	3	3	2
518753486848	China Titles  Title Emperor of China	0.0	18	0.0	0	0	0	0	0	0	0	0	0	0	0	0	0	0	0	0	0	0
518753486848	China Contains major portion of Gaotou Township	0.2727272727272727	22	0.445361771415	0	0	1	1	0	1	0	0	0	0	0	0	0	1	1	0	1	0	0	0	0	0
518753486848	China Coterminous with  Location Taiwan	0.1111111111111111	18	0.314269680527	0	0	1	0	0	0	0	0	0	0	0	1	0	0	0	0	0	0
518753486848	China Belongs To Combatant Group Triple Entente	0.0	28	0.0	0	0	0	0	0	0	0	0	0	0	0	0	0	0	0	0	0	0	0	0	0	0	0	0	0	0	0	0
518753486848	China Exhibitions created about this subject China Design Now	0.0	18	0.0	0	0	0	0	0	0	0	0	0	0	0	0	0	0	0	0	0	0
518753486848	China TV shows filmed here The Bride with White Hair	0.0	22	0.0	0	0	0	0	0	0	0	0	0	0	0	0	0	0	0	0	0	0	0	0	0	0
518753486848	China Government Government of China	0.0	22	0.0	0	0	0	0	0	0	0	0	0	0	0	0	0	0	0	0	0	0	0	0	0	0
518753486848	China Subject of Great Wall of China	0.0	18	0.0	0	0	0	0	0	0	0	0	0	0	0	0	0	0	0	0	0	0
518753486848	China Periodicals Modern China	0.0	8	0.0	0	0	0	0	0	0	0	0
518753486848	China Currency Formerly Used Huizi	0.0	22	0.0	0	0	0	0	0	0	0	0	0	0	0	0	0	0	0	0	0	0	0	0	0	0
518753486848	China Films On This Subject Mao's Last Dancer	0.0	9	0.0	0	0	0	0	0	0	0	0	0
518753486848	China Currency Used Renminbi	0.0	22	0.0	0	0	0	0	0	0	0	0	0	0	0	0	0	0	0	0	0	0	0	0	0	0
518753486848	China Casualties  Military Conflict Vietnam War	0.0	22	0.0	0	0	0	0	0	0	0	0	0	0	0	0	0	0	0	0	0	0	0	0	0	0
518753486848	China Force Deployments  Combatant Soviet Union	0.0	22	0.0	0	0	0	0	0	0	0	0	0	0	0	0	0	0	0	0	0	0	0	0	0	0
518753486848	China Capital Beijing	0.0	22	0.0	0	0	0	0	0	0	0	0	0	0	0	0	0	0	0	0	0	0	0	0	0	0
518753486848	China Flag  Flag Flag of China	0.0	22	0.0	0	0	0	0	0	0	0	0	0	0	0	0	0	0	0	0	0	0	0	0	0	0
518753486848	China Places exported to  Currency United States Dollar	0.0	18	0.0	0	0	0	0	0	0	0	0	0	0	0	0	0	0	0	0	0	0
518753486848	China GDP (nominal per capita)  Currency United States Dollar	0.0	22	0.0	0	0	0	0	0	0	0	0	0	0	0	0	0	0	0	0	0	0	0	0	0	0
518753486848	China Internet TLD mo	0.0	12	0.0	0	0	0	0	0	0	0	0	0	0	0	0
518753486848	China National anthem  Anthem March of the Volunteers	0.0	22	0.0	0	0	0	0	0	0	0	0	0	0	0	0	0	0	0	0	0	0	0	0	0	0
5153485448	Diana, Princess of Wales Celebrity rivals  Rival Camilla, Duchess of Cornwall	0.0	36	0.0	0	0	0	0	0	0	0	0	0	0	0	0	0	0	0	0	0	0	0	0	0	0	0	0	0	0	0	0	0	0	0	0	0	0	0	0
5153485448	Diana, Princess of Wales Condition Bulimia nervosa	0.16666666666666666	36	0.5	0	0	0	0	2	1	0	0	0	0	0	0	0	0	0	0	0	0	0	0	0	0	2	1	0	0	0	0	0	0	0	0	0	0	0	0
5153485448	Diana, Princess of Wales Celebrity friends  Friend Elton John	0.0	36	0.0	0	0	0	0	0	0	0	0	0	0	0	0	0	0	0	0	0	0	0	0	0	0	0	0	0	0	0	0	0	0	0	0	0	0	0	0
5153485448	Diana, Princess of Wales Romantic relationships (with celebrities)  Celebrity Theodore J. Forstmann	0.1111111111111111	36	0.314269680527	0	0	0	0	0	1	0	0	0	0	0	0	0	1	0	0	0	0	0	0	0	0	0	1	0	0	0	0	0	0	0	1	0	0	0	0
5153485448	Diana, Princess of Wales Place of burial Althorp	1.6111111111111112	36	1.11249913303	2	0	2	2	3	3	2	0	0	2	3	2	1	3	2	0	0	2	2	0	2	2	3	3	2	0	0	2	3	2	1	3	2	0	0	2
5153485448	Diana, Princess of Wales Cause of death Traffic collision	2.8333333333333335	36	0.687184270936	3	3	3	3	3	3	3	0	3	3	3	3	3	3	3	3	3	3	3	3	3	3	3	3	3	0	3	3	3	3	3	3	3	3	3	3
5153485448	Diana, Princess of Wales Family House of Windsor	0.0	106	0.0	0	0	0	0	0	0	0	0	0	0	0	0	0	0	0	0	0	0	0	0	0	0	0	0	0	0	0	0	0	0	0	0	0	0	0	0	0	0	0	0	0	0	0	0	0	0	0	0	0	0	0	0	0	0	0	0	0	0	0	0	0	0	0	0	0	0	0	0	0	0	0	0	0	0	0	0	0	0	0	0	0	0	0	0	0	0	0	0	0	0	0	0	0	0	0	0	0	0	0	0	0	0	0	0	0	0
5153485448	Diana, Princess of Wales Titles  Noble title Princess of Wales	0.0	36	0.0	0	0	0	0	0	0	0	0	0	0	0	0	0	0	0	0	0	0	0	0	0	0	0	0	0	0	0	0	0	0	0	0	0	0	0	0
5153485448	Diana, Princess of Wales Representations In Fiction Princess Diana	0.07547169811320754	106	0.264150943396	0	0	0	0	0	0	0	0	0	0	0	0	0	0	0	0	0	0	0	0	0	0	1	0	1	0	0	0	0	0	0	0	0	0	0	0	0	0	0	0	0	0	0	1	0	0	0	0	0	0	0	1	0	0	0	0	0	0	0	0	0	0	0	0	0	0	0	0	0	0	0	0	0	0	0	1	0	1	0	0	0	0	0	0	0	0	0	0	0	0	0	0	0	0	0	0	1	0	0	0	0	0	0	0	1	0
5153485448	Diana, Princess of Wales Religion Anglicanism	0.0	106	0.0	0	0	0	0	0	0	0	0	0	0	0	0	0	0	0	0	0	0	0	0	0	0	0	0	0	0	0	0	0	0	0	0	0	0	0	0	0	0	0	0	0	0	0	0	0	0	0	0	0	0	0	0	0	0	0	0	0	0	0	0	0	0	0	0	0	0	0	0	0	0	0	0	0	0	0	0	0	0	0	0	0	0	0	0	0	0	0	0	0	0	0	0	0	0	0	0	0	0	0	0	0	0	0	0	0	0
5153485448	Diana, Princess of Wales Place of death Paris	2.84	100	0.504380808517	3	3	3	3	3	3	3	3	3	3	3	3	3	3	3	3	3	3	2	3	2	3	3	3	0	3	3	2	3	3	3	2	3	3	2	3	3	3	3	3	3	3	3	3	3	3	3	3	3	3	3	3	3	3	3	3	3	3	3	3	3	3	3	3	3	3	3	3	2	3	2	3	3	3	0	3	3	2	3	3	3	2	3	3	2	3	3	3	3	3	3	3	3	3	3	3	3	3	3	3
5153485448	Diana, Princess of Wales Spouse (or domestic partner)  Spouse Charles, Prince of Wales	0.02	100	0.14	0	0	0	0	0	0	0	0	0	0	0	0	0	0	0	0	0	0	0	0	0	0	0	0	0	0	0	0	0	0	0	0	0	0	0	0	0	0	0	0	1	0	0	0	0	0	0	0	0	0	0	0	0	0	0	0	0	0	0	0	0	0	0	0	0	0	0	0	0	0	0	0	0	0	0	0	0	0	0	0	0	0	0	0	0	0	0	0	0	0	1	0	0	0	0	0	0	0	0	0
5153485448	Diana, Princess of Wales Parents John Spencer	0.0	107	0.0	0	0	0	0	0	0	0	0	0	0	0	0	0	0	0	0	0	0	0	0	0	0	0	0	0	0	0	0	0	0	0	0	0	0	0	0	0	0	0	0	0	0	0	0	0	0	0	0	0	0	0	0	0	0	0	0	0	0	0	0	0	0	0	0	0	0	0	0	0	0	0	0	0	0	0	0	0	0	0	0	0	0	0	0	0	0	0	0	0	0	0	0	0	0	0	0	0	0	0	0	0	0	0	0	0	0	0
5153485448	Diana, Princess of Wales Siblings  Sibling John Spencer	0.0	106	0.0	0	0	0	0	0	0	0	0	0	0	0	0	0	0	0	0	0	0	0	0	0	0	0	0	0	0	0	0	0	0	0	0	0	0	0	0	0	0	0	0	0	0	0	0	0	0	0	0	0	0	0	0	0	0	0	0	0	0	0	0	0	0	0	0	0	0	0	0	0	0	0	0	0	0	0	0	0	0	0	0	0	0	0	0	0	0	0	0	0	0	0	0	0	0	0	0	0	0	0	0	0	0	0	0	0	0
5153485448	Diana, Princess of Wales TV episode performances  Special performance type Him/Herself	0.022222222222222223	90	0.147405546238	0	0	0	0	0	0	0	0	0	0	0	0	0	0	0	0	0	0	0	0	0	0	0	0	0	0	0	0	0	0	0	0	0	0	0	0	0	0	0	0	0	0	0	1	0	0	0	0	0	0	0	0	0	0	0	0	0	0	0	0	0	0	0	0	0	0	0	0	0	0	0	0	0	0	0	0	0	0	0	0	0	0	0	0	0	0	0	0	1	0
5153485448	Diana, Princess of Wales Children Prince Harry	0.0	96	0.0	0	0	0	0	0	0	0	0	0	0	0	0	0	0	0	0	0	0	0	0	0	0	0	0	0	0	0	0	0	0	0	0	0	0	0	0	0	0	0	0	0	0	0	0	0	0	0	0	0	0	0	0	0	0	0	0	0	0	0	0	0	0	0	0	0	0	0	0	0	0	0	0	0	0	0	0	0	0	0	0	0	0	0	0	0	0	0	0	0	0	0	0	0	0	0	0
5153485448	Diana, Princess of Wales Education  Institution The New School at West Heath	0.0	96	0.0	0	0	0	0	0	0	0	0	0	0	0	0	0	0	0	0	0	0	0	0	0	0	0	0	0	0	0	0	0	0	0	0	0	0	0	0	0	0	0	0	0	0	0	0	0	0	0	0	0	0	0	0	0	0	0	0	0	0	0	0	0	0	0	0	0	0	0	0	0	0	0	0	0	0	0	0	0	0	0	0	0	0	0	0	0	0	0	0	0	0	0	0	0	0	0	0
5153485448	Diana, Princess of Wales Country of nationality United Kingdom	0.0	78	0.0	0	0	0	0	0	0	0	0	0	0	0	0	0	0	0	0	0	0	0	0	0	0	0	0	0	0	0	0	0	0	0	0	0	0	0	0	0	0	0	0	0	0	0	0	0	0	0	0	0	0	0	0	0	0	0	0	0	0	0	0	0	0	0	0	0	0	0	0	0	0	0	0	0	0	0	0	0	0
5153485448	Diana, Princess of Wales Films On This Subject Diana	0.0851063829787234	94	0.347010775113	0	0	0	0	0	0	0	0	0	0	0	0	0	0	0	0	2	0	0	1	0	0	0	0	0	0	0	0	0	0	0	0	0	0	0	0	0	1	0	0	0	0	0	0	0	0	0	0	0	0	0	0	0	0	0	0	0	0	0	0	0	0	0	2	0	0	1	0	0	0	0	0	0	0	0	0	0	0	0	0	0	0	0	0	1	0	0	0	0	0	0	0	0	0
5153485448	Diana, Princess of Wales Place of birth Sandringham	0.0	78	0.0	0	0	0	0	0	0	0	0	0	0	0	0	0	0	0	0	0	0	0	0	0	0	0	0	0	0	0	0	0	0	0	0	0	0	0	0	0	0	0	0	0	0	0	0	0	0	0	0	0	0	0	0	0	0	0	0	0	0	0	0	0	0	0	0	0	0	0	0	0	0	0	0	0	0	0	0	0	0
72907148	Abraham Lincoln Military Commands  Military Conflict American Civil War	0.2727272727272727	22	0.616575453011	0	0	0	0	0	0	0	0	2	0	1	0	0	0	0	0	0	0	0	2	0	1
72907148	Abraham Lincoln Appointees  Office	0.06666666666666667	30	0.249443825785	0	0	0	0	0	0	0	1	0	0	0	0	0	0	0	0	0	0	0	0	0	0	1	0	0	0	0	0	0	0
72907148	 position	0.13333333333333333	30	0.49888765157	0	0	0	0	0	0	0	2	0	0	0	0	0	0	0	0	0	0	0	0	0	0	2	0	0	0	0	0	0	0
72907148	 or title United States Secretary of State	0.2	30	0.541602560309	0	0	0	0	1	0	0	2	0	0	0	0	0	0	0	0	0	0	0	1	0	0	2	0	0	0	0	0	0	0
72907148	Abraham Lincoln Spouse (or domestic partner)  Location of ceremony Springfield	2.5	12	1.11803398875	0	3	3	3	3	3	0	3	3	3	3	3
88677448	Albert Einstein Book editions published The World As I See It	1.1111111111111112	18	0.874889763779	2	1	2	0	2	2	0	0	1	2	1	2	0	2	2	0	0	1
88677448	Albert Einstein Siblings  Sibling Maja Einstein	0.0	18	0.0	0	0	0	0	0	0	0	0	0	0	0	0	0	0	0	0	0	0
88677448	Albert Einstein Spouse (or domestic partner)  Location of ceremony Bern	0.0	6	0.0	0	0	0	0	0	0
5249574948	Beijing Works Written About This Topic The Interior	0.0	28	0.0	0	0	0	0	0	0	0	0	0	0	0	0	0	0	0	0	0	0	0	0	0	0	0	0	0	0	0	0
5295826848	Titanic Quotations I'm King of the World!	0.043010752688172046	93	0.202881314668	0	0	0	0	0	0	0	0	0	0	0	0	0	0	0	1	0	0	1	0	0	0	0	0	0	0	0	0	0	0	0	0	0	0	0	0	0	0	0	0	0	0	0	0	0	0	0	0	0	0	0	0	0	0	0	0	0	0	0	0	0	1	0	0	1	0	0	0	0	0	0	0	0	0	0	0	0	0	0	0	0	0	0	0	0	0	0	0	0	0	0	0	0
5295826848	Titanic Executive produced by Rae Sanchini	0.0	15	0.0	0	0	0	0	0	0	0	0	0	0	0	0	0	0	0
5295826848	Titanic Screenplay by James Cameron	0.0	14	0.0	0	0	0	0	0	0	0	0	0	0	0	0	0	0
5354845548	United Nations Award Nominations  Award Academy Award for Best Documentary Short Subject	0.0	20	0.0	0	0	0	0	0	0	0	0	0	0	0	0	0	0	0	0	0	0	0	0
5354845548	United Nations Works Written About This Topic Black History Month Enhanced by International Year for People of African Descent	0.0	24	0.0	0	0	0	0	0	0	0	0	0	0	0	0	0	0	0	0	0	0	0	0	0	0	0	0
5578775448	Stanley Kubrick Things named after this Kubrick	0.0851063829787234	94	0.347010775113	0	0	0	0	0	1	0	0	0	0	0	0	0	0	0	0	0	0	0	1	0	0	0	0	0	0	0	0	0	0	0	0	0	0	0	0	0	0	0	0	0	0	0	0	2	0	0	0	0	0	0	0	1	0	0	0	0	0	0	0	0	0	0	0	0	0	1	0	0	0	0	0	0	0	0	0	0	0	0	0	0	0	0	0	0	0	0	0	0	0	0	2	0	0
5578775448	Stanley Kubrick Quotations You're free to speculate as you wish about the philosophical and allegorical meaning of the film—and such speculation is one indication that it has succeeded in gripping the audience at a deep level—but I don't want to spell out a verbal road map for 2001 that every viewer will feel obligated to pursue or else fear he's missed the point.	0.6736842105263158	95	0.967276211171	0	1	0	0	0	0	0	2	0	0	0	0	0	1	0	1	0	0	0	2	2	0	0	0	0	2	0	0	3	0	1	0	3	1	0	1	2	2	1	0	3	2	0	0	2	0	0	0	1	0	0	0	0	0	2	0	0	0	0	0	1	0	1	0	0	0	2	2	0	0	0	0	2	0	0	3	0	1	0	3	1	0	1	2	2	1	0	3	2	0	0	2	0	0	0
5578775448	Stanley Kubrick Film Story Credits A.I. Artificial Intelligence	2.127659574468085	94	0.936653646939	3	3	3	3	1	1	1	2	2	2	3	0	3	2	3	2	3	2	1	2	2	2	2	2	3	2	3	3	3	3	1	3	3	2	2	0	2	3	3	0	2	3	1	3	3	0	2	3	3	3	3	1	1	1	2	2	2	3	0	3	2	3	2	3	2	1	2	2	2	2	2	3	2	3	3	3	3	1	3	3	2	2	0	2	3	3	0	2	3	1	3	3	0	2
7057716748	Richard Burton Films appeared in  Type of Appearance Him/Herself	1.4	80	0.7	1	1	0	1	2	1	2	2	1	1	2	1	1	1	2	1	3	2	2	2	1	2	2	2	2	1	1	2	0	2	2	1	1	2	2	0	2	1	1	0	1	1	0	1	2	1	2	2	1	1	2	1	1	1	2	1	3	2	2	2	1	2	2	2	2	1	1	2	0	2	2	1	1	2	2	0	2	1	1	0
7176525248	Jacques-Yves Cousteau Things named after this Jacques Cousteau National Estuarine Research Reserve	0.06976744186046512	86	0.452144699889	0	0	0	0	0	0	0	0	0	0	0	0	0	0	0	0	0	0	0	0	0	0	0	0	0	0	0	0	0	0	0	0	0	0	0	0	0	0	0	0	3	0	0	0	0	0	0	0	0	0	0	0	0	0	0	0	0	0	0	0	0	0	0	0	0	0	0	0	0	0	0	0	0	0	0	0	0	0	0	0	0	0	0	3	0	0
7176525248	Jacques-Yves Cousteau Films appeared in  Type of Appearance Him/Herself	0.09302325581395349	86	0.473185812776	0	0	1	0	0	0	0	0	0	0	0	0	0	0	0	0	0	0	0	0	0	0	0	0	0	0	0	0	0	0	0	0	0	0	0	0	0	0	0	0	3	0	0	0	0	1	0	0	0	0	0	0	0	0	0	0	0	0	0	0	0	0	0	0	0	0	0	0	0	0	0	0	0	0	0	0	0	0	0	0	0	0	0	3	0	0
7176525248	Jacques-Yves Cousteau Places lived  Location Aquitaine	0.08108108108108109	74	0.486486486486	0	0	0	0	0	0	0	0	0	0	0	0	0	0	0	0	0	0	0	0	0	0	0	0	0	0	0	0	0	0	0	0	0	0	3	0	0	0	0	0	0	0	0	0	0	0	0	0	0	0	0	0	0	0	0	0	0	0	0	0	0	0	0	0	0	0	0	0	0	0	0	3	0	0
7176525248	Jacques-Yves Cousteau TV episode performances  Episode EPISODE #328	0.08108108108108109	74	0.486486486486	0	0	0	0	0	0	0	0	0	0	0	0	0	0	0	0	0	0	0	0	0	0	0	0	0	0	0	0	0	0	0	0	0	0	3	0	0	0	0	0	0	0	0	0	0	0	0	0	0	0	0	0	0	0	0	0	0	0	0	0	0	0	0	0	0	0	0	0	0	0	0	3	0	0
7876784948	Cameroon Beers from here 33 Export	0.23076923076923078	26	0.575639597965	0	0	0	0	0	0	0	0	0	1	2	0	0	0	0	0	0	0	0	0	0	0	1	2	0	0
7876784948	Cameroon Agencies Cameroon Ministry of Justice	1.3846153846153846	26	0.835598499323	0	0	1	2	1	2	0	2	2	2	2	2	2	0	0	1	2	1	2	0	2	2	2	2	2	2
7876784948	Cameroon Events 2008 Cameroonian anti-government protests	0.9	20	1.04403065089	2	0	0	1	0	1	0	2	3	0	2	0	0	1	0	1	0	2	3	0
7876784948	Cameroon Governing officials  Basic title President	2.0	20	1.0	1	3	1	2	3	2	0	2	3	3	1	3	1	2	3	2	0	2	3	3
7876784948	Cameroon Works Written About This Topic Cameroon with Egbert	0.0	20	0.0	0	0	0	0	0	0	0	0	0	0	0	0	0	0	0	0	0	0	0	0
8372755048	Eritrea Organizations with this scope People's Front for Democracy and Justice	0.2962962962962963	54	0.531581484978	0	1	0	1	0	0	0	1	0	0	0	0	1	1	2	0	0	0	0	0	1	0	0	0	0	0	0	0	1	0	1	0	0	0	1	0	0	0	0	1	1	2	0	0	0	0	0	1	0	0	0	0	0	0
8372755048	Eritrea Athletic performances  Medal Bronze medal	0.0	54	0.0	0	0	0	0	0	0	0	0	0	0	0	0	0	0	0	0	0	0	0	0	0	0	0	0	0	0	0	0	0	0	0	0	0	0	0	0	0	0	0	0	0	0	0	0	0	0	0	0	0	0	0	0	0	0
8372755048	Eritrea Governing officials  Basic title President	2.1481481481481484	54	0.704677688535	2	2	2	2	1	2	0	3	3	1	2	2	2	2	2	3	3	3	2	3	3	3	2	2	2	2	2	2	2	2	2	1	2	0	3	3	1	2	2	2	2	2	3	3	3	2	3	3	3	2	2	2	2	2
8448865148	Illinois Organizations with this scope Illinois State Board of Education	0.13953488372093023	86	0.509509355819	0	0	0	0	0	0	0	0	1	0	0	0	0	0	0	0	0	1	0	0	0	0	0	1	0	0	0	0	0	0	0	0	0	0	0	0	0	0	0	0	0	3	0	0	0	0	0	0	0	0	0	1	0	0	0	0	0	0	0	0	1	0	0	0	0	0	1	0	0	0	0	0	0	0	0	0	0	0	0	0	0	0	0	0	3	0
8448865148	Illinois Events Black Hawk War	0.0	12	0.0	0	0	0	0	0	0	0	0	0	0	0	0
8478554948	Bill Gates Quotations I believe that if you show people the problems and you show them the solutions they will be moved to act.	0.36585365853658536	82	0.689860274328	0	1	0	1	0	0	0	0	0	0	0	1	0	2	0	0	0	2	3	0	1	0	0	1	0	0	0	0	0	1	0	0	0	0	0	0	1	0	1	0	0	0	1	0	1	0	0	0	0	0	0	0	1	0	2	0	0	0	2	3	0	1	0	0	1	0	0	0	0	0	1	0	0	0	0	0	0	1	0	1	0	0
8478554948	Bill Gates Works Written About This Topic Programmers at work	0.36585365853658536	82	0.689860274328	0	0	0	0	0	0	0	0	0	0	0	0	0	2	0	0	0	1	1	0	1	0	0	2	0	0	0	1	0	0	0	1	0	2	0	0	2	0	2	0	0	0	0	0	0	0	0	0	0	0	0	0	0	0	2	0	0	0	1	1	0	1	0	0	2	0	0	0	1	0	0	0	1	0	2	0	0	2	0	2	0	0
8478554948	Bill Gates Things named after this Bill & Melinda Gates Foundation	0.7317073170731707	82	0.856094086575	1	1	0	1	0	0	0	1	0	1	1	2	0	1	1	1	1	2	3	0	2	0	0	3	0	0	0	0	1	2	0	1	0	1	0	0	1	0	2	0	0	1	1	0	1	0	0	0	1	0	1	1	2	0	1	1	1	1	2	3	0	2	0	0	3	0	0	0	0	1	2	0	1	0	1	0	0	1	0	2	0	0
8772815348	Poland Featured In Films The Dead And The Living	0.0	2	0.0	0	0
8772815348	Poland Organizations founded United Nations	0.0	2	0.0	0	0
8772815348	Poland Time zone(s) Central European Time Zone	0.0	2	0.0	0	0
8772815348	Poland Languages spoken Polish Language	0.0	2	0.0	0	0
9078665448	Russia Military Commanders  Military Commander Dmitry Donskoy	0.0	8	0.0	0	0	0	0	0	0	0	0
9078665448	Russia Second level divisions Odintsovsky District	1.25	8	0.829156197589	0	2	2	1	0	2	2	1
9078665448	Russia Religions  Religion Islam	0.5	8	0.866025403784	0	0	0	2	0	0	0	2
706888504948	Shaquille O'Neal Lyrics Written Biological Didn't Bother	0.68	25	0.835224520713	2	0	1	0	0	0	0	2	2	1	0	0	2	0	1	0	0	0	0	2	2	1	0	0	1
706888504948	Shaquille O'Neal Musical Genres Hip hop music	0.7272727272727273	22	0.862439361864	2	0	1	0	0	0	0	2	2	1	0	2	0	1	0	0	0	0	2	2	1	0
706888504948	Shaquille O'Neal Works Composed Biological Didn't Bother	0.7272727272727273	22	1.05234880934	2	0	0	0	0	0	0	2	3	1	0	2	0	0	0	0	0	0	2	3	1	0
706888504948	Shaquille O'Neal Record Labels A&M Records	0.625	32	0.85695682505	2	0	0	0	0	0	0	2	2	1	0	0	2	0	1	0	2	0	0	0	0	0	0	2	2	1	0	0	2	0	1	0
57865383535048	Michelle Obama Films appeared in  Type of Appearance Him/Herself	0.0	81	0.0	0	0	0	0	0	0	0	0	0	0	0	0	0	0	0	0	0	0	0	0	0	0	0	0	0	0	0	0	0	0	0	0	0	0	0	0	0	0	0	0	0	0	0	0	0	0	0	0	0	0	0	0	0	0	0	0	0	0	0	0	0	0	0	0	0	0	0	0	0	0	0	0	0	0	0	0	0	0	0	0	0
57865383535048	Michelle Obama Award Nominations  Award Nominee Barack Obama	0.05	80	0.217944947177	0	0	0	0	0	0	0	0	0	0	0	0	0	0	0	0	0	0	0	0	0	0	0	0	0	0	0	0	1	0	0	0	0	0	0	1	0	0	0	0	0	0	0	0	0	0	0	0	0	0	0	0	0	0	0	0	0	0	0	0	0	0	0	0	0	0	0	0	1	0	0	0	0	0	0	1	0	0	0	0
9571555448	Pelé Government Positions Held  Office position or title Minister for Sport and the Olympics	0.0	6	0.0	0	0	0	0	0	0
8686545348	Montenegro Beers from here Trebjesa Niksicko Pivo	0.07142857142857142	84	0.257539376819	0	0	0	0	0	0	0	0	0	0	0	0	0	0	0	0	0	0	1	0	0	0	0	0	0	0	0	0	0	1	0	0	0	1	0	0	0	0	0	0	0	0	0	0	0	0	0	0	0	0	0	0	0	0	0	0	0	0	0	0	1	0	0	0	0	0	0	0	0	0	0	1	0	0	0	1	0	0	0	0	0	0	0	0
8686545348	Montenegro Newspapers Dan	0.3783783783783784	74	0.585931983478	1	0	0	0	1	1	0	0	0	0	1	0	0	0	0	0	1	0	1	0	1	0	0	0	1	0	0	0	2	0	1	0	0	2	0	1	0	1	0	0	0	1	1	0	0	0	0	1	0	0	0	0	0	1	0	1	0	1	0	0	0	1	0	0	0	2	0	1	0	0	2	0	1	0
8686545348	Montenegro Athletic performances  Olympics The London 2012 Summer Olympics	0.02666666666666667	75	0.161107279648	0	0	0	0	0	0	0	0	0	0	0	0	0	0	0	0	1	0	0	0	0	0	0	0	0	0	0	0	0	0	0	0	0	0	0	0	0	0	0	0	0	0	0	0	0	0	0	0	0	0	0	0	0	1	0	0	0	0	0	0	0	0	0	0	0	0	0	0	0	0	0	0	0	0	0
8686545348	Montenegro Military Conflicts  Conflict Siege of Dubrovnik	1.3513513513513513	74	1.12023685276	3	0	2	0	3	1	2	2	2	0	0	1	1	1	2	2	3	0	3	0	0	0	0	0	2	2	1	2	3	1	3	0	2	3	1	2	0	3	0	2	0	3	1	2	2	2	0	0	1	1	1	2	2	3	0	3	0	0	0	0	0	2	2	1	2	3	1	3	0	2	3	1	2	0
8686545348	Montenegro Agencies Montenegro Ministry of Finance	2.119047619047619	84	0.624971654686	2	3	2	2	1	2	2	2	2	3	3	2	2	1	2	2	2	2	2	3	3	2	2	2	3	2	3	1	3	3	1	2	2	2	3	2	2	2	1	1	3	2	2	3	2	2	1	2	2	2	2	3	3	2	2	1	2	2	2	2	2	3	3	2	2	2	3	2	3	1	3	3	1	2	2	2	3	2	2	2	1	1	3	2
8686545348	Montenegro Energy use per capita  Source Energy use per capita, World Development Indicators and Global Development Finance, World Bank	0.7027027027027027	74	0.982684268254	0	0	0	0	0	0	0	2	0	0	1	1	0	0	2	0	1	0	1	1	0	2	0	0	3	1	0	0	2	3	0	0	0	0	1	3	2	0	0	0	0	0	0	0	2	0	0	1	1	0	0	2	0	1	0	1	1	0	2	0	0	3	1	0	0	2	3	0	0	0	0	1	3	2
5167788848	Charles, Prince of Wales Things named after this The Prince's Trust	0.2898550724637681	69	0.567257559153	0	0	0	0	1	0	0	0	0	0	0	0	0	2	0	0	0	0	0	0	0	1	1	2	0	0	1	1	1	0	0	0	0	0	0	0	0	0	1	0	0	0	0	0	0	0	0	2	0	0	0	0	0	0	0	1	1	2	0	0	1	1	1	0	0	0	0	0	0
5167788848	Charles, Prince of Wales Films appeared in  Type of Appearance Him/Herself	0.37681159420289856	69	0.683160797066	0	0	1	0	0	1	0	0	0	1	0	0	0	0	0	0	0	0	0	0	0	1	1	3	0	0	1	1	2	0	0	0	1	0	0	0	1	0	0	1	0	0	0	1	0	0	0	0	0	0	0	0	0	0	0	1	1	3	0	0	1	1	2	0	0	0	1	0	0
5167788848	Charles, Prince of Wales TV episode performances  Special performance type Him/Herself	0.09090909090909091	22	0.287479787288	0	0	0	0	0	1	0	0	0	0	0	0	0	0	0	0	1	0	0	0	0	0
5167788848	Charles, Prince of Wales Place of birth Buckingham Palace	2.4615384615384617	13	0.498518515262	2	2	3	3	3	2	2	2	3	3	3	2	2
518753486848	China Official Language Standard Mandarin	0.0	14	0.0	0	0	0	0	0	0	0	0	0	0	0	0	0	0
518753486848	China Second level divisions Yulin	0.0	10	0.0	0	0	0	0	0	0	0	0	0	0
518753486848	China Tourist attractions Mausoleum of the First Qin Emperor	0.6	10	1.2	0	3	0	0	0	0	3	0	0	0
518753486848	China Time zone(s) China Time Zone	0.0	10	0.0	0	0	0	0	0	0	0	0	0	0
5153485448	Diana, Princess of Wales Influenced Banksy	0.0	99	0.0	0	0	0	0	0	0	0	0	0	0	0	0	0	0	0	0	0	0	0	0	0	0	0	0	0	0	0	0	0	0	0	0	0	0	0	0	0	0	0	0	0	0	0	0	0	0	0	0	0	0	0	0	0	0	0	0	0	0	0	0	0	0	0	0	0	0	0	0	0	0	0	0	0	0	0	0	0	0	0	0	0	0	0	0	0	0	0	0	0	0	0	0	0	0	0	0	0	0	0
5153485448	Diana, Princess of Wales Things named after this Diana, Princess of Wales Memorial Fountain	0.5306122448979592	98	0.702823483989	0	0	0	0	1	0	1	0	0	0	0	0	0	0	0	0	1	0	1	0	2	2	0	0	0	0	1	1	0	0	1	0	0	0	1	0	1	1	2	2	1	0	1	2	0	0	1	2	1	0	0	0	0	1	0	1	0	0	0	0	0	0	0	0	0	1	0	1	0	2	2	0	0	0	0	1	1	0	0	1	0	0	0	1	0	1	1	2	2	1	0	1	2	0	0	1	2	1
5153485448	Diana, Princess of Wales Works Written About This Topic Diana, Princess of Wales	0.26262626262626265	99	0.561129067165	0	0	0	0	0	0	0	0	0	0	0	0	0	0	0	0	0	0	2	0	0	2	0	0	0	0	0	0	0	0	1	0	0	1	0	1	0	0	1	2	0	0	1	0	0	0	1	1	0	0	0	0	0	0	0	0	0	0	0	0	0	0	0	0	0	0	0	2	0	0	2	0	0	0	0	0	0	0	0	1	0	0	1	0	1	0	0	1	2	0	0	1	0	0	0	1	1	0	0
72907148	Abraham Lincoln Things named after this Lincoln	0.07142857142857142	28	0.257539376819	0	1	0	0	0	0	0	0	0	0	0	0	0	0	0	1	0	0	0	0	0	0	0	0	0	0	0	0
72907148	Abraham Lincoln Quotations A woman is the only thing I am afraid of that I know will not hurt me.	0.5	28	0.5	1	0	0	0	0	1	0	0	1	1	1	1	0	1	1	0	0	0	0	1	0	0	1	1	1	1	0	1
72907148	Abraham Lincoln Works Written About This Topic Abraham Lincoln	0.4444444444444444	18	0.831479419283	0	0	0	0	0	0	0	2	2	0	0	0	0	0	0	0	2	2
72907148	Abraham Lincoln Works written Abraham Lincoln	0.2	10	0.4	0	1	0	0	0	0	1	0	0	0
72907148	Abraham Lincoln Organizations founded Republican Party	0.2857142857142857	28	0.699854212224	0	2	0	0	0	0	0	0	0	0	0	2	0	0	0	2	0	0	0	0	0	0	0	0	0	2	0	0
72907148	Abraham Lincoln Appointment made  Appointee Salmon P. Chase	0.14285714285714285	28	0.349927106112	0	0	0	0	0	0	0	0	0	0	0	1	0	1	0	0	0	0	0	0	0	0	0	0	0	1	0	1
72907148	Abraham Lincoln Government Positions Held  Jurisdiction of office Illinois	0.5	20	0.80622577483	0	1	2	0	0	0	0	2	0	0	0	1	2	0	0	0	0	2	0	0
72907148	Abraham Lincoln Influenced Martin Luther King, Jr.	0.21428571428571427	28	0.410325903324	0	0	1	0	0	0	0	0	0	0	0	1	0	1	0	0	1	0	0	0	0	0	0	0	0	1	0	1
72907148	Abraham Lincoln Siblings  Sibling Thomas Lincoln	2.2	10	0.748331477355	3	3	2	2	1	3	3	2	2	1
72907148	Abraham Lincoln Influenced By Thomas Paine	0.8	20	0.871779788708	0	1	2	2	0	0	0	1	0	2	0	1	2	2	0	0	0	1	0	2
72907148	Abraham Lincoln Profession Politician	1.0	10	1.26491106407	0	3	2	0	0	0	3	2	0	0
72907148	Abraham Lincoln Children Robert Todd Lincoln	2.0	10	1.09544511501	3	3	2	0	2	3	3	2	0	2
88677448	Albert Einstein Influenced Karl Popper	0.8571428571428571	56	0.914732033919	0	2	0	1	0	1	0	1	2	1	0	1	0	2	2	3	0	1	0	1	2	2	0	2	0	0	0	0	0	2	0	1	0	1	0	1	2	1	0	1	0	2	2	3	0	1	0	1	2	2	0	2	0	0	0	0
88677448	Albert Einstein Recordings Einsteins speches and broadcasts: At the Royal Albert Hall, London [1933]	0.6666666666666666	12	0.471404520791	0	1	1	1	1	0	0	1	1	1	1	0
88677448	Albert Einstein Works Written About This Topic Einstein	0.6923076923076923	52	0.951485913604	0	2	2	2	1	0	0	2	0	1	0	2	2	3	0	0	0	0	1	0	0	0	0	0	0	0	0	2	2	2	1	0	0	2	0	1	0	2	2	3	0	0	0	0	1	0	0	0	0	0	0	0
88677448	Albert Einstein Works written Isaac Newton	1.3076923076923077	52	0.910166120477	0	2	2	2	1	1	0	2	2	1	1	2	1	3	1	0	1	3	2	0	0	2	2	2	1	0	0	2	2	2	1	1	0	2	2	1	1	2	1	3	1	0	1	3	2	0	0	2	2	2	1	0
88677448	Albert Einstein Things named after this Albert Einstein College of Medicine	0.6785714285714286	56	0.847415036979	1	0	0	0	0	0	0	0	0	0	1	1	0	1	0	1	1	2	0	0	0	3	0	1	1	2	2	2	1	0	0	0	0	0	0	0	0	0	1	1	0	1	0	1	1	2	0	0	0	3	0	1	1	2	2	2
88677448	Albert Einstein Influenced By Mahatma Gandhi	0.75	56	0.871165065546	0	1	0	0	0	2	0	2	1	1	0	1	0	2	2	3	0	1	0	1	2	1	0	1	0	0	0	0	0	1	0	0	0	2	0	2	1	1	0	1	0	2	2	3	0	1	0	1	2	1	0	1	0	0	0	0
88677448	Albert Einstein Quotations Gravitation cannot be held responsible for people falling in love.	0.25	56	0.737999225706	0	0	0	0	0	2	0	0	0	0	0	0	0	3	0	2	0	0	0	0	0	0	0	0	0	0	0	0	0	0	0	0	0	2	0	0	0	0	0	0	0	3	0	2	0	0	0	0	0	0	0	0	0	0	0	0
88677448	Albert Einstein Films appeared in  Type of Appearance Him/Herself	0.0	52	0.0	0	0	0	0	0	0	0	0	0	0	0	0	0	0	0	0	0	0	0	0	0	0	0	0	0	0	0	0	0	0	0	0	0	0	0	0	0	0	0	0	0	0	0	0	0	0	0	0	0	0	0	0
88677448	Albert Einstein Awards Won  Award category Nobel Prize in Physics	1.8333333333333333	12	1.34370962472	0	3	0	2	3	3	0	3	0	2	3	3
88677448	Albert Einstein Profession Writer	1.5	12	1.25830573921	0	3	3	1	0	2	0	3	3	1	0	2
88677448	Albert Einstein Films On This Subject Young Einstein	0.0	56	0.0	0	0	0	0	0	0	0	0	0	0	0	0	0	0	0	0	0	0	0	0	0	0	0	0	0	0	0	0	0	0	0	0	0	0	0	0	0	0	0	0	0	0	0	0	0	0	0	0	0	0	0	0	0	0	0	0
88677448	Albert Einstein Education  Degree PhD	2.8333333333333335	12	0.37267799625	3	3	3	2	3	3	3	3	3	2	3	3
88677448	Albert Einstein Places lived  Location Germany	0.0	12	0.0	0	0	0	0	0	0	0	0	0	0	0	0
88677448	Albert Einstein Children Hans Albert Einstein	0.0	12	0.0	0	0	0	0	0	0	0	0	0	0	0	0
88677448	Albert Einstein Gender Male	0.0	12	0.0	0	0	0	0	0	0	0	0	0	0	0	0
88677448	Albert Einstein Parents Pauline Einstein	0.0	12	0.0	0	0	0	0	0	0	0	0	0	0	0	0
5249574948	Beijing People born here Faye Wong	0.0	12	0.0	0	0	0	0	0	0	0	0	0	0	0	0
5249574948	Beijing Contains Peking University	0.0	12	0.0	0	0	0	0	0	0	0	0	0	0	0	0
5295826848	Titanic Award Nominations  Award Nominee Celine Dion	1.8	10	0.979795897113	2	3	2	2	0	2	3	2	2	0
5295826848	Titanic Awards Won  Award winner Celine Dion	1.5714285714285714	84	0.929486728378	2	3	2	2	0	2	0	2	3	2	3	3	2	0	1	2	1	2	2	2	1	2	1	0	2	2	2	2	2	2	0	2	3	1	0	0	2	1	2	0	2	1	2	3	2	2	0	2	0	2	3	2	3	3	2	0	1	2	1	2	2	2	1	2	1	0	2	2	2	2	2	2	0	2	3	1	0	0	2	1	2	0	2	1
5295826848	Titanic Performances  Actor Kate Winslet	0.0	6	0.0	0	0	0	0	0	0
5295826848	Titanic Other crew  Film crew role Special Effects	0.0	10	0.0	0	0	0	0	0	0	0	0	0	0
5295826848	Titanic Netflix Genres Drama	0.0	7	0.0	0	0	0	0	0	0	0
5295826848	Titanic Release date(s)  Film release region London	0.0	10	0.0	0	0	0	0	0	0	0	0	0	0
5295826848	Titanic Genres Drama	0.0	6	0.0	0	0	0	0	0	0
5295826848	Titanic Languages English Language	0.0	10	0.0	0	0	0	0	0	0	0	0	0	0
