query_id	answer_id	final_rating	num_ratings	std_rating	r1	r2	r3	r4	r5	r6	r7	r8	r9	r10	r11	r12	r13	r14	r15	r16	r17	r18	r19	r20	r21	r22	r23	r24	r25	r26	r27	r28	r29	r30	r31	r32	r33	r34	r35	r36	r37	r38	r39	r40	r41	r42	r43	r44	r45	r46	r47	r48	r49	r50	r51	r52	r53	r54	r55	r56	r57	r58	r59	r60	r61	r62	r63	r64	r65	r66	r67	r68	r69	r70	r71	r72	r73	r74	r75	r76	r77	r78	r79	r80	r81	r82	r83	r84	r85	r86	r87	r88	r89	r90	r91	r92	r93	r94	r95	r96	r97	r98	r99	r100	r101	r102	r103	r104	r105	r106	r107	r108	r109	r110	r111	r112	r113	r114	r115	r116	r117	r118	r119	r120	r121	r122	r123	r124	r125	r126	r127	r128	r129	r130	r131	r132	r133	r134	r135	r136	r137	r138	r139	r140	r141	r142	r143	r144	r145	r146	r147	r148	r149	r150	r151	r152	r153	r154	r155	r156	r157	r158	r159	r160	r161	r162	r163	r164	r165	r166	r167	r168	r169	r170	r171	r172	r173	r174	r175	r176	r177	r178	r179	r180	r181	r182	r183	r184	r185	r186	r187	r188	r189	r190	r191	r192	r193	r194	r195	r196	r197	r198	r199	r200	r201	r202	r203	r204	r205	r206	r207	r208	r209	r210	r211	r212	r213	r214	r215	r216	r217	r218	r219
72907148	Abraham Lincoln Romantic relationships (with celebrities)  Celebrity Ann Rutledge	2.888888888888889	36	0.314269680527	3	3	3	3	3	3	3	3	3	3	3	3	3	3	3	2	3	2	3	3	3	3	3	3	3	3	3	3	3	3	3	3	3	2	3	2
72907148	Abraham Lincoln Vice president Andrew Johnson	0.0	46	0.0	0	0	0	0	0	0	0	0	0	0	0	0	0	0	0	0	0	0	0	0	0	0	0	0	0	0	0	0	0	0	0	0	0	0	0	0	0	0	0	0	0	0	0	0	0	0
72907148	Abraham Lincoln Dedications  Dedicated By United States Congress	0.13043478260869565	46	0.447636093086	0	0	0	0	0	0	1	0	0	0	0	0	0	0	0	0	0	0	0	0	2	0	0	0	0	0	0	0	0	1	0	0	0	0	0	0	0	0	0	0	0	0	0	2	0	0
72907148	Abraham Lincoln Condition Smallpox	1.8888888888888888	36	0.874889763779	2	0	1	3	2	2	3	3	2	2	2	3	2	1	0	2	2	2	2	0	1	3	2	2	3	3	2	2	2	3	2	1	0	2	2	2
72907148	Abraham Lincoln Place of burial Oak Ridge Cemetery	1.2142857142857142	28	1.08091042503	0	1	0	0	1	2	0	3	2	2	1	0	2	3	0	1	0	0	1	2	0	3	2	2	1	0	2	3
72907148	Abraham Lincoln Film Story Credits Lincoln's Gettysburg Address	0.0	14	0.0	0	0	0	0	0	0	0	0	0	0	0	0	0	0
72907148	Abraham Lincoln Election campaigns Abraham Lincoln Presidential Campaign, 1860	0.1111111111111111	36	0.458122847291	0	0	0	0	0	0	0	0	0	0	0	0	0	0	0	2	0	0	0	0	0	0	0	0	0	0	0	0	0	0	0	0	0	2	0	0
72907148	Abraham Lincoln Service  Rank Captain	0.4444444444444444	18	0.496903995	0	0	0	1	1	1	1	0	0	0	0	0	1	1	1	1	0	0
72907148	Abraham Lincoln Named after Abraham	1.0	18	1.15470053838	3	0	0	2	0	2	0	0	2	3	0	0	2	0	2	0	0	2
72907148	Abraham Lincoln Cause of death Assassination	1.8888888888888888	18	0.874889763779	2	2	0	1	2	2	3	3	2	2	2	0	1	2	2	3	3	2
72907148	Abraham Lincoln Speeches or presentations  Speech subject American Civil War	0.29411764705882354	34	0.665512264646	0	0	0	0	0	2	0	0	0	0	1	0	0	0	2	0	0	0	0	0	0	0	2	0	0	0	0	1	0	0	0	2	0	0
72907148	Abraham Lincoln Participated in conflicts Black Hawk War	0.2222222222222222	18	0.415739709642	0	1	0	0	0	1	0	0	0	0	1	0	0	0	1	0	0	0
72907148	Abraham Lincoln Exhibitions created about this subject Abraham Lincoln: Self-Made in America	0.3333333333333333	24	0.7453559925	0	0	0	0	0	2	0	0	0	2	0	0	0	0	0	0	0	2	0	0	0	2	0	0
72907148	Abraham Lincoln Party  Party Republican Party	0.3333333333333333	6	0.471404520791	0	1	0	0	1	0
72907148	Abraham Lincoln Ethnicity Americans	1.7857142857142858	28	1.14508711013	3	2	0	1	2	1	2	3	3	3	3	2	0	0	3	2	0	1	2	1	2	3	3	3	3	2	0	0
72907148	Abraham Lincoln Representations In Fiction Abraham Lincoln	0.17391304347826086	46	0.563542669427	0	0	0	0	0	0	2	0	0	0	0	0	0	0	0	0	2	0	0	0	0	0	0	0	0	0	0	0	0	2	0	0	0	0	0	0	0	0	0	2	0	0	0	0	0	0
72907148	Abraham Lincoln Films On This Subject Lincoln	0.5	24	0.763762615826	0	0	0	0	0	2	2	1	0	0	0	1	0	0	0	0	0	2	2	1	0	0	0	1
72907148	Abraham Lincoln Place of death Washington, D.C.	1.7777777777777777	18	0.916245694582	2	1	0	1	2	2	3	3	2	2	1	0	1	2	2	3	3	2
72907148	Abraham Lincoln Employment history  Title President	0.7777777777777778	18	0.916245694582	0	2	0	2	2	0	0	1	0	0	2	0	2	2	0	0	1	0
72907148	Abraham Lincoln Quotations About This Subject \The Emancipation Proclamation...can remind us in 2013 of all the mistakes we never want to commit again but it can also motivate us to fulfill to an ever greater degree the definitive freedom-sustaining and life-enhancing principles of democracy in living action.	0.0	18	0.0	0	0	0	0	0	0	0	0	0	0	0	0	0	0	0	0	0	0
88677448	Albert Einstein Inventions Einstein refrigerator	1.0357142857142858	56	1.05160227602	0	1	1	2	0	2	2	2	0	3	0	1	0	3	2	3	1	0	0	2	1	0	0	1	0	2	0	0	0	1	1	2	0	2	2	2	0	3	0	1	0	3	2	3	1	0	0	2	1	0	0	1	0	2	0	0
88677448	Albert Einstein Departments School of Mathematics, Institute for Advanced Study	1.7333333333333334	60	0.963788819653	2	2	0	3	2	2	1	1	2	3	3	0	2	1	0	0	2	3	2	0	2	1	2	3	2	2	2	3	2	2	2	2	0	3	2	2	1	1	2	3	3	0	2	1	0	0	2	3	2	0	2	1	2	3	2	2	2	3	2	2
88677448	Albert Einstein Follows diet Veganism	0.0	60	0.0	0	0	0	0	0	0	0	0	0	0	0	0	0	0	0	0	0	0	0	0	0	0	0	0	0	0	0	0	0	0	0	0	0	0	0	0	0	0	0	0	0	0	0	0	0	0	0	0	0	0	0	0	0	0	0	0	0	0	0	0
88677448	Albert Einstein Academic advisors Heinrich Friedrich Weber	2.4	60	0.8	3	3	1	3	3	2	2	2	3	3	3	1	3	3	3	1	2	3	2	2	2	3	3	2	3	3	0	2	3	3	3	3	1	3	3	2	2	2	3	3	3	1	3	3	3	1	2	3	2	2	2	3	3	2	3	3	0	2	3	3
88677448	Albert Einstein Family Einstein family	0.0	20	0.0	0	0	0	0	0	0	0	0	0	0	0	0	0	0	0	0	0	0	0	0
88677448	Albert Einstein Hall of fame inductions  Hall of fame The Walhalla	0.3333333333333333	60	0.69920589878	0	0	1	1	0	0	0	1	0	0	0	1	0	0	0	0	0	3	0	0	0	0	0	0	0	1	0	2	0	0	0	0	1	1	0	0	0	1	0	0	0	1	0	0	0	0	0	3	0	0	0	0	0	0	0	1	0	2	0	0
88677448	Albert Einstein Series Written (or Contributed To) The Collected Papers of Albert Einstein	1.1	20	1.04403065089	0	0	0	0	2	2	1	3	1	2	0	0	0	0	2	2	1	3	1	2
88677448	Albert Einstein Member of  Organization Royal Society	1.1	60	0.943398113206	2	1	2	0	1	2	0	2	0	2	0	1	1	0	2	0	1	3	2	2	2	0	1	0	0	2	0	0	2	2	2	1	2	0	1	2	0	2	0	2	0	1	1	0	2	0	1	3	2	2	2	0	1	0	0	2	0	0	2	2
88677448	Albert Einstein Appears in ranked lists  List Time 100: The Most Important People of the Century	0.6	20	0.8	0	0	2	0	0	0	1	2	1	0	0	0	2	0	0	0	1	2	1	0
88677448	Albert Einstein Artwork on the Subject Albert Einstein Memorial	0.36666666666666664	60	0.706320670014	0	0	0	0	0	2	0	1	0	2	0	0	0	0	2	0	1	2	1	0	0	0	0	0	0	0	0	0	0	0	0	0	0	0	0	2	0	1	0	2	0	0	0	0	2	0	1	2	1	0	0	0	0	0	0	0	0	0	0	0
88677448	Albert Einstein Academic advisees Nathan Rosen	2.1481481481481484	54	0.970059322497	3	3	1	3	3	3	1	3	1	3	2	2	2	2	3	1	2	0	1	3	3	3	2	0	2	3	3	3	3	1	3	3	3	1	3	1	3	2	2	2	2	3	1	2	0	1	3	3	3	2	0	2	3	3
88677448	Albert Einstein Governance of  Organization Black Mountain College	0.5	16	0.707106781187	2	0	0	0	1	0	0	1	2	0	0	0	1	0	0	1
88677448	Albert Einstein Cause of death Abdominal aortic aneurysm	0.0	16	0.0	0	0	0	0	0	0	0	0	0	0	0	0	0	0	0	0
88677448	Albert Einstein Representations In Fiction Albert Einstein	0.2	60	0.47609522857	0	0	0	0	0	0	0	0	0	0	0	0	0	0	0	0	1	2	0	0	0	0	0	1	0	1	1	0	0	0	0	0	0	0	0	0	0	0	0	0	0	0	0	0	0	0	1	2	0	0	0	0	0	1	0	1	1	0	0	0
88677448	Albert Einstein Peers  Peers Werner Heisenberg	0.5555555555555556	54	0.916245694582	0	0	0	0	0	0	0	0	0	0	2	0	1	2	3	0	2	0	1	2	2	0	0	0	0	0	0	0	0	0	0	0	0	0	0	0	0	2	0	1	2	3	0	2	0	1	2	2	0	0	0	0	0	0
88677448	Albert Einstein Ethnicity Jewish people	0.08333333333333333	72	0.363241578628	0	0	0	0	0	0	0	0	0	0	0	0	0	0	0	0	0	0	0	0	0	2	1	0	0	0	0	0	0	0	0	0	0	0	0	0	0	0	0	0	0	0	0	0	0	0	0	0	0	0	0	0	0	0	0	0	0	2	1	0	0	0	0	0	0	0	0	0	0	0	0	0
88677448	Albert Einstein Religion Judaism	0.0	20	0.0	0	0	0	0	0	0	0	0	0	0	0	0	0	0	0	0	0	0	0	0
88677448	Albert Einstein Organizations founded Hebrew University of Jerusalem	0.75	72	0.982485510213	1	0	0	2	1	0	0	0	1	0	0	1	0	0	1	0	0	0	2	0	0	1	2	3	1	0	0	0	0	3	1	0	0	2	2	3	1	0	0	2	1	0	0	0	1	0	0	1	0	0	1	0	0	0	2	0	0	1	2	3	1	0	0	0	0	3	1	0	0	2	2	3
88677448	Albert Einstein Employment history  Employer Leiden University	1.8	10	1.16619037897	0	3	1	2	3	0	3	1	2	3
88677448	Albert Einstein Place of death Princeton	0.0	16	0.0	0	0	0	0	0	0	0	0	0	0	0	0	0	0	0	0
5249574948	Beijing Tour operators TravelChinaGuide	0.05263157894736842	38	0.223296878269	0	0	0	0	0	1	0	0	0	0	0	0	0	0	0	0	0	0	0	0	0	0	0	0	1	0	0	0	0	0	0	0	0	0	0	0	0	0
5249574948	Beijing Travel destinations served  Mode of transportation Air travel	0.0	42	0.0	0	0	0	0	0	0	0	0	0	0	0	0	0	0	0	0	0	0	0	0	0	0	0	0	0	0	0	0	0	0	0	0	0	0	0	0	0	0	0	0	0	0
5249574948	Beijing Olympics hosted 2008 Summer Olympics	0.0	38	0.0	0	0	0	0	0	0	0	0	0	0	0	0	0	0	0	0	0	0	0	0	0	0	0	0	0	0	0	0	0	0	0	0	0	0	0	0	0	0
5249574948	Beijing Olympics bid on  Olympic games 2008 Summer Olympics	0.0	42	0.0	0	0	0	0	0	0	0	0	0	0	0	0	0	0	0	0	0	0	0	0	0	0	0	0	0	0	0	0	0	0	0	0	0	0	0	0	0	0	0	0	0	0
5249574948	Beijing Exhibitions created about this subject Beijing 2008: A Photographic Journey	0.0	42	0.0	0	0	0	0	0	0	0	0	0	0	0	0	0	0	0	0	0	0	0	0	0	0	0	0	0	0	0	0	0	0	0	0	0	0	0	0	0	0	0	0	0	0
5249574948	Beijing Country China	0.0	43	0.0	0	0	0	0	0	0	0	0	0	0	0	0	0	0	0	0	0	0	0	0	0	0	0	0	0	0	0	0	0	0	0	0	0	0	0	0	0	0	0	0	0	0	0
5249574948	Beijing Accommodation Beijing Hotel	0.0	38	0.0	0	0	0	0	0	0	0	0	0	0	0	0	0	0	0	0	0	0	0	0	0	0	0	0	0	0	0	0	0	0	0	0	0	0	0	0	0	0
5249574948	Beijing Local transportation Beijing Subway	0.0	42	0.0	0	0	0	0	0	0	0	0	0	0	0	0	0	0	0	0	0	0	0	0	0	0	0	0	0	0	0	0	0	0	0	0	0	0	0	0	0	0	0	0	0	0
5249574948	Beijing How to get here  Mode of transportation Bus	0.0	42	0.0	0	0	0	0	0	0	0	0	0	0	0	0	0	0	0	0	0	0	0	0	0	0	0	0	0	0	0	0	0	0	0	0	0	0	0	0	0	0	0	0	0	0
5249574948	Beijing Time zone(s) China Time Zone	0.0	34	0.0	0	0	0	0	0	0	0	0	0	0	0	0	0	0	0	0	0	0	0	0	0	0	0	0	0	0	0	0	0	0	0	0	0	0
5249574948	Beijing Nearby airports Beijing Capital International Airport	0.0	42	0.0	0	0	0	0	0	0	0	0	0	0	0	0	0	0	0	0	0	0	0	0	0	0	0	0	0	0	0	0	0	0	0	0	0	0	0	0	0	0	0	0	0	0
5249574948	Beijing Climate  Month February	0.0	42	0.0	0	0	0	0	0	0	0	0	0	0	0	0	0	0	0	0	0	0	0	0	0	0	0	0	0	0	0	0	0	0	0	0	0	0	0	0	0	0	0	0	0	0
5249574948	Beijing Adjoins  Adjoins Hebei	0.0	42	0.0	0	0	0	0	0	0	0	0	0	0	0	0	0	0	0	0	0	0	0	0	0	0	0	0	0	0	0	0	0	0	0	0	0	0	0	0	0	0	0	0	0	0
5249574948	Beijing Newspapers People's Daily	0.0	42	0.0	0	0	0	0	0	0	0	0	0	0	0	0	0	0	0	0	0	0	0	0	0	0	0	0	0	0	0	0	0	0	0	0	0	0	0	0	0	0	0	0	0	0
5249574948	Beijing Contained by China	0.0	22	0.0	0	0	0	0	0	0	0	0	0	0	0	0	0	0	0	0	0	0	0	0	0	0
5249574948	Beijing Tourist attractions Beijing National Stadium	0.0	31	0.0	0	0	0	0	0	0	0	0	0	0	0	0	0	0	0	0	0	0	0	0	0	0	0	0	0	0	0	0	0	0	0
5249574948	Beijing Organizations with this scope Beijing Ultrasonic Co., Ltd	2.3333333333333335	42	0.776643163348	2	3	2	3	2	3	2	3	1	2	3	2	3	3	0	2	3	2	2	3	3	2	3	2	3	2	3	2	3	1	2	3	2	3	3	0	2	3	2	2	3	3
5249574948	Beijing Governing officials  Basic title Mayor	0.0	42	0.0	0	0	0	0	0	0	0	0	0	0	0	0	0	0	0	0	0	0	0	0	0	0	0	0	0	0	0	0	0	0	0	0	0	0	0	0	0	0	0	0	0	0
5249574948	Beijing Featured In Films Hero	0.0	42	0.0	0	0	0	0	0	0	0	0	0	0	0	0	0	0	0	0	0	0	0	0	0	0	0	0	0	0	0	0	0	0	0	0	0	0	0	0	0	0	0	0	0	0
5249574948	Beijing Events 2008 Summer Olympics	0.0	42	0.0	0	0	0	0	0	0	0	0	0	0	0	0	0	0	0	0	0	0	0	0	0	0	0	0	0	0	0	0	0	0	0	0	0	0	0	0	0	0	0	0	0	0
5295826848	Titanic Film Collections AFI's 100 Years...100 Movies	0.08333333333333333	96	0.276385399196	0	0	0	0	0	0	0	0	0	0	0	0	0	0	0	0	0	1	0	0	1	0	0	0	0	0	0	0	0	0	0	0	0	0	1	1	0	0	0	0	0	0	0	0	0	0	0	0	0	0	0	0	0	0	0	0	0	0	0	0	0	0	0	0	0	1	0	0	1	0	0	0	0	0	0	0	0	0	0	0	0	0	1	1	0	0	0	0	0	0	0	0	0	0	0	0
5295826848	Titanic Primary language English Language	0.0625	96	0.242061459138	0	0	0	0	0	0	0	0	0	0	1	0	0	0	0	0	0	1	0	0	0	0	0	0	0	0	0	0	1	0	0	0	0	0	0	0	0	0	0	0	0	0	0	0	0	0	0	0	0	0	0	0	0	0	0	0	0	0	1	0	0	0	0	0	0	1	0	0	0	0	0	0	0	0	0	0	1	0	0	0	0	0	0	0	0	0	0	0	0	0	0	0	0	0	0	0
5295826848	Titanic Gross revenue  Currency United States Dollar	0.020833333333333332	96	0.142826137508	0	0	0	0	0	0	0	0	0	0	0	0	0	0	0	0	0	1	0	0	0	0	0	0	0	0	0	0	0	0	0	0	0	0	0	0	0	0	0	0	0	0	0	0	0	0	0	0	0	0	0	0	0	0	0	0	0	0	0	0	0	0	0	0	0	1	0	0	0	0	0	0	0	0	0	0	0	0	0	0	0	0	0	0	0	0	0	0	0	0	0	0	0	0	0	0
5295826848	Titanic Dubbing performances  Language German Language	0.020833333333333332	96	0.142826137508	0	0	0	0	0	0	0	0	0	0	0	0	0	0	0	0	0	1	0	0	0	0	0	0	0	0	0	0	0	0	0	0	0	0	0	0	0	0	0	0	0	0	0	0	0	0	0	0	0	0	0	0	0	0	0	0	0	0	0	0	0	0	0	0	0	1	0	0	0	0	0	0	0	0	0	0	0	0	0	0	0	0	0	0	0	0	0	0	0	0	0	0	0	0	0	0
5295826848	Titanic Film format Super 35	0.10416666666666667	96	0.305476631221	0	0	0	0	0	0	0	0	0	0	0	0	0	0	0	0	0	1	0	0	1	1	0	0	0	0	0	0	1	0	0	0	0	0	0	0	0	0	0	0	0	0	0	0	1	0	0	0	0	0	0	0	0	0	0	0	0	0	0	0	0	0	0	0	0	1	0	0	1	1	0	0	0	0	0	0	1	0	0	0	0	0	0	0	0	0	0	0	0	0	0	0	1	0	0	0
5295826848	Titanic Things named after this Titanic Barbie Doll	0.02040816326530612	98	0.141391902659	0	0	0	0	0	0	0	0	0	0	0	0	0	0	0	0	0	0	1	0	0	0	0	0	0	0	0	0	0	0	0	0	0	0	0	0	0	0	0	0	0	0	0	0	0	0	0	0	0	0	0	0	0	0	0	0	0	0	0	0	0	0	0	0	0	0	0	1	0	0	0	0	0	0	0	0	0	0	0	0	0	0	0	0	0	0	0	0	0	0	0	0	0	0	0	0	0	0
5295826848	Titanic Featured Song My Heart Will Go On	2.783505154639175	97	0.541605176766	3	3	3	2	3	3	3	3	3	3	3	3	2	2	3	3	3	3	3	2	3	3	3	3	3	3	3	3	3	3	3	3	3	3	3	3	2	3	3	0	3	2	3	2	3	3	3	3	3	3	3	2	3	3	3	3	3	3	3	3	2	2	3	3	3	3	3	2	3	3	3	3	3	3	3	3	3	3	3	3	3	3	3	3	2	3	3	0	3	2	3	2	3	3	3	3	2
5295826848	Titanic Estimated budget  Currency United States Dollar	0.041666666666666664	96	0.199826313471	0	0	0	0	0	0	0	0	0	0	0	0	0	0	0	0	0	1	0	0	0	0	0	0	0	0	0	0	1	0	0	0	0	0	0	0	0	0	0	0	0	0	0	0	0	0	0	0	0	0	0	0	0	0	0	0	0	0	0	0	0	0	0	0	0	1	0	0	0	0	0	0	0	0	0	0	1	0	0	0	0	0	0	0	0	0	0	0	0	0	0	0	0	0	0	0
5295826848	Titanic Subjects Tragedy	0.041666666666666664	96	0.199826313471	0	0	0	0	0	0	0	0	0	0	0	0	0	0	0	0	0	1	0	0	0	0	0	0	0	0	0	0	0	0	0	0	0	0	0	0	0	0	0	0	0	0	1	0	0	0	0	0	0	0	0	0	0	0	0	0	0	0	0	0	0	0	0	0	0	1	0	0	0	0	0	0	0	0	0	0	0	0	0	0	0	0	0	0	0	0	0	0	0	0	1	0	0	0	0	0
5295826848	Titanic Soundtrack Titanic: Music from the Motion Picture	2.8958333333333335	96	0.367399835178	3	3	3	3	3	3	3	3	3	3	3	3	3	3	3	3	3	2	1	3	3	3	3	3	3	3	3	2	3	3	3	2	3	3	3	3	3	3	3	3	3	3	3	3	3	3	3	3	3	3	3	3	3	3	3	3	3	3	3	3	3	3	3	3	3	2	1	3	3	3	3	3	3	3	3	2	3	3	3	2	3	3	3	3	3	3	3	3	3	3	3	3	3	3	3	3
5295826848	Titanic Set Decoration by Michael D. Ford	0.021739130434782608	92	0.145830520272	0	0	0	0	0	0	0	0	0	0	0	0	0	0	0	1	0	0	0	0	0	0	0	0	0	0	0	0	0	0	0	0	0	0	0	0	0	0	0	0	0	0	0	0	0	0	0	0	0	0	0	0	0	0	0	0	0	0	0	0	0	1	0	0	0	0	0	0	0	0	0	0	0	0	0	0	0	0	0	0	0	0	0	0	0	0	0	0	0	0	0	0
5295826848	Titanic Appears in ranked lists  List The Movie List: the first 9200	0.045454545454545456	88	0.208298895225	0	0	0	0	0	0	0	0	0	0	0	0	0	1	0	0	0	0	0	0	0	0	0	0	1	0	0	0	0	0	0	0	0	0	0	0	0	0	0	0	0	0	0	0	0	0	0	0	0	0	0	0	0	0	0	0	0	1	0	0	0	0	0	0	0	0	0	0	1	0	0	0	0	0	0	0	0	0	0	0	0	0	0	0	0	0	0	0
5295826848	Titanic Costume design by Deborah Lynn Scott	0.021739130434782608	92	0.145830520272	0	0	0	0	0	0	0	0	0	0	0	0	0	0	0	1	0	0	0	0	0	0	0	0	0	0	0	0	0	0	0	0	0	0	0	0	0	0	0	0	0	0	0	0	0	0	0	0	0	0	0	0	0	0	0	0	0	0	0	0	0	1	0	0	0	0	0	0	0	0	0	0	0	0	0	0	0	0	0	0	0	0	0	0	0	0	0	0	0	0	0	0
5295826848	Titanic Production design by Peter Lamont	0.04081632653061224	98	0.197864483976	0	0	0	0	0	0	0	0	0	0	0	0	0	0	0	0	0	0	1	0	0	0	0	0	0	0	0	0	0	0	0	0	0	0	0	0	0	0	0	0	0	0	0	0	0	1	0	0	0	0	0	0	0	0	0	0	0	0	0	0	0	0	0	0	0	0	0	1	0	0	0	0	0	0	0	0	0	0	0	0	0	0	0	0	0	0	0	0	0	0	0	0	0	0	1	0	0	0
5295826848	Titanic Rated PG-13 (USA)	0.022727272727272728	88	0.149032693734	0	0	0	0	0	0	0	0	0	0	0	0	0	1	0	0	0	0	0	0	0	0	0	0	0	0	0	0	0	0	0	0	0	0	0	0	0	0	0	0	0	0	0	0	0	0	0	0	0	0	0	0	0	0	0	0	0	1	0	0	0	0	0	0	0	0	0	0	0	0	0	0	0	0	0	0	0	0	0	0	0	0	0	0	0	0	0	0
5295826848	Titanic Casting director Mali Finn	0.043010752688172046	93	0.202881314668	0	0	0	0	0	0	0	0	0	0	0	0	0	0	0	1	0	0	0	0	0	0	0	0	0	0	0	0	0	0	0	0	0	0	0	0	0	0	0	0	0	0	1	0	0	0	0	0	0	0	0	0	0	0	0	0	0	0	0	0	0	1	0	0	0	0	0	0	0	0	0	0	0	0	0	0	0	0	0	0	0	0	0	0	0	0	0	0	1	0	0	0	0
5295826848	Titanic Cinematography Russell Carpenter	0.0	25	0.0	0	0	0	0	0	0	0	0	0	0	0	0	0	0	0	0	0	0	0	0	0	0	0	0	0
5295826848	Titanic Art direction by Charles Lee	0.11764705882352941	102	0.378182382784	0	0	0	0	0	0	0	0	0	0	2	0	0	1	0	0	0	0	0	0	1	0	0	0	0	0	0	0	0	0	0	0	1	0	0	0	0	0	0	0	0	0	0	0	0	1	0	0	0	0	0	0	0	0	0	0	0	0	0	0	0	2	0	0	1	0	0	0	0	0	0	1	0	0	0	0	0	0	0	0	0	0	0	1	0	0	0	0	0	0	0	0	0	0	0	0	1	0	0	0	0	0
5295826848	Titanic Music by James Horner	2.5	24	0.866025403784	3	2	3	2	2	3	0	3	3	3	3	3	3	2	3	2	2	3	0	3	3	3	3	3
5295826848	Titanic Production companies Paramount Pictures	0.0	14	0.0	0	0	0	0	0	0	0	0	0	0	0	0	0	0
5354845548	United Nations Force Deployments  Military Conflict United Nations Operation in the Congo	0.0	24	0.0	0	0	0	0	0	0	0	0	0	0	0	0	0	0	0	0	0	0	0	0	0	0	0	0
5354845548	United Nations Military Commanders  Military Conflict War in Darfur	0.0	34	0.0	0	0	0	0	0	0	0	0	0	0	0	0	0	0	0	0	0	0	0	0	0	0	0	0	0	0	0	0	0	0	0	0	0	0
5354845548	United Nations Subjects A Contrario	0.0	24	0.0	0	0	0	0	0	0	0	0	0	0	0	0	0	0	0	0	0	0	0	0	0	0	0	0
5354845548	United Nations Offices/Positions Within the Body President of the United Nations General Assembly	0.75	24	0.924211375534	1	0	2	0	2	0	0	2	0	2	0	0	1	0	2	0	2	0	0	2	0	2	0	0
5354845548	United Nations Programs with this subject Pauline Frederick at the U.N.	0.0	24	0.0	0	0	0	0	0	0	0	0	0	0	0	0	0	0	0	0	0	0	0	0	0	0	0	0
5354845548	United Nations Geographic scope World	0.23529411764705882	34	0.545506970323	0	0	1	0	0	0	0	0	0	0	2	0	1	0	0	0	0	0	0	1	0	0	0	0	0	0	0	2	0	1	0	0	0	0
5354845548	United Nations Place founded Lake Success	0.5882352941176471	34	0.844276476142	0	0	1	0	2	2	0	1	0	0	0	2	2	0	0	0	0	0	0	1	0	2	2	0	1	0	0	0	2	2	0	0	0	0
5354845548	United Nations Subject of Black History Month Enhanced by International Year for People of African Descent	0.0	35	0.0	0	0	0	0	0	0	0	0	0	0	0	0	0	0	0	0	0	0	0	0	0	0	0	0	0	0	0	0	0	0	0	0	0	0	0
5354845548	United Nations Exhibitions sponsored  Venue Chelsea Art Museum	0.0	24	0.0	0	0	0	0	0	0	0	0	0	0	0	0	0	0	0	0	0	0	0	0	0	0	0	0
5354845548	United Nations TV programs Created 21st Century	0.0	35	0.0	0	0	0	0	0	0	0	0	0	0	0	0	0	0	0	0	0	0	0	0	0	0	0	0	0	0	0	0	0	0	0	0	0	0	0
5354845548	United Nations Sectors Law	0.0	35	0.0	0	0	0	0	0	0	0	0	0	0	0	0	0	0	0	0	0	0	0	0	0	0	0	0	0	0	0	0	0	0	0	0	0	0	0
5354845548	United Nations Members  Officeholder Lester B. Pearson	0.4166666666666667	24	0.640095478989	0	0	1	0	1	0	0	1	0	0	2	0	0	0	1	0	1	0	0	1	0	0	2	0
5354845548	United Nations Organizations founded UN Women	0.2	30	0.541602560309	0	0	0	0	1	0	0	0	0	0	2	0	0	0	0	0	0	0	0	1	0	0	0	0	0	2	0	0	0	0
5354845548	United Nations Headquarters  City/Town New York City	2.75	24	0.829156197589	3	3	3	3	3	0	3	3	3	3	3	3	3	3	3	3	3	0	3	3	3	3	3	3
5354845548	United Nations Military Conflicts  Conflict Korean War	0.0	24	0.0	0	0	0	0	0	0	0	0	0	0	0	0	0	0	0	0	0	0	0	0	0	0	0	0
5354845548	United Nations Leadership  Person Kofi Annan	0.4117647058823529	34	0.691020007322	0	0	1	0	1	0	0	2	0	0	2	0	1	0	0	0	0	0	0	1	0	1	0	0	2	0	0	2	0	1	0	0	0	0
5354845548	United Nations Quotations About This Subject The United Nations is designed to make possible lasting freedom and independence for all its members.	0.0	34	0.0	0	0	0	0	0	0	0	0	0	0	0	0	0	0	0	0	0	0	0	0	0	0	0	0	0	0	0	0	0	0	0	0	0	0
5354845548	United Nations Things named after this 6000 United Nations	0.0	30	0.0	0	0	0	0	0	0	0	0	0	0	0	0	0	0	0	0	0	0	0	0	0	0	0	0	0	0	0	0	0	0
5354845548	United Nations Founders United Kingdom	0.5	24	0.866025403784	0	0	2	0	0	2	0	2	0	0	0	0	0	0	2	0	0	2	0	2	0	0	0	0
5354845548	United Nations Awards Won  Award category Peabody Award	0.0	24	0.0	0	0	0	0	0	0	0	0	0	0	0	0	0	0	0	0	0	0	0	0	0	0	0	0
5578775448	Stanley Kubrick Structures Owned  Structure Childwickbury Manor	0.0625	96	0.242061459138	0	0	1	0	0	0	0	0	0	1	0	0	0	0	0	0	0	0	0	0	0	0	0	0	0	0	0	0	0	0	0	0	0	0	0	0	0	1	0	0	0	0	0	0	0	0	0	0	0	0	1	0	0	0	0	0	0	1	0	0	0	0	0	0	0	0	0	0	0	0	0	0	0	0	0	0	0	0	0	0	0	0	0	0	0	1	0	0	0	0	0	0	0	0	0	0
5578775448	Stanley Kubrick Place of burial Childwickbury Manor	0.0	96	0.0	0	0	0	0	0	0	0	0	0	0	0	0	0	0	0	0	0	0	0	0	0	0	0	0	0	0	0	0	0	0	0	0	0	0	0	0	0	0	0	0	0	0	0	0	0	0	0	0	0	0	0	0	0	0	0	0	0	0	0	0	0	0	0	0	0	0	0	0	0	0	0	0	0	0	0	0	0	0	0	0	0	0	0	0	0	0	0	0	0	0	0	0	0	0	0	0
5578775448	Stanley Kubrick Cause of death Myocardial infarction	0.020833333333333332	96	0.142826137508	0	0	0	0	0	0	0	0	0	0	0	0	0	0	0	0	0	0	0	0	0	0	0	0	0	0	0	0	0	1	0	0	0	0	0	0	0	0	0	0	0	0	0	0	0	0	0	0	0	0	0	0	0	0	0	0	0	0	0	0	0	0	0	0	0	0	0	0	0	0	0	0	0	0	0	0	0	1	0	0	0	0	0	0	0	0	0	0	0	0	0	0	0	0	0	0
5578775448	Stanley Kubrick Films edited Fear and Desire	1.6666666666666667	30	0.942809041582	2	3	2	1	3	1	2	2	0	2	1	2	0	3	1	2	3	2	1	3	1	2	2	0	2	1	2	0	3	1
5578775448	Stanley Kubrick Film cinematography credits Fear and Desire	2.0	30	0.816496580928	2	3	2	2	3	3	2	2	1	2	2	2	0	3	1	2	3	2	2	3	3	2	2	1	2	2	2	0	3	1
5578775448	Stanley Kubrick Religion Judaism	0.020833333333333332	96	0.142826137508	0	0	0	0	0	0	0	0	0	0	0	0	0	0	0	0	0	0	0	0	0	0	0	0	0	0	0	0	0	1	0	0	0	0	0	0	0	0	0	0	0	0	0	0	0	0	0	0	0	0	0	0	0	0	0	0	0	0	0	0	0	0	0	0	0	0	0	0	0	0	0	0	0	0	0	0	0	1	0	0	0	0	0	0	0	0	0	0	0	0	0	0	0	0	0	0
5578775448	Stanley Kubrick Employment history  Employer Cowles Media Company	0.8571428571428571	84	1.03674005034	0	0	0	0	0	1	0	0	1	0	1	0	0	1	1	1	0	0	0	0	0	0	1	0	0	1	0	3	2	1	0	1	2	3	0	2	2	3	3	3	2	1	0	0	0	0	0	1	0	0	1	0	1	0	0	1	1	1	0	0	0	0	0	0	1	0	0	1	0	3	2	1	0	1	2	3	0	2	2	3	3	3	2	1
5578775448	Stanley Kubrick Ethnicity Jewish people	0.0196078431372549	102	0.138648388468	0	0	0	0	0	0	0	0	0	0	0	0	0	0	0	0	0	0	0	0	0	0	0	0	0	0	0	0	0	0	0	0	0	0	0	0	0	0	0	0	1	0	0	0	0	0	0	0	0	0	0	0	0	0	0	0	0	0	0	0	0	0	0	0	0	0	0	0	0	0	0	0	0	0	0	0	0	0	0	0	0	0	0	0	0	0	0	0	0	0	0	1	0	0	0	0	0	0	0	0	0	0
5578775448	Stanley Kubrick Place of death St Albans	0.0	18	0.0	0	0	0	0	0	0	0	0	0	0	0	0	0	0	0	0	0	0
5578775448	Stanley Kubrick Spouse (or domestic partner)  Type of union Marriage	0.0	102	0.0	0	0	0	0	0	0	0	0	0	0	0	0	0	0	0	0	0	0	0	0	0	0	0	0	0	0	0	0	0	0	0	0	0	0	0	0	0	0	0	0	0	0	0	0	0	0	0	0	0	0	0	0	0	0	0	0	0	0	0	0	0	0	0	0	0	0	0	0	0	0	0	0	0	0	0	0	0	0	0	0	0	0	0	0	0	0	0	0	0	0	0	0	0	0	0	0	0	0	0	0	0	0
5578775448	Stanley Kubrick Parents Jacques Leonard Kubrick	0.0	90	0.0	0	0	0	0	0	0	0	0	0	0	0	0	0	0	0	0	0	0	0	0	0	0	0	0	0	0	0	0	0	0	0	0	0	0	0	0	0	0	0	0	0	0	0	0	0	0	0	0	0	0	0	0	0	0	0	0	0	0	0	0	0	0	0	0	0	0	0	0	0	0	0	0	0	0	0	0	0	0	0	0	0	0	0	0	0	0	0	0	0	0
5578775448	Stanley Kubrick Siblings  Sibling Barbara Kubrick	0.0	90	0.0	0	0	0	0	0	0	0	0	0	0	0	0	0	0	0	0	0	0	0	0	0	0	0	0	0	0	0	0	0	0	0	0	0	0	0	0	0	0	0	0	0	0	0	0	0	0	0	0	0	0	0	0	0	0	0	0	0	0	0	0	0	0	0	0	0	0	0	0	0	0	0	0	0	0	0	0	0	0	0	0	0	0	0	0	0	0	0	0	0	0
5578775448	Stanley Kubrick Education  Institution Columbia University	0.0	24	0.0	0	0	0	0	0	0	0	0	0	0	0	0	0	0	0	0	0	0	0	0	0	0	0	0
5578775448	Stanley Kubrick Films Produced Full Metal Jacket	2.372093023255814	86	0.682786895623	3	3	2	3	2	3	2	1	3	1	3	2	2	2	1	2	3	2	3	3	3	3	2	3	3	3	2	3	2	2	3	2	2	3	1	3	2	3	1	3	2	3	2	3	3	2	3	2	3	2	1	3	1	3	2	2	2	1	2	3	2	3	3	3	3	2	3	3	3	2	3	2	2	3	2	2	3	1	3	2	3	1	3	2	3	2
5578775448	Stanley Kubrick Children Vivian Kubrick	0.0	24	0.0	0	0	0	0	0	0	0	0	0	0	0	0	0	0	0	0	0	0	0	0	0	0	0	0
5578775448	Stanley Kubrick Places lived  Location New York City	0.0	90	0.0	0	0	0	0	0	0	0	0	0	0	0	0	0	0	0	0	0	0	0	0	0	0	0	0	0	0	0	0	0	0	0	0	0	0	0	0	0	0	0	0	0	0	0	0	0	0	0	0	0	0	0	0	0	0	0	0	0	0	0	0	0	0	0	0	0	0	0	0	0	0	0	0	0	0	0	0	0	0	0	0	0	0	0	0	0	0	0	0	0	0
5578775448	Stanley Kubrick Influenced By H. P. Lovecraft	1.2549019607843137	102	0.882135049349	2	2	1	0	2	2	0	1	0	1	0	2	1	1	2	1	2	3	2	2	0	1	1	3	1	1	0	2	2	2	1	0	0	2	1	1	0	2	2	1	0	2	2	1	3	2	1	1	2	0	0	2	2	1	0	2	2	0	1	0	1	0	2	1	1	2	1	2	3	2	2	0	1	1	3	1	1	0	2	2	2	1	0	0	2	1	1	0	2	2	1	0	2	2	1	3	2	1	1	2	0	0
5578775448	Stanley Kubrick Film writing credits Full Metal Jacket	2.1627906976744184	86	0.833324319403	2	3	2	2	2	2	2	0	3	2	3	1	2	2	1	2	2	2	3	3	3	2	2	3	3	3	2	3	3	2	3	0	2	2	2	0	3	3	1	3	2	3	2	2	3	2	2	2	2	2	0	3	2	3	1	2	2	1	2	2	2	3	3	3	2	2	3	3	3	2	3	3	2	3	0	2	2	2	0	3	3	1	3	2	3	2
5578775448	Stanley Kubrick Place of birth The Bronx	0.0	14	0.0	0	0	0	0	0	0	0	0	0	0	0	0	0	0
5578775448	Stanley Kubrick Fictional Characters Created HAL 9000	1.8333333333333333	96	0.964653075233	3	3	2	1	3	2	0	2	1	2	3	3	0	3	2	3	2	0	2	1	2	2	1	1	2	2	2	2	0	2	2	1	2	3	2	3	2	2	2	2	0	3	3	0	3	2	0	2	3	3	2	1	3	2	0	2	1	2	3	3	0	3	2	3	2	0	2	1	2	2	1	1	2	2	2	2	0	2	2	1	2	3	2	3	2	2	2	2	0	3	3	0	3	2	0	2
7057716748	Richard Burton Dedications  Work Dedicated Nineteen Eighty-Four	0.41025641025641024	78	0.741376015118	0	0	0	0	0	0	0	0	0	2	0	0	0	1	0	3	0	0	1	0	0	2	0	0	2	0	0	0	1	1	0	1	1	0	0	0	0	1	0	0	0	0	0	0	0	0	0	0	2	0	0	0	1	0	3	0	0	1	0	0	2	0	0	2	0	0	0	1	1	0	1	1	0	0	0	0	1	0
7057716748	Richard Burton Service  Military Force Royal Air Force	0.02564102564102564	78	0.158061897512	0	0	0	0	0	0	0	0	0	0	0	0	0	0	0	0	0	0	0	0	0	0	0	0	1	0	0	0	0	0	0	0	0	0	0	0	0	0	0	0	0	0	0	0	0	0	0	0	0	0	0	0	0	0	0	0	0	0	0	0	0	0	0	1	0	0	0	0	0	0	0	0	0	0	0	0	0	0
7057716748	Richard Burton Representations In Fiction Richard Burton	0.7272727272727273	88	0.888400922077	0	0	2	0	0	0	0	0	0	0	2	0	0	0	2	0	2	1	2	0	1	0	2	2	0	0	2	2	0	2	1	2	0	0	2	0	1	2	1	1	0	0	0	0	0	0	2	0	0	0	0	0	0	0	2	0	0	0	2	0	2	1	2	0	1	0	2	2	0	0	2	2	0	2	1	2	0	0	2	0	1	2	1	1	0	0	0	0
7057716748	Richard Burton Theater Roles  Play Camelot	0.6666666666666666	78	0.857346333195	0	0	2	2	0	0	0	0	0	0	0	0	0	2	0	3	0	0	2	0	0	2	2	0	1	1	0	1	1	1	0	1	2	1	1	1	0	0	0	0	0	2	2	0	0	0	0	0	0	0	0	0	2	0	3	0	0	2	0	0	2	2	0	1	1	0	1	1	1	0	1	2	1	1	1	0	0	0
7057716748	Richard Burton Cause of death Cerebral hemorrhage	0.05063291139240506	79	0.219246937667	0	0	0	0	0	0	0	0	0	0	0	0	0	0	0	0	0	0	1	0	0	0	0	0	1	0	0	0	0	0	0	0	0	0	0	0	0	0	0	0	0	0	0	0	0	0	0	0	0	0	0	0	0	0	0	0	0	1	0	0	0	0	0	1	0	0	0	0	0	0	0	0	0	0	0	0	0	0	0
7057716748	Richard Burton Religion Presbyterianism	0.05128205128205128	78	0.316123795024	0	0	0	0	0	0	0	0	0	0	0	0	0	0	0	0	0	0	0	0	0	0	0	0	2	0	0	0	0	0	0	0	0	0	0	0	0	0	0	0	0	0	0	0	0	0	0	0	0	0	0	0	0	0	0	0	0	0	0	0	0	0	0	2	0	0	0	0	0	0	0	0	0	0	0	0	0	0
7057716748	Richard Burton Ethnicity Welsh people	0.0	88	0.0	0	0	0	0	0	0	0	0	0	0	0	0	0	0	0	0	0	0	0	0	0	0	0	0	0	0	0	0	0	0	0	0	0	0	0	0	0	0	0	0	0	0	0	0	0	0	0	0	0	0	0	0	0	0	0	0	0	0	0	0	0	0	0	0	0	0	0	0	0	0	0	0	0	0	0	0	0	0	0	0	0	0	0	0	0	0	0	0
7057716748	Richard Burton Films Produced The Taming of the Shrew	1.564102564102564	78	1.12762222704	0	2	2	2	0	3	0	0	3	1	3	1	2	2	0	3	1	3	2	1	2	2	3	3	0	3	1	1	1	2	0	0	3	1	1	1	3	3	0	0	2	2	2	0	3	0	0	3	1	3	1	2	2	0	3	1	3	2	1	2	2	3	3	0	3	1	1	1	2	0	0	3	1	1	1	3	3	0
7057716748	Richard Burton Place of death Céligny	0.0	72	0.0	0	0	0	0	0	0	0	0	0	0	0	0	0	0	0	0	0	0	0	0	0	0	0	0	0	0	0	0	0	0	0	0	0	0	0	0	0	0	0	0	0	0	0	0	0	0	0	0	0	0	0	0	0	0	0	0	0	0	0	0	0	0	0	0	0	0	0	0	0	0	0	0
7057716748	Richard Burton Films directed Doctor Faustus	1.1333333333333333	15	0.95684667296	0	2	2	2	0	2	0	0	2	2	2	0	2	0	1
