5295826848	Titanic Produced by James Cameron	0.0	6	0.0	0	0	0	0	0	0
5295826848	Titanic Directed by James Cameron	0.0	6	0.0	0	0	0	0	0	0
5295826848	Titanic Edited by James Cameron	0.0	7	0.0	0	0	0	0	0	0	0
5295826848	Titanic Distributors  Film distribution medium DVD	0.09523809523809523	84	0.293543523951	0	0	0	0	0	0	0	0	0	0	0	1	0	0	0	0	1	0	0	0	0	0	1	0	0	0	0	0	0	0	0	0	0	0	0	0	0	0	1	0	0	0	0	0	0	0	0	0	0	0	0	0	0	1	0	0	0	0	1	0	0	0	0	0	1	0	0	0	0	0	0	0	0	0	0	0	0	0	0	0	1	0	0	0
5354845548	United Nations Employees and other personnel  Person Kofi Annan	0.4	20	0.663324958071	1	0	0	2	0	1	0	0	0	0	1	0	0	2	0	1	0	0	0	0
5354845548	United Nations Child  Child World Health Organization	0.0	14	0.0	0	0	0	0	0	0	0	0	0	0	0	0	0	0
5354845548	United Nations Works written GEO-2000	0.0	10	0.0	0	0	0	0	0	0	0	0	0	0
5354845548	United Nations Members  Member United Kingdom	0.2	20	0.4	1	0	0	0	0	1	0	0	0	0	1	0	0	0	0	1	0	0	0	0
5578775448	Stanley Kubrick Award Nominations  Award Nominee Arthur C. Clarke	1.6666666666666667	18	0.816496580928	2	0	2	2	1	2	1	3	2	2	0	2	2	1	2	1	3	2
5578775448	Stanley Kubrick Films appeared in  Type of Appearance Him/Herself	1.1428571428571428	84	1.05945692673	1	0	0	2	0	2	0	0	1	0	1	0	0	0	2	2	0	1	1	3	2	1	0	3	2	0	1	0	2	1	1	2	3	3	0	0	3	1	2	3	1	1	1	0	0	2	0	2	0	0	1	0	1	0	0	0	2	2	0	1	1	3	2	1	0	3	2	0	1	0	2	1	1	2	3	3	0	0	3	1	2	3	1	1
5578775448	Stanley Kubrick Works written Stanley Kubrick	1.4285714285714286	7	0.494871659305	1	2	1	1	2	1	2
5578775448	Stanley Kubrick Awards Won  Award winner Arthur C. Clarke	1.619047619047619	84	0.949997016346	2	0	2	2	1	2	1	3	2	2	2	0	1	1	3	1	1	1	1	3	2	1	3	3	2	2	2	3	3	2	0	2	3	1	1	1	2	0	0	2	0	2	2	0	2	2	1	2	1	3	2	2	2	0	1	1	3	1	1	1	1	3	2	1	3	3	2	2	2	3	3	2	0	2	3	1	1	1	2	0	0	2	0	2
5578775448	Stanley Kubrick Influenced Robin Williams	1.2142857142857142	84	0.802843585718	1	0	1	1	2	2	1	2	1	2	1	0	1	1	2	1	0	0	2	2	2	0	0	3	2	1	1	0	2	2	1	2	2	2	1	2	1	1	1	2	0	0	1	0	1	1	2	2	1	2	1	2	1	0	1	1	2	1	0	0	2	2	2	0	0	3	2	1	1	0	2	2	1	2	2	2	1	2	1	1	1	2	0	0
5578775448	Stanley Kubrick Film performances  Special Performance Type Voice	0.3333333333333333	6	0.471404520791	0	0	1	0	0	1
5578775448	Stanley Kubrick Profession Film director	2.3333333333333335	6	0.471404520791	2	2	3	2	2	3
5578775448	Stanley Kubrick Gender Male	0.0	6	0.0	0	0	0	0	0	0
7057716748	Richard Burton Recordings Brave New World	0.17647058823529413	17	0.381220041083	0	1	0	0	0	0	0	0	0	1	0	0	0	0	0	0	1
7057716748	Richard Burton Albums Camelot (1960 original Broadway cast)	0.18181818181818182	11	0.38569460792	0	1	0	0	0	0	1	0	0	0	0
7057716748	Richard Burton Recording contributions  Recording Brave New World	0.5	16	0.866025403784	0	2	0	0	0	0	0	2	0	2	0	0	0	0	0	2
7057716748	Richard Burton Awards Won  Award winner Julie Andrews	0.32432432432432434	74	0.572054337527	0	1	0	0	0	0	0	1	0	0	0	1	0	0	0	0	2	0	0	0	0	0	1	1	1	0	0	1	0	0	2	0	0	1	0	0	0	0	1	0	0	0	0	0	1	0	0	0	1	0	0	0	0	2	0	0	0	0	0	1	1	1	0	0	1	0	0	2	0	0	1	0	0	0
7057716748	Richard Burton Award Nominations  Award Academy Award for Best Actor in a Supporting Role	0.7297297297297297	74	0.793509094914	0	0	0	2	0	0	0	2	0	0	0	2	0	1	0	1	2	0	1	2	1	2	0	1	1	0	1	2	0	1	2	1	0	1	0	1	0	0	0	0	2	0	0	0	2	0	0	0	2	0	1	0	1	2	0	1	2	1	2	0	1	1	0	1	2	0	1	2	1	0	1	0	1	0
7057716748	Richard Burton TV episode performances  Episode The Gathering Storm	0.8918918918918919	74	0.952487037119	0	2	0	2	0	0	0	1	0	2	0	2	0	3	0	0	2	0	0	2	3	0	0	1	1	1	2	1	0	1	2	0	1	1	1	2	0	0	2	0	2	0	0	0	1	0	2	0	2	0	3	0	0	2	0	0	2	3	0	0	1	1	1	2	1	0	1	2	0	1	1	1	2	0
7057716748	Richard Burton Film performances  Special Performance Type Narrator	0.875	16	0.927024810887	0	2	0	2	0	1	0	2	0	2	0	2	0	1	0	2
7057716748	Richard Burton Works written A Christmas story	0.45454545454545453	11	0.782029569731	0	2	0	0	0	0	2	0	0	0	1
7057716748	Richard Burton Profession Actor	0.2727272727272727	11	0.445361771415	0	0	0	0	1	0	0	0	0	1	1
7176525248	Jacques-Yves Cousteau Awards Won  Award category Academy Award for Best Documentary Feature	0.075	80	0.46837484988	0	0	0	0	0	0	0	0	0	0	0	0	0	0	0	0	0	0	0	0	0	0	0	0	0	0	0	0	0	0	0	0	0	0	0	0	0	3	0	0	0	0	0	0	0	0	0	0	0	0	0	0	0	0	0	0	0	0	0	0	0	0	0	0	0	0	0	0	0	0	0	0	0	0	0	0	0	3	0	0
7176525248	Jacques-Yves Cousteau Award Nominations  Award Academy Award for Best Documentary Feature	0.08571428571428572	70	0.499795876701	0	0	0	0	0	0	0	0	0	0	0	0	0	0	0	0	0	0	0	0	0	0	0	0	0	0	0	0	0	0	0	0	3	0	0	0	0	0	0	0	0	0	0	0	0	0	0	0	0	0	0	0	0	0	0	0	0	0	0	0	0	0	0	0	0	0	0	3	0	0
7176525248	Jacques-Yves Cousteau Works written The Whale	0.08450704225352113	71	0.496366484133	0	0	0	0	0	0	0	0	0	0	0	0	0	0	0	0	0	0	0	0	0	0	0	0	0	0	0	0	0	0	0	0	3	0	0	0	0	0	0	0	0	0	0	0	0	0	0	0	0	0	0	0	0	0	0	0	0	0	0	0	0	0	0	0	0	0	0	3	0	0	0
7176525248	Jacques-Yves Cousteau Profession Film director	0.08823529411764706	68	0.506873174695	0	0	0	0	0	0	0	0	0	0	0	0	0	0	0	0	0	0	0	0	0	0	0	0	0	0	0	0	0	0	0	3	0	0	0	0	0	0	0	0	0	0	0	0	0	0	0	0	0	0	0	0	0	0	0	0	0	0	0	0	0	0	0	0	0	3	0	0
7176525248	Jacques-Yves Cousteau Film performances  Special Performance Type Narrator	0.08823529411764706	68	0.506873174695	0	0	0	0	0	0	0	0	0	0	0	0	0	0	0	0	0	0	0	0	0	0	0	0	0	0	0	0	0	0	0	3	0	0	0	0	0	0	0	0	0	0	0	0	0	0	0	0	0	0	0	0	0	0	0	0	0	0	0	0	0	0	0	0	0	3	0	0
7176525248	Jacques-Yves Cousteau Gender Male	0.17647058823529413	68	0.567273574176	0	0	0	0	0	0	0	0	0	1	0	0	0	0	0	0	0	0	0	0	1	0	0	0	0	0	0	0	0	1	0	3	0	0	0	0	0	0	0	0	0	0	0	1	0	0	0	0	0	0	0	0	0	0	1	0	0	0	0	0	0	0	0	1	0	3	0	0
7176525248	Jacques-Yves Cousteau Children Philippe Cousteau	1.8	80	0.6	2	1	1	2	2	2	2	1	2	1	2	1	2	2	2	2	3	2	3	2	2	1	1	1	2	3	2	2	1	2	2	2	2	2	1	2	1	3	1	2	2	1	1	2	2	2	2	1	2	1	2	1	2	2	2	2	3	2	3	2	2	1	1	1	2	3	2	2	1	2	2	2	2	2	1	2	1	3	1	2
7176525248	Jacques-Yves Cousteau Education  Institution École Navale	0.08823529411764706	68	0.506873174695	0	0	0	0	0	0	0	0	0	0	0	0	0	0	0	0	0	0	0	0	0	0	0	0	0	0	0	0	0	0	0	3	0	0	0	0	0	0	0	0	0	0	0	0	0	0	0	0	0	0	0	0	0	0	0	0	0	0	0	0	0	0	0	0	0	3	0	0
7176525248	Jacques-Yves Cousteau Place of birth Saint-André-de-Cubzac	0.11764705882352941	68	0.529411764706	0	0	0	0	0	0	0	0	0	0	0	1	0	0	0	0	0	0	0	0	0	0	0	0	0	0	0	0	0	0	0	3	0	0	0	0	0	0	0	0	0	0	0	0	0	1	0	0	0	0	0	0	0	0	0	0	0	0	0	0	0	0	0	0	0	3	0	0
7176525248	Jacques-Yves Cousteau Country of nationality France	0.08823529411764706	68	0.506873174695	0	0	0	0	0	0	0	0	0	0	0	0	0	0	0	0	0	0	0	0	0	0	0	0	0	0	0	0	0	0	0	3	0	0	0	0	0	0	0	0	0	0	0	0	0	0	0	0	0	0	0	0	0	0	0	0	0	0	0	0	0	0	0	0	0	3	0	0
7876784948	Cameroon Contains Douala	2.4	10	0.8	3	3	1	2	3	3	3	1	2	3
7876784948	Cameroon People born here Wes Madiko	0.2	10	0.4	0	0	0	0	1	0	0	0	0	1
7876784948	Cameroon Organizations with this scope Cameroon People's Democratic Movement	1.4	10	0.8	1	0	2	2	2	1	0	2	2	2
7876784948	Cameroon Athletes  Olympics The London 2012 Summer Olympics	0.0	13	0.0	0	0	0	0	0	0	0	0	0	0	0	0	0
7876784948	Cameroon Partially contains  Partially contains Congo River	1.7777777777777777	18	1.13311544747	3	3	2	0	3	2	0	2	1	3	3	2	0	3	2	0	2	1
7876784948	Cameroon Partially contains Congo River	1.7777777777777777	18	1.13311544747	3	3	2	0	3	2	0	2	1	3	3	2	0	3	2	0	2	1
7876784948	Cameroon GDP (nominal)  Currency United States Dollar	0.6923076923076923	13	0.910166120477	0	0	0	2	0	2	0	0	0	2	0	2	1
7876784948	Cameroon Athletic performances  Medal Gold medal	0.0	10	0.0	0	0	0	0	0	0	0	0	0	0
7876784948	Cameroon Administrative Divisions East Region	2.3333333333333335	12	0.7453559925	3	1	2	3	3	2	3	1	2	3	3	2
7876784948	Cameroon Electricity consumption per capita  Source Electricity consumption per capita, World Development Indicators and Global Development Finance, World Bank	0.8947368421052632	19	1.07089420786	1	0	0	2	3	2	0	0	0	1	0	0	2	3	2	0	0	0	1
7876784948	Cameroon Energy use per capita  Source Energy use per capita, World Development Indicators and Global Development Finance, World Bank	1.1538461538461537	13	0.863459396948	1	0	0	2	2	2	1	0	0	2	2	2	1
7876784948	Cameroon GDP growth rate  Source World Bank, World Development Indicators, GDP Growth Rate	1.4615384615384615	13	0.745796901141	1	0	2	2	2	2	1	0	2	2	2	2	1
8372755048	Eritrea Contains Asmara	0.0	48	0.0	0	0	0	0	0	0	0	0	0	0	0	0	0	0	0	0	0	0	0	0	0	0	0	0	0	0	0	0	0	0	0	0	0	0	0	0	0	0	0	0	0	0	0	0	0	0	0	0
8372755048	Eritrea People born here Dawit Isaak	0.08333333333333333	48	0.276385399196	0	0	0	0	0	0	0	0	0	0	1	0	0	0	0	0	0	0	0	0	0	0	0	1	0	0	0	0	0	0	0	0	0	0	1	0	0	0	0	0	0	0	0	0	0	0	0	1
8372755048	Eritrea Athletes  Olympics The London 2012 Summer Olympics	0.0	49	0.0	0	0	0	0	0	0	0	0	0	0	0	0	0	0	0	0	0	0	0	0	0	0	0	0	0	0	0	0	0	0	0	0	0	0	0	0	0	0	0	0	0	0	0	0	0	0	0	0	0
8372755048	Eritrea Events Mahdist War	0.0	48	0.0	0	0	0	0	0	0	0	0	0	0	0	0	0	0	0	0	0	0	0	0	0	0	0	0	0	0	0	0	0	0	0	0	0	0	0	0	0	0	0	0	0	0	0	0	0	0	0	0
8372755048	Eritrea Works Written About This Topic Ciao Asmara	0.0	48	0.0	0	0	0	0	0	0	0	0	0	0	0	0	0	0	0	0	0	0	0	0	0	0	0	0	0	0	0	0	0	0	0	0	0	0	0	0	0	0	0	0	0	0	0	0	0	0	0	0
8372755048	Eritrea Military Conflicts  Conflict Mahdist War	0.041666666666666664	48	0.199826313471	0	0	0	0	0	0	0	0	0	0	0	0	0	0	0	1	0	0	0	0	0	0	0	0	0	0	0	0	0	0	0	0	0	0	0	0	0	0	0	1	0	0	0	0	0	0	0	0
8372755048	Eritrea GDP (nominal)  Currency United States Dollar	0.0	58	0.0	0	0	0	0	0	0	0	0	0	0	0	0	0	0	0	0	0	0	0	0	0	0	0	0	0	0	0	0	0	0	0	0	0	0	0	0	0	0	0	0	0	0	0	0	0	0	0	0	0	0	0	0	0	0	0	0	0	0
8372755048	Eritrea Partially contains Nile	0.0	58	0.0	0	0	0	0	0	0	0	0	0	0	0	0	0	0	0	0	0	0	0	0	0	0	0	0	0	0	0	0	0	0	0	0	0	0	0	0	0	0	0	0	0	0	0	0	0	0	0	0	0	0	0	0	0	0	0	0	0	0
8372755048	Eritrea Partially contains  Partially contains Nile	0.0	58	0.0	0	0	0	0	0	0	0	0	0	0	0	0	0	0	0	0	0	0	0	0	0	0	0	0	0	0	0	0	0	0	0	0	0	0	0	0	0	0	0	0	0	0	0	0	0	0	0	0	0	0	0	0	0	0	0	0	0	0
8372755048	Eritrea Electricity consumption per capita  Source Electricity consumption per capita, World Development Indicators and Global Development Finance, World Bank	0.0	69	0.0	0	0	0	0	0	0	0	0	0	0	0	0	0	0	0	0	0	0	0	0	0	0	0	0	0	0	0	0	0	0	0	0	0	0	0	0	0	0	0	0	0	0	0	0	0	0	0	0	0	0	0	0	0	0	0	0	0	0	0	0	0	0	0	0	0	0	0	0	0
8372755048	Eritrea Administrative Divisions Gash-Barka Region	0.20408163265306123	49	0.403028931799	0	0	0	0	0	1	0	1	0	0	0	0	0	0	1	0	1	0	0	0	0	0	0	1	0	0	0	0	0	1	0	1	0	0	0	0	0	0	1	0	1	0	0	0	0	0	0	1	0
8372755048	Eritrea Energy use per capita  Source Energy use per capita, World Development Indicators and Global Development Finance, World Bank	0.01694915254237288	59	0.129080900099	0	0	0	0	0	0	0	0	0	0	0	0	0	0	0	0	0	0	0	0	0	0	0	0	0	0	0	0	0	0	0	0	0	0	0	0	0	0	0	0	0	0	0	0	0	0	0	0	0	0	0	0	0	0	0	0	0	0	1
8372755048	Eritrea GDP growth rate  Source World Bank, World Development Indicators, GDP Growth Rate	0.01694915254237288	59	0.129080900099	0	0	0	0	0	0	0	0	0	0	0	0	0	0	0	0	0	0	0	0	0	0	0	0	0	0	0	0	0	0	0	0	0	0	0	0	0	0	0	0	0	0	0	0	0	0	0	0	0	0	0	0	0	0	0	0	0	0	1
8372755048	Eritrea GDP real  Adjustment currency United States Dollar	0.0	59	0.0	0	0	0	0	0	0	0	0	0	0	0	0	0	0	0	0	0	0	0	0	0	0	0	0	0	0	0	0	0	0	0	0	0	0	0	0	0	0	0	0	0	0	0	0	0	0	0	0	0	0	0	0	0	0	0	0	0	0	0
8372755048	Eritrea Life expectancy  Source World Bank, World Development Indicators, Life Expectancy	0.0	59	0.0	0	0	0	0	0	0	0	0	0	0	0	0	0	0	0	0	0	0	0	0	0	0	0	0	0	0	0	0	0	0	0	0	0	0	0	0	0	0	0	0	0	0	0	0	0	0	0	0	0	0	0	0	0	0	0	0	0	0	0
8448865148	Illinois Contains Chicago	1.0	6	0.0	1	1	1	1	1	1
8448865148	Illinois People born here Jonatha Brooke	0.0	6	0.0	0	0	0	0	0	0
8448865148	Illinois Governing officials  Officeholder Barack Obama	0.025	80	0.15612494996	0	0	0	0	0	0	0	0	0	0	0	0	0	0	1	0	0	0	0	0	0	0	0	0	0	0	0	0	0	0	0	0	0	0	0	0	0	0	0	0	0	0	0	0	0	0	0	0	0	0	0	0	0	0	1	0	0	0	0	0	0	0	0	0	0	0	0	0	0	0	0	0	0	0	0	0	0	0	0	0
8448865148	Illinois Works Written About This Topic Chicago	0.0	6	0.0	0	0	0	0	0	0
8448865148	Illinois Unemployment Rate  Source Bureau of Labor Statistics, Unemployment in US States	0.0	7	0.0	0	0	0	0	0	0	0
8448865148	Illinois Population  Source United States Census Bureau, Population	0.0	4	0.0	0	0	0	0
8448865148	Illinois Representatives  Officeholder Barack Obama	0.025	80	0.15612494996	0	0	0	0	0	0	0	0	0	0	0	0	0	0	1	0	0	0	0	0	0	0	0	0	0	0	0	0	0	0	0	0	0	0	0	0	0	0	0	0	0	0	0	0	0	0	0	0	0	0	0	0	0	0	1	0	0	0	0	0	0	0	0	0	0	0	0	0	0	0	0	0	0	0	0	0	0	0	0	0
8478554948	Bill Gates Films appeared in  Type of Appearance Him/Herself	0.4050632911392405	79	0.626805995096	1	0	0	0	0	1	0	0	1	1	0	2	1	0	0	1	2	0	1	0	0	1	0	0	0	0	0	0	2	0	0	0	0	0	1	0	0	1	0	1	0	0	0	0	1	0	0	1	1	0	2	1	0	0	1	2	0	1	0	0	1	0	0	0	0	0	0	2	0	0	0	0	0	1	0	0	1	0	0
8478554948	Bill Gates Works written The Road Ahead	0.2	10	0.4	1	0	0	0	0	1	0	0	0	0
8478554948	Bill Gates Profession Entrepreneur	1.2	10	1.16619037897	3	1	0	2	0	3	1	0	2	0
8478554948	Bill Gates Recording contributions  Role Vocals	0.2	10	0.4	1	0	0	0	0	1	0	0	0	0
8478554948	Bill Gates Gender Male	2.0	10	0.632455532034	3	2	1	2	2	3	2	1	2	2
8478554948	Bill Gates Book editions published The Road Ahead	0.0	15	0.0	0	0	0	0	0	0	0	0	0	0	0	0	0	0	0
8772815348	Poland Contains Warsaw	0.3	20	0.640312423743	0	0	1	0	0	0	0	0	0	2	0	0	1	0	0	0	0	0	0	2
8772815348	Poland People born here Robert Babicz	1.8	10	0.748331477355	2	1	2	1	3	2	1	2	1	3
8772815348	Poland Organizations with this scope Democratic Party	0.1	20	0.3	0	0	0	0	0	0	0	0	0	1	0	0	0	0	0	0	0	0	0	1
8772815348	Poland Works Written About This Topic Poland	0.0	10	0.0	0	0	0	0	0	0	0	0	0	0
8772815348	Poland Agencies Polish Ministry of Public Security	0.0	10	0.0	0	0	0	0	0	0	0	0	0	0
8772815348	Poland Athletes  Olympics The London 2012 Summer Olympics	0.0	20	0.0	0	0	0	0	0	0	0	0	0	0	0	0	0	0	0	0	0	0	0	0
8772815348	Poland Athletic performances  Olympics The London 2012 Summer Olympics	0.0	21	0.0	0	0	0	0	0	0	0	0	0	0	0	0	0	0	0	0	0	0	0	0	0
8772815348	Poland Governing officials  Basic title President	0.2	10	0.4	0	0	0	0	1	0	0	0	0	1
8772815348	Poland Events Russian Civil War	0.0	10	0.0	0	0	0	0	0	0	0	0	0	0
8772815348	Poland GDP (nominal)  Currency United States Dollar	0.4	10	0.8	0	0	0	2	0	0	0	0	2	0
8772815348	Poland Titles Pornography	0.0	10	0.0	0	0	0	0	0	0	0	0	0	0
8772815348	Poland Military Conflicts  Combatants United Kingdom	0.1	20	0.3	0	0	0	0	0	0	0	0	0	1	0	0	0	0	0	0	0	0	0	1
8772815348	Poland Teams Poland national football team	0.0	10	0.0	0	0	0	0	0	0	0	0	0	0
8772815348	Poland Electricity consumption per capita  Source Electricity consumption per capita, World Development Indicators and Global Development Finance, World Bank	1.2	20	1.07703296143	3	0	2	2	1	2	0	0	0	2	3	0	2	2	1	2	0	0	0	2
8772815348	Poland Energy use per capita  Source Energy use per capita, World Development Indicators and Global Development Finance, World Bank	1.2	20	1.07703296143	3	0	2	2	1	2	0	0	0	2	3	0	2	2	1	2	0	0	0	2
8772815348	Poland Partially contains  Partially contains Carpathian Mountains	0.0	20	0.0	0	0	0	0	0	0	0	0	0	0	0	0	0	0	0	0	0	0	0	0
8772815348	Poland Partially contains Carpathian Mountains	0.0	20	0.0	0	0	0	0	0	0	0	0	0	0	0	0	0	0	0	0	0	0	0	0
8772815348	Poland Administrative Divisions Warsaw	0.2	10	0.4	0	0	1	0	0	0	0	1	0	0
8772815348	Poland Fertility rate  Source World Bank, World Development Indicators, Fertility Rate	1.8	10	1.46969384567	3	0	3	3	0	3	0	3	3	0
8772815348	Poland Life expectancy  Source World Bank, World Development Indicators, Life Expectancy	2.4	10	1.2	3	0	3	3	3	3	0	3	3	3
9078665448	Russia Contains Moscow	2.4444444444444446	18	0.831479419283	1	3	3	3	3	3	1	3	2	1	3	3	3	3	3	1	3	2
9078665448	Russia Organizations with this scope Bolsheviks	0.0	18	0.0	0	0	0	0	0	0	0	0	0	0	0	0	0	0	0	0	0	0
9078665448	Russia People born here CoH	0.0	12	0.0	0	0	0	0	0	0	0	0	0	0	0	0
9078665448	Russia Agencies Russian Ministry of the Emergency Situations	0.0	12	0.0	0	0	0	0	0	0	0	0	0	0	0	0
9078665448	Russia Governing officials  Basic title President	0.0	12	0.0	0	0	0	0	0	0	0	0	0	0	0	0
9078665448	Russia Athletes  Olympics The London 2012 Summer Olympics	0.0	18	0.0	0	0	0	0	0	0	0	0	0	0	0	0	0	0	0	0	0	0
9078665448	Russia Partially contains Caspian Sea	2.5555555555555554	18	0.95581391856	3	3	3	3	3	3	0	3	2	3	3	3	3	3	3	0	3	2
9078665448	Russia Partially contains  Partially contains Caspian Sea	2.5555555555555554	18	0.95581391856	3	3	3	3	3	3	0	3	2	3	3	3	3	3	3	0	3	2
9078665448	Russia Events World War II	0.0	12	0.0	0	0	0	0	0	0	0	0	0	0	0	0
9078665448	Russia GDP (nominal)  Currency United States Dollar	0.3333333333333333	12	0.7453559925	0	0	0	0	0	2	0	0	0	0	0	2
9078665448	Russia Athletic performances  Olympics The London 2012 Summer Olympics	0.0	18	0.0	0	0	0	0	0	0	0	0	0	0	0	0	0	0	0	0	0	0
9078665448	Russia Government bodies State Duma	0.2727272727272727	22	0.616575453011	0	0	0	0	2	0	0	1	0	0	0	0	0	0	0	2	0	0	1	0	0	0
9078665448	Russia Works Written About This Topic Belarus	0.3333333333333333	12	0.7453559925	0	0	0	0	0	2	0	0	0	0	0	2
9078665448	Russia Administrative Divisions Moscow	1.8888888888888888	18	0.874889763779	1	3	2	2	2	3	2	0	2	1	3	2	2	2	3	2	0	2
9078665448	Russia Teams Russia national football team	0.0	18	0.0	0	0	0	0	0	0	0	0	0	0	0	0	0	0	0	0	0	0
9078665448	Russia Electricity consumption per capita  Source Electricity consumption per capita, World Development Indicators and Global Development Finance, World Bank	0.3333333333333333	12	0.7453559925	0	0	0	0	2	0	0	0	0	0	2	0
9078665448	Russia Energy use per capita  Source Energy use per capita, World Development Indicators and Global Development Finance, World Bank	0.3333333333333333	12	0.7453559925	0	0	0	0	2	0	0	0	0	0	2	0
9078665448	Russia Fertility rate  Source World Bank, World Development Indicators, Fertility Rate	0.4444444444444444	18	0.831479419283	0	0	0	0	0	2	2	0	0	0	0	0	0	0	2	2	0	0
9078665448	Russia Life expectancy  Source World Bank, World Development Indicators, Life Expectancy	0.4444444444444444	18	0.831479419283	0	0	0	0	0	2	2	0	0	0	0	0	0	0	2	2	0	0
9078665448	Russia Population growth rate  Source Population Growth Rate, World Development Indicators and Global Development Finance, World Bank	0.7777777777777778	18	1.13311544747	0	0	0	0	2	3	2	0	0	0	0	0	0	2	3	2	0	0
538284665548	Salesforce.com Employees and other personnel  Title Chairman	0.125	80	0.399217985567	0	0	0	1	0	0	0	0	0	0	2	0	0	0	0	0	0	0	0	0	0	0	0	1	0	0	0	0	0	0	0	0	1	0	0	0	0	0	0	0	0	0	0	1	0	0	0	0	0	0	2	0	0	0	0	0	0	0	0	0	0	0	0	1	0	0	0	0	0	0	0	0	1	0	0	0	0	0	0	0
538284665548	Salesforce.com Child  Child Heroku	0.0	19	0.0	0	0	0	0	0	0	0	0	0	0	0	0	0	0	0	0	0	0	0
546675674948	Boris Becker TV episode performances  Episode Katherine Jenkins	0.0	24	0.0	0	0	0	0	0	0	0	0	0	0	0	0	0	0	0	0	0	0	0	0	0	0	0	0
706888504948	Shaquille O'Neal Award Nominations  Award Nominee Chaka Khan	0.7777777777777778	18	0.916245694582	0	2	2	1	0	0	2	0	0	0	2	2	1	0	0	2	0	0
706888504948	Shaquille O'Neal Awards Won  Award category All-NBA Team	1.4285714285714286	21	1.36526392256	0	3	3	1	0	0	3	0	3	2	0	3	3	1	0	0	3	0	3	2	0
706888504948	Shaquille O'Neal Recordings Player	1.3333333333333333	18	1.33333333333	0	3	3	1	0	0	3	2	0	0	3	3	1	0	0	3	2	0
706888504948	Shaquille O'Neal Films appeared in  Type of Appearance Him/Herself	0.7619047619047619	21	0.867660340871	0	2	2	1	0	0	2	1	0	0	0	2	2	1	0	0	2	1	0	0	0
706888504948	Shaquille O'Neal Albums Steel	1.0	10	0.894427191	0	2	2	1	0	0	2	2	1	0
706888504948	Shaquille O'Neal TV episode performances  Episode Miami	0.7777777777777778	18	0.916245694582	0	2	2	1	0	0	2	0	0	0	2	2	1	0	0	2	0	0
706888504948	Shaquille O'Neal Recording contributions  Role Guest	1.0	10	0.894427191	0	2	2	1	0	0	2	2	1	0
706888504948	Shaquille O'Neal Film performances  Special Performance Type Him/Herself	0.8888888888888888	18	0.874889763779	0	2	2	1	0	0	2	1	0	0	2	2	1	0	0	2	1	0
706888504948	Shaquille O'Neal Profession Actor	1.0	10	0.894427191	0	2	2	1	0	0	2	2	1	0
706888504948	Shaquille O'Neal Works written Shaq and the Beanstalk and Other Very Tall Tales	1.0	10	0.894427191	0	2	2	1	0	0	2	2	1	0
706888504948	Shaquille O'Neal Children Shareef O'Neal	0.6	10	0.489897948557	0	1	1	1	0	0	1	1	1	0
706888504948	Shaquille O'Neal Gender Male	1.0	10	0.894427191	0	2	2	1	0	0	2	2	1	0
706888504948	Shaquille O'Neal Places lived  Location San Antonio	0.6	10	0.489897948557	0	1	1	1	0	0	1	1	1	0
706888504948	Shaquille O'Neal Education  Degree Bachelor of Arts	0.8	10	0.748331477355	0	1	2	1	0	0	1	2	1	0
57865383535048	Michelle Obama TV episode performances  Episode Michelle Obama	0.0	76	0.0	0	0	0	0	0	0	0	0	0	0	0	0	0	0	0	0	0	0	0	0	0	0	0	0	0	0	0	0	0	0	0	0	0	0	0	0	0	0	0	0	0	0	0	0	0	0	0	0	0	0	0	0	0	0	0	0	0	0	0	0	0	0	0	0	0	0	0	0	0	0	0	0	0	0	0	0
57865383535048	Michelle Obama Works written American Grown	0.47058823529411764	17	0.696009386247	2	0	1	0	0	1	0	0	2	0	1	0	0	1	0	0	0
767878574948	Family Guy Episodes Three Kings	0.0	6	0.0	0	0	0	0	0	0
9571555448	Pelé Awards Won  Award category BBC Sports Personality of the Year Lifetime Achievement Award	2.3333333333333335	12	0.7453559925	2	3	1	3	2	3	2	3	1	3	2	3
8686545348	Montenegro Contains Podgorica	0.8	10	0.748331477355	0	0	2	1	1	0	0	2	1	1
8686545348	Montenegro Organizations with this scope People's Party	1.5	12	0.763762615826	0	2	2	2	2	1	0	2	2	2	2	1
8686545348	Montenegro People born here Milovan Đilas	0.2	10	0.4	0	0	0	1	0	0	0	0	1	0
8686545348	Montenegro Governing officials  Basic title President	3.0	10	0.0	3	3	3	3	3	3	3	3	3	3
8686545348	Montenegro Athletes  Olympics The London 2012 Summer Olympics	0.16666666666666666	12	0.37267799625	0	1	0	0	0	0	0	1	0	0	0	0
8686545348	Montenegro Events Yugoslav Wars	1.2	10	0.748331477355	1	2	1	0	2	1	2	1	0	2
8686545348	Montenegro Partially contains Tara	0.45454545454545453	22	0.89072354283	0	1	3	0	0	0	1	0	0	0	0	0	1	3	0	0	0	1	0	0	0	0
8686545348	Montenegro Partially contains  Partially contains Tara	0.8333333333333334	12	1.06718737291	0	1	3	1	0	0	0	1	3	1	0	0
8686545348	Montenegro GDP (nominal)  Currency United States Dollar	0.8	10	0.748331477355	0	0	2	1	1	0	0	2	1	1
8686545348	Montenegro Life expectancy  Source World Bank, World Development Indicators, Life Expectancy	0.3076923076923077	13	0.461538461538	1	0	1	0	0	0	1	0	1	0	0	0	0
8686545348	Montenegro Fertility rate  Source World Bank, World Development Indicators, Fertility Rate	0.23076923076923078	13	0.421325044235	0	1	0	0	0	0	0	1	0	0	0	0	1
5167788848	Charles, Prince of Wales Gender Male	2.0	5	0.894427191	3	1	3	1	2
518753486848	China Contains Hong Kong	0.2	10	0.4	0	0	0	0	1	0	0	0	0	1
518753486848	China People born here Xu Wei	0.0	4	0.0	0	0	0	0
518753486848	China Organizations with this scope Communist Party of China	0.0	4	0.0	0	0	0	0
518753486848	China Events Pacific War	0.0	4	0.0	0	0	0	0
518753486848	China Works Written About This Topic Japan	0.0	4	0.0	0	0	0	0
518753486848	China Athletes  Olympics The London 2012 Summer Olympics	0.0	10	0.0	0	0	0	0	0	0	0	0	0	0
518753486848	China Agencies Chinese Ministry of Public Security	0.0	4	0.0	0	0	0	0
518753486848	China GDP (nominal)  Currency United States Dollar	0.0	11	0.0	0	0	0	0	0	0	0	0	0	0	0
518753486848	China Teams Shanghai Sharks	0.2	10	0.4	0	1	0	0	0	0	1	0	0	0
518753486848	China Partially contains  Partially contains Himalayas	0.4	10	0.489897948557	0	1	0	0	1	0	1	0	0	1
518753486848	China Governing officials  Basic title President	0.0	4	0.0	0	0	0	0
518753486848	China Partially contains Himalayas	0.4	10	0.489897948557	0	1	0	0	1	0	1	0	0	1
518753486848	China Electricity consumption per capita  Source Electricity consumption per capita, World Development Indicators and Global Development Finance, World Bank	0.0	10	0.0	0	0	0	0	0	0	0	0	0	0
518753486848	China Energy use per capita  Source Energy use per capita, World Development Indicators and Global Development Finance, World Bank	0.0	10	0.0	0	0	0	0	0	0	0	0	0	0
518753486848	China Administrative Divisions Hong Kong	0.2	10	0.4	0	0	0	0	1	0	0	0	0	1
518753486848	China Fertility rate  Source World Bank, World Development Indicators, Fertility Rate	0.0	4	0.0	0	0	0	0
518753486848	China Life expectancy  Source World Bank, World Development Indicators, Life Expectancy	0.0	4	0.0	0	0	0	0
518753486848	China Population growth rate  Source Population Growth Rate, World Development Indicators and Global Development Finance, World Bank	0.0	4	0.0	0	0	0	0
518753486848	China GDP real  Adjustment currency United States Dollar	0.0	10	0.0	0	0	0	0	0	0	0	0	0	0
518753486848	China CO2 emissions per capita  Source CO2 emissions per capita, World Development Indicators and Global Development Finance, World Bank	0.0	4	0.0	0	0	0	0
5153485448	Diana, Princess of Wales Films appeared in  Type of Appearance Him/Herself	0.06976744186046512	86	0.254754677909	0	0	0	0	0	0	0	0	0	0	0	0	1	0	1	0	0	0	0	0	0	0	0	0	0	0	0	0	0	0	0	0	0	1	0	0	0	0	0	0	0	0	0	0	0	0	0	0	0	0	0	0	0	0	0	1	0	1	0	0	0	0	0	0	0	0	0	0	0	0	0	0	0	0	0	0	1	0	0	0	0	0	0	0	0	0
5153485448	Diana, Princess of Wales Quotations Hugs can do great amounts of good -- especially for children.	0.0	86	0.0	0	0	0	0	0	0	0	0	0	0	0	0	0	0	0	0	0	0	0	0	0	0	0	0	0	0	0	0	0	0	0	0	0	0	0	0	0	0	0	0	0	0	0	0	0	0	0	0	0	0	0	0	0	0	0	0	0	0	0	0	0	0	0	0	0	0	0	0	0	0	0	0	0	0	0	0	0	0	0	0	0	0	0	0	0	0
5153485448	Diana, Princess of Wales Profession Crown Princess	0.08571428571428572	70	0.499795876701	0	0	0	0	0	0	0	0	0	0	0	0	0	0	0	0	0	0	0	0	0	0	0	0	3	0	0	0	0	0	0	0	0	0	0	0	0	0	0	0	0	0	0	0	0	0	0	0	0	0	0	0	0	0	0	0	0	0	0	3	0	0	0	0	0	0	0	0	0	0
5153485448	Diana, Princess of Wales Gender Female	0.0	70	0.0	0	0	0	0	0	0	0	0	0	0	0	0	0	0	0	0	0	0	0	0	0	0	0	0	0	0	0	0	0	0	0	0	0	0	0	0	0	0	0	0	0	0	0	0	0	0	0	0	0	0	0	0	0	0	0	0	0	0	0	0	0	0	0	0	0	0	0	0	0	0
72907148	Abraham Lincoln Artwork on the Subject Abraham Lincoln	0.0	18	0.0	0	0	0	0	0	0	0	0	0	0	0	0	0	0	0	0	0	0
5578775448	Stanley Kubrick Films directed Full Metal Jacket	2.923076923076923	13	0.266469355011	3	3	3	3	3	3	3	3	3	3	3	3	2
7876784948	Cameroon GDP real  Adjustment currency United States Dollar	2.0	2	0.0	2	2
7876784948	Cameroon CO2 emissions per capita  Source CO2 emissions per capita, World Development Indicators and Global Development Finance, World Bank	1.3333333333333333	3	0.942809041582	2	2	0
7876784948	Cameroon Fertility rate  Source World Bank, World Development Indicators, Fertility Rate	1.0	3	0.0	1	1	1
7876784948	Cameroon Life expectancy  Source World Bank, World Development Indicators, Life Expectancy	0.6666666666666666	3	0.471404520791	1	1	0
7876784948	Cameroon GNI per capita in PPP dollars  Currency United States Dollar	1.0	2	0.0	1	1
7876784948	Cameroon GNI in PPP dollars  Currency United States Dollar	1.0	2	0.0	1	1
7876784948	Cameroon Population growth rate  Source Population Growth Rate, World Development Indicators and Global Development Finance, World Bank	1.0	3	0.0	1	1	1
