srp	7176525248	Philippe Cousteau Cause of death Aviation accident or incident	Jacques-Yves Cousteau TV regular appearances Appearance type Him/Herself	Jacques-Yves Cousteau Belongs to Order Order Legion of Honour	Philippe Cousteau Children Alexandra Cousteau	Philippe Cousteau Parents Jacques-Yves Cousteau	Jacques-Yves Cousteau Things named after this Jacques Cousteau National Estuarine Research Reserve	Jacques-Yves Cousteau Spouse (or domestic partner) Location of ceremony Paris	Philippe Cousteau Siblings Sibling Jean-Michel Cousteau	Jacques-Yves Cousteau Ethnicity French people	Jacques-Yves Cousteau Films Executive Produced Cousteau: My First 85 Years	Jacques-Yves Cousteau Films appeared in Type of Appearance Him/Herself	Philippe Cousteau Place of death Lisbon	Jacques-Yves Cousteau Organizations founded EarthEcho International	Jacques-Yves Cousteau Places lived Location Aquitaine	Jacques-Yves Cousteau Education Institution École Navale	Jacques-Yves Cousteau Films Produced World Without Sun	Philippe Cousteau Place of birth Toulon	Jacques-Yves Cousteau Awards Won Award category Academy Award for Best Documentary Feature	Jacques-Yves Cousteau Profession Film director	Jacques-Yves Cousteau Award Nominations Award Academy Award for Best Documentary Feature
srp	8387675748	Mars Planetographic coordinate system Areographic coordinate system	Mars Orbit Type Heliocentric orbit	Mars Missions sent here Mars Exploration Rover	Mars Fictional Works Set Here Doom	Mars Locations Beagle	Mars Orbits Sun	Mars Orbited by Deimos	Mars Star system Solar System	Mars Named after Mars	Phobos Category Natural satellite	Phobos Discoverer Asaph Hall	Mars Fictional Characters Born Here Jeffrey Sinclair	Mars Works Written About This Topic Mars	Mars Artwork on the Subject Twenty-eight Views of Mars	Mars Meteorites Black Beauty	Mars Contains Tharsis	Mars Missions sent here Mars Science Laboratory	Mars Fictional Works Set Here Mission to Mars	Mars Locations Gold	Phobos Orbits Mars
srp	7876784948	Cameroon National anthem Anthem O Cameroon, Cradle of Our Forefathers	Cameroon Currency Used Central African CFA franc	Cameroon Flag Flag Flag of Cameroon	Cameroon Internet TLD cm	Cameroon Multi-event tournaments participated in 2010 Commonwealth Games	Cameroon Official Language English Language	Cameroon GDP (nominal per capita) Currency United States Dollar	Cameroon Form of Government Republic	Cameroon Languages spoken English Language	Cameroon Olympics participated in 2008 Summer Olympics	Cameroon Government bodies Senate	Cameroon Teams Cameroon national football team	Cameroon Agencies Cameroon Ministry of Justice	Yaoundé Nearby airports Yaoundé Nsimalen International Airport	Cameroon Internet users as percentage of population Source Internet users as percentage of population, World Development Indicators and Global Development Finance, World Bank	Cameroon Military expenditure as percentage of GDP Source Military expenditure as percentage of GDP, World Development Indicators and Global Development Finance, World Bank	Yaoundé Featured In Films North-South.com	Cameroon Administrative Divisions East Region	Cameroon Beers from here 33 Export	Cameroon Official Language French
srp	8372755048	Eritrea Multi-event tournaments participated in 2012 World Mountain Running Championships	Eritrea Flag Flag Flag of Eritrea	President of Eritrea Jurisdiction Eritrea	Eritrea Internet TLD er	Eritrea National anthem Anthem Ertra, Ertra, Ertra	Eritrea Currency Used Eritrean nakfa	Eritrea GDP (nominal per capita) Currency United States Dollar	Eritrea Government bodies National Assembly	Eritrea Official Language English Language	Eritrea Capital Asmara	Eritrea Olympics participated in 2008 Summer Olympics	Eritrea Form of Government Presidential system	Eritrea Languages spoken Hejazi Arabic	Eritrea Athletic performances Medal Silver medal	Eritrea Teams Eritrea national football team	Eritrea Military expenditure as percentage of GDP Source Military expenditure as percentage of GDP, World Development Indicators and Global Development Finance, World Bank	Eritrea Partially contains Nile	Eritrea Partially contains Partially contains Nile	Eritrea Governing officials Basic title President	Eritrea Official Language Arabic Language
srp	80837248	Apollo 11 Space program Apollo program	Neil Armstrong Space Agency NASA	Apollo 11 Astronauts (if manned) Buzz Aldrin	Neil Armstrong Space Missions Apollo 11	Neil Armstrong Hall of fame inductions Hall of fame Aerospace Walk of Honor	Neil Armstrong Member of Organization American Philosophical Society	Neil Armstrong Representations In Fiction Neil Armstrong	Neil Armstrong Education Institution University of Southern California	Neil Armstrong Films appeared in Type of Appearance Him/Herself	Neil Armstrong Participated in conflicts Korean War	Neil Armstrong Place of birth Auglaize County	Neil Armstrong Places lived Location Ohio	Neil Armstrong Ethnicity German American	Neil Armstrong Cause of death Complications from cardiac surgery	Neil Armstrong Profession Professor	Neil Armstrong Spouse (or domestic partner) Location of ceremony Ohio	Neil Armstrong Employment history Employer NASA	Neil Armstrong Gender Male	Neil Armstrong Religion Deism	Neil Armstrong Place of death Cincinnati
srp	8478554948	Seattle Nearby airports Seattle–Tacoma International Airport	Seattle Capital of Administrative division King County	Seattle Time zone(s) Pacific Time Zone	Seattle Featured In Films Sleepless in Seattle	Seattle Events 2012 Seattle International Film Festival	Seattle Postal codes 98104	Bill Gates Representations In Fiction Bill Gates	Seattle Place Seattle	Seattle People born here Jimi Hendrix	Bill Gates Ethnicity Scottish American	Seattle County King County	Seattle Named after Chief Seattle	Bill Gates Organizations founded Microsoft Corporation	Seattle Contained by Washington	Seattle Tourist attractions Seattle Art Museum	Seattle Population Source United States Census Bureau, Population	Bill Gates Spouse (or domestic partner) Spouse Melinda Gates	Bill Gates Education Institution Harvard College	Seattle Nearby airports Boeing Field	Seattle Featured In Films WarGames
srp	877070565548	Harry Potter literary series Fictional universe Harry Potter	J. K. Rowling Fictional universes created Harry Potter	J. K. Rowling Series Written (or Contributed To) Harry Potter literary series	Harry Potter literary series Works in this series Harry Potter and the Deathly Hallows	J. K. Rowling Books illustrated The Tales of Beedle the Bard	J. K. Rowling Fictional Characters Created Harry Potter	J. K. Rowling Influenced By Stephen King	J. K. Rowling Film Story Credits Harry Potter and the Order of the Phoenix	J. K. Rowling Influenced Emma Maree Urquhart	J. K. Rowling Languages English Language	J. K. Rowling Book editions published Harry Potter and the Deathly Hallows	J. K. Rowling Awards Won Winning work Harry Potter literary series	J. K. Rowling Award Nominations Nominated work Harry Potter literary series	J. K. Rowling Education Major/Field Of Study French	J. K. Rowling Quotations If you want to know what a man's like, take a good look at how he treats his inferiors, not his equals.	J. K. Rowling Place of birth Yate	J. K. Rowling Spouse (or domestic partner) Type of union Marriage	J. K. Rowling Works written Harry Potter and the Deathly Hallows	J. K. Rowling Profession Writer	J. K. Rowling Series Written (or Contributed To) Harry Potter (Associational)
srp	77848153825048	The Big Bang Theory Program creator Chuck Lorre	The Big Bang Theory Languages English Language	The Big Bang Theory Original network Network CBS	Johnny Galecki Celebrity friends Friend Sara Gilbert	The Big Bang Theory Recurring writers Writer Chuck Lorre	The Big Bang Theory Genre Comedy	The Big Bang Theory Seasons The Big Bang Theory - Season 1	The Big Bang Theory TV Producer Producer Chuck Lorre	The Big Bang Theory Regular acting performances Special performance type Voice	Johnny Galecki Starring TV roles Series The Big Bang Theory	Johnny Galecki Theater Roles Play The Little Dog Laughed	Johnny Galecki Romantic relationships (with celebrities) Celebrity Kaley Cuoco	Johnny Galecki Ethnicity Irish people	The Big Bang Theory Awards Won Award winner Bob Newhart	The Big Bang Theory Award Nominations Award Nominee CBS	Johnny Galecki TV episode performances Episode Girl Talk	The Big Bang Theory Program creator Bill Prady	The Big Bang Theory Languages Hindi Language	The Big Bang Theory Recurring writers Writer Bill Prady	The Big Bang Theory Genre Sitcom
srp	546675674948	Wimbledon Match Results Wimbledon Championship Match	Wimbledon Current frequency Yearly	Wimbledon Champions Winner Serena Williams	Boris Becker Tennis Titles Tournament The US Open (Tennis)	Wimbledon Instances 2010 Wimbledon Championships	Boris Becker Romantic relationships (with celebrities) Celebrity Sandy Meyer-Wölden	Boris Becker Hall of fame inductions Hall of fame International Tennis Hall of Fame	Boris Becker Sports played Sport Tennis	Boris Becker TV regular appearances Program Piers Morgan's Life Stories	Boris Becker Places lived Location London	Boris Becker Parents Karl-Heinz	Boris Becker Awards Won Award category BBC Overseas Sports Personality of the Year	Boris Becker Spouse (or domestic partner) Type of union Marriage	Boris Becker Place of birth Leimen	Boris Becker Country of nationality Germany	Wimbledon Match Results Winner Roger Federer	Wimbledon Champions Winner Serena Williams	Boris Becker Tennis Titles Tournament Wimbledon	Wimbledon Instances 2005 Wimbledon Championships	Boris Becker Romantic relationships (with celebrities) Relationship type Engaged to
srp	57865383535048	Bachelor of Arts Honorary degree recipients Recipient Nelson Mandela	Bachelor of Arts People with this degree Major/Field Of Study Piano	Michelle Obama Member of Organization Alpha Phi Omega	Michelle Obama Employment history Employer Federal government of the United States	Michelle Obama Education Institution Princeton University	Michelle Obama Ethnicity African American	Michelle Obama Awards Won Winning work Let's Move!	Michelle Obama Places lived Location Hyde Park	Michelle Obama Religion Protestantism	Michelle Obama Place of birth Chicago	Michelle Obama Government Positions Held Basic title First Lady	Michelle Obama Gender Female	Michelle Obama Spouse (or domestic partner) Spouse Barack Obama	Michelle Obama Party Party Democratic Party	Michelle Obama Works Written About This Topic What Death of Osama Bin Laden Indicates About Barack Obama's Leadership	Michelle Obama Profession Writer	Bachelor of Arts Honorary degree recipients Institution University of South Africa	Bachelor of Arts People with this degree Specialization England	Michelle Obama Employment history Title First Lady	Michelle Obama Awards Won Ceremony 2010 Kids' Choice Awards
srp	9078665448	Russia Multi-event tournaments participated in 2012 World Mountain Running Championships	Europe Contains major portion of Spain	Russia Athletes Competitor Russia national football team	Russia Force Deployments Resource Infantry	Russia Places exported to Exported to Uzbekistan	Russia Places imported from Imported from Uzbekistan	Russia Casualties Military Conflict Battle of Kulikovo	Russia Internet TLD ru	Russia National anthem Anthem National Anthem of Russia	Russia Currency Used Russian ruble	Russia Flag Flag Flag of Russia	Russia GDP (nominal per capita) Currency United States Dollar	Russia Official Language Russian Language	Russia Olympics participated in The London 2012 Summer Olympics	Russia Capital Moscow	Russia Breeds orginating here Siberian Husky	Europe Universe Mortal Engines	Russia Military Commanders Military Commander Dmitry Donskoy	Russia Languages spoken Russian Language	Russia Form of Government Federal republic
srp	5153485448	Paris Featured In Films Munich	Paris Teams Paris Saint-Germain F.C.	Paris Time zone(s) Central European Time Zone	Paris Capital of Administrative division Île-de-France	Paris Tourist attractions The Louvre	Diana, Princess of Wales Place of burial Althorp	Paris Artwork on the Subject Paris Street	Rainy Day	Paris Nearby airports Charles de Gaulle Airport	Paris Postal codes 75000	Diana, Princess of Wales Representations In Fiction Princess Diana	Paris Things named after this Paris Hilton	Diana, Princess of Wales Cause of death Traffic collision	Paris Newspapers Le Monde	Paris Events 1924 Summer Olympics	Diana, Princess of Wales Religion Anglicanism	Paris Adjoins Adjoins Hauts-de-Seine	Paris Country France	Paris Named after Parisii	Paris Featured In Films Inglourious Basterds
srp	5788825148	Isaac Asimov Influenced Kurt Vonnegut	Isaac Asimov Influenced By Bertrand Russell	Isaac Asimov Ethnicity Jewish people	Isaac Asimov Quotations Individual science fiction stories may seem as trivial as ever to the blinder critics and philosophers of today -- but the core of science fiction, its essence has become crucial to our salvation if we are to be saved at all.	Foundation Part of fictional universes The Foundation Universe	Isaac Asimov Religion Judaism	Isaac Asimov Cause of death Heart failure	Isaac Asimov Education Institution Columbia University	Foundation Previous in series Foundation's Triumph	Foundation Next in series Foundation and Empire	Isaac Asimov Spouse (or domestic partner) Type of union Marriage	Isaac Asimov Awards Won Award category Hugo Award for Best Novel	Isaac Asimov Places lived Location Brooklyn	Isaac Asimov Place of death New York City	Isaac Asimov Book editions published Gold	Foundation Original language English Language	Isaac Asimov Place of birth Petrovichi	Isaac Asimov Works written Gold	Foundation Author Isaac Asimov	Isaac Asimov Award Nominations Award Nominee Harlan Ellison
eml	487680894948	Abraham Lincoln Romantic relationships (with celebrities) Celebrity Ann Rutledge	Abraham Lincoln Vice president Andrew Johnson	Abraham Lincoln Military Commands Military Conflict American Civil War	Abraham Lincoln Place of burial Oak Ridge Cemetery	Abraham Lincoln Participated in conflicts Black Hawk War	Abraham Lincoln Named after Abraham	Abraham Lincoln Service Rank Captain	Abraham Lincoln Dedications Dedicated By United States Congress	Abraham Lincoln Ethnicity Americans	Abraham Lincoln Election campaigns Abraham Lincoln Presidential Campaign, 1860	Abraham Lincoln Employment history Title President	Abraham Lincoln Quotations About This Subject \The Emancipation Proclamation...can remind us in 2013 of all the mistakes we never want to commit again but it can also motivate us to fulfill to an ever greater degree the definitive freedom-sustaining and life-enhancing principles of democracy in living action.	Abraham Lincoln Cause of death Assassination	Abraham Lincoln Appointees Office position or title United States Secretary of State	Mary Todd Lincoln Condition Bipolar disorder	Abraham Lincoln Appointment made Appointee Salmon P. Chase	Abraham Lincoln Influenced By Thomas Paine	Abraham Lincoln Representations In Fiction Abraham Lincoln	Abraham Lincoln Romantic relationships (with celebrities) Relationship type Dated	Abraham Lincoln Vice president Hannibal Hamlin
eml	88677448	Albert Einstein Artwork on the Subject Albert Einstein Memorial	Albert Einstein Inventions Einstein refrigerator	Albert Einstein Series Written (or Contributed To) The Collected Papers of Albert Einstein	Albert Einstein Family Einstein family	Albert Einstein Follows diet Veganism	Albert Einstein Appears in ranked lists List Time 100: The Most Important People of the Century	Albert Einstein Cause of death Abdominal aortic aneurysm	Albert Einstein Hall of fame inductions Hall of fame The Walhalla	Albert Einstein Departments School of Mathematics, Institute for Advanced Study	Albert Einstein Member of Organization Royal Society	Albert Einstein Book editions published The World As I See It	Albert Einstein Governance of Organization Black Mountain College	Heinrich Friedrich Weber Academic advisors Ernst Abbe	Albert Einstein Siblings Sibling Maja Einstein	Albert Einstein Organizations founded Hebrew University of Jerusalem	Albert Einstein Representations In Fiction Albert Einstein	Albert Einstein Religion Judaism	Heinrich Friedrich Weber Place of death Zürich	Albert Einstein Spouse (or domestic partner) Location of ceremony Bern	Albert Einstein Ethnicity Jewish people
eml	956886885148	Beijing Tour operators TravelChinaGuide	Beijing Olympics hosted 2008 Summer Olympics	Lenovo Supplier CompuCom	Beijing Travel destinations served Mode of transportation Air travel	Lenovo Competitive space Space Personal computer	Beijing Olympics bid on Olympic games 2008 Summer Olympics	Beijing Exhibitions created about this subject Beijing 2008: A Photographic Journey	Lenovo Brands Brand ThinkPad	Beijing Country China	Lenovo Products Consumer product Lenovo Thinkpad Edge 11	Beijing Accommodation Beijing Hotel	Lenovo Product lines Product line ThinkPad	Lenovo Issue LENOVO GROUP LTD Common Stock	Beijing Time zone(s) China Time Zone	Lenovo Board members Role Chairman	Beijing Local transportation Beijing Subway	Beijing Travel destinations served Travel destination xibei-person0925	Beijing Olympics bid on Bidding city Paris	Beijing Accommodation Shangri-La Hotel, Beijing	Lenovo Product lines Product line ThinkPad Edge
eml	5295826848	Titanic Film Collections AFI's 100 Years...100 Movies	Titanic Gross revenue Currency United States Dollar	Titanic Primary language English Language	Titanic Featured Song My Heart Will Go On	Titanic Quotations I'm King of the World!	Titanic Film format Super 35	Titanic Estimated budget Currency United States Dollar	Titanic: Music from the Motion Picture Film Titanic	Titanic Casting director Mali Finn	Titanic Set Decoration by Michael D. Ford	Titanic Things named after this Titanic Barbie Doll	Titanic Production design by Peter Lamont	Titanic Costume design by Deborah Lynn Scott	Titanic: Music from the Motion Picture Buy or download Web page .	Titanic Executive produced by Rae Sanchini	Titanic Cinematography Russell Carpenter	Titanic Music by James Horner	Titanic Dubbing performances Language German Language	Titanic Screenplay by James Cameron	Titanic Soundtrack Titanic Reflections (Non Original Versions)
eml	685776674948	2002 Cannes Film Festival Festival Cannes Film Festival	2002 Cannes Film Festival Instance of recurring event Cannes Film Festival	Aki Kaurismäki Influenced By Jean-Pierre Melville	Aki Kaurismäki Film music credits Juha	2002 Cannes Film Festival Awards presented Award winner Aki Kaurismäki	Aki Kaurismäki Film Story Credits Leningrad Cowboys Go America	Aki Kaurismäki Films appeared in Type of Appearance Him/Herself	Aki Kaurismäki Siblings Sibling Mika Kaurismäki	Aki Kaurismäki Spouse (or domestic partner) Type of union Marriage	Aki Kaurismäki Awards Won Winning work Le Havre	Aki Kaurismäki Education Major/Field Of Study Media studies	Aki Kaurismäki Country of nationality Finland	Aki Kaurismäki Place of birth Orimattila	Aki Kaurismäki Films edited Historic Centre	Aki Kaurismäki Gender Male	Aki Kaurismäki Profession Actor	2002 Cannes Film Festival Awards presented Award category Cannes Grand Prix	Aki Kaurismäki Film Story Credits I Hired a Contract Killer	Aki Kaurismäki Films appeared in Type of Appearance Him/Herself	Aki Kaurismäki Spouse (or domestic partner) Spouse Paula Oinonen
eml	5578775448	Stanley Kubrick Structures Owned Structure Childwickbury Manor	Full Metal Jacket Estimated budget Currency United States Dollar	Full Metal Jacket Soundtrack Full Metal Jacket	Stanley Kubrick Place of burial Childwickbury Manor	Full Metal Jacket Subjects Vietnam War	Full Metal Jacket Adapted From The Short-Timers	Full Metal Jacket Casting director Leon Vitali	Full Metal Jacket Rated R (USA)	Full Metal Jacket Set Decoration by Barbara Drake	Stanley Kubrick Things named after this Kubrick	Full Metal Jacket Production design by Anton Furst	Full Metal Jacket Story by Gustav Hasford	Full Metal Jacket Costume design by Keith Denny	Stanley Kubrick Cause of death Myocardial infarction	Full Metal Jacket Executive produced by Jan Harlan	Full Metal Jacket Film festivals 2005 Berlin International Film Festival	Full Metal Jacket Edited by Martin Hunter	Full Metal Jacket Cinematography Douglas Milsome	Full Metal Jacket Music by Vivian Kubrick	Stanley Kubrick Employment history Employer Cowles Media Company
eml	7057716748	Richard Burton Dedications Work Dedicated Nineteen Eighty-Four	Richard Burton Representations In Fiction Richard Burton	Doctor Faustus Set Decoration by Dario Simoni	Doctor Faustus Appears in ranked lists List The Movie List: the first 9200	Richard Burton Service Military Force Royal Air Force	Doctor Faustus Production design by John DeCuir	Doctor Faustus Distributors Distributor Columbia Pictures	Doctor Faustus Art direction by Boris Juraga	Richard Burton Cause of death Cerebral hemorrhage	Richard Burton Ethnicity Welsh people	Richard Burton Religion Presbyterianism	Doctor Faustus Edited by John Shirley	Doctor Faustus Music by Mario Nascimbene	Doctor Faustus Screenplay by Nevill Coghill	Doctor Faustus Produced by Richard Burton	Doctor Faustus Languages English Language	Richard Burton Place of death Céligny	Doctor Faustus Country of origin United Kingdom	Richard Burton Theater Roles Play Camelot	Richard Burton Theater Roles Role King Arthur
eml	7176525248	Jacques-Yves Cousteau Dedications Work Dedicated The Life Aquatic with Steve Zissou	Jacques-Yves Cousteau Ships owned Ship RV Calypso	Jacques-Yves Cousteau Hall of fame inductions Hall of fame Television Hall of Fame	Jacques-Yves Cousteau Belongs to Order Order Legion of Honour	Jacques-Yves Cousteau Inventions Aqua-lung	Jacques-Yves Cousteau Participated in conflicts World War II	Philippe Cousteau Cause of death Aviation accident or incident	Jacques-Yves Cousteau Ethnicity French people	Jacques-Yves Cousteau Governance of Organization National Association of Underwater Instructors	Jacques-Yves Cousteau Things named after this Jacques Cousteau National Estuarine Research Reserve	Jacques-Yves Cousteau TV episodes produced Role Executive Producer	Jacques-Yves Cousteau Films Executive Produced Cousteau: My First 85 Years	Jacques-Yves Cousteau Films appeared in Type of Appearance Him/Herself	Jacques-Yves Cousteau Film writing credits The Silent World	Philippe Cousteau Place of death Lisbon	Philippe Cousteau Siblings Sibling Jean-Michel Cousteau	Jacques-Yves Cousteau TV regular appearances Appearance type Him/Herself	Jacques-Yves Cousteau TV episode performances Episode EPISODE #328	Jacques-Yves Cousteau Spouse (or domestic partner) Location of ceremony Paris	Jacques-Yves Cousteau Organizations founded EarthEcho International
eml	8387675748	Mars Meteorites Black Beauty	Mars Planetographic coordinate system Areographic coordinate system	Mars Orbit Type Heliocentric orbit	Mars Artwork on the Subject Twenty-eight Views of Mars	Phobos Discoverer Asaph Hall	Mars Star system Solar System	Mars Orbits Sun	Mars Orbited by Deimos	Mars Named after Mars	Phobos Category Natural satellite	Mars Missions sent here Mars Exploration Rover	Mars Fictional Characters Born Here Jeffrey Sinclair	Mars Fictional Works Set Here Doom	Mars Works Written About This Topic Mars	Mars Contains Tharsis	Mars Locations Beagle	Phobos Star system Solar System	Phobos Orbits Mars	Phobos Named after Phobos	Mars Category Planet
eml	7876784948	Cameroon Multi-event tournaments participated in 2010 Commonwealth Games	Cameroon Internet TLD cm	Cameroon National anthem Anthem O Cameroon, Cradle of Our Forefathers	Cameroon Currency Used Central African CFA franc	Cameroon Flag Flag Flag of Cameroon	Cameroon GDP (nominal per capita) Currency United States Dollar	Cameroon Form of Government Republic	Cameroon Beers from here 33 Export	Cameroon Agencies Cameroon Ministry of Justice	Cameroon Teams Cameroon national football team	Yaoundé Featured In Films North-South.com	Cameroon Official Language English Language	Cameroon Olympics participated in 2008 Summer Olympics	Cameroon Events 2008 Cameroonian anti-government protests	Cameroon Government bodies Senate	Cameroon Subject of Poets of the Past and Present in 2014 Spotlight	Yaoundé Nearby airports Yaoundé Nsimalen International Airport	Cameroon Governing officials Basic title President	Cameroon Time zone(s) West Africa Time Zone	Cameroon Official Language French
eml	8372755048	Eritrea Multi-event tournaments participated in 2012 World Mountain Running Championships	Eritrea Internet TLD er	Eritrea National anthem Anthem Ertra, Ertra, Ertra	Eritrea Athletic performances Medal Silver medal	Eritrea Currency Used Eritrean nakfa	Eritrea Flag Flag Flag of Eritrea	Eritrea GDP (nominal per capita) Currency United States Dollar	Eritrea Olympics participated in 2008 Summer Olympics	Eritrea Capital Asmara	President of Eritrea Jurisdiction Eritrea	Eritrea Languages spoken Hejazi Arabic	Eritrea Form of Government Presidential system	Eritrea Government bodies National Assembly	Eritrea Teams Eritrea national football team	Eritrea Organizations with this scope People's Front for Democracy and Justice	Eritrea Athletic performances Medal Bronze medal	Eritrea Governing officials Basic title President	President of Eritrea Office Holders Basic title President	Eritrea Time zone(s) East Africa Time Zone	Eritrea Athletic performances Tournament 2009 World Championships in Athletics
