method	query_id	tp1	tp2	tp3	tp4	tp5	tp6	tp7	tp8	tp9	tp10	tp11	tp12	tp13	tp14	tp15	tp16	tp17	tp18	tp19	tp20
em	487680894948	Abraham Lincoln Vice president Andrew Johnson	Abraham Lincoln Speeches or presentations Speech subject American Civil War	Abraham Lincoln Appointment made Appointee Salmon P. Chase	Abraham Lincoln Dedications Dedicated By United States Congress	Abraham Lincoln Election campaigns Abraham Lincoln Presidential Campaign, 1860	Abraham Lincoln Romantic relationships (with celebrities) Celebrity Ann Rutledge	Abraham Lincoln Exhibitions created about this subject Abraham Lincoln: Self-Made in America	Abraham Lincoln Appointees Office position or title United States Secretary of State	Mary Todd Lincoln Condition Bipolar disorder	Abraham Lincoln Artwork on the Subject Abraham Lincoln	Abraham Lincoln Military Commands Military Conflict American Civil War	Abraham Lincoln Films On This Subject Lincoln	Abraham Lincoln Representations In Fiction Abraham Lincoln	Abraham Lincoln Place of burial Oak Ridge Cemetery	Abraham Lincoln Influenced Martin Luther King, Jr.	Abraham Lincoln Influenced By Thomas Paine	Abraham Lincoln Participated in conflicts Black Hawk War	Abraham Lincoln Named after Abraham	Abraham Lincoln Service Rank Captain	Abraham Lincoln Vice president Hannibal Hamlin
em	88677448	Albert Einstein Follows diet Veganism	Albert Einstein Hall of fame inductions Hall of fame The Walhalla	Albert Einstein Artwork on the Subject Albert Einstein Memorial	Albert Einstein Representations In Fiction Albert Einstein	Albert Einstein Peers Peers Werner Heisenberg	Albert Einstein Family Einstein family	Albert Einstein Member of Organization Royal Society	Albert Einstein Series Written (or Contributed To) The Collected Papers of Albert Einstein	Albert Einstein Films On This Subject Young Einstein	Albert Einstein Appears in ranked lists List Time 100: The Most Important People of the Century	Albert Einstein Quotations Gravitation cannot be held responsible for people falling in love.	Albert Einstein Departments School of Mathematics, Institute for Advanced Study	Albert Einstein Cause of death Abdominal aortic aneurysm	Albert Einstein Governance of Organization Black Mountain College	Albert Einstein Organizations founded Hebrew University of Jerusalem	Albert Einstein Influenced By Mahatma Gandhi	Albert Einstein Films appeared in Type of Appearance Him/Herself	Albert Einstein Ethnicity Jewish people	Albert Einstein Religion Judaism	Albert Einstein Influenced Karl Popper
em	956886885148	Beijing Tour operators TravelChinaGuide	Beijing Olympics bid on Olympic games 2008 Summer Olympics	Beijing Olympics hosted 2008 Summer Olympics	Lenovo Supplier CompuCom	Lenovo Product lines Product line ThinkPad	Lenovo Computer Models ThinkPad	Beijing Accommodation Beijing Hotel	Beijing Travel destinations served Mode of transportation Air travel	Lenovo Competitive space Space Personal computer	Beijing Local transportation Beijing Subway	Beijing Exhibitions created about this subject Beijing 2008: A Photographic Journey	Lenovo Brands Brand ThinkPad	Beijing How to get here Mode of transportation Bus	Lenovo Sponsorship Sponsored Recipient Korean Olympic Committee	Beijing Climate Month February	Lenovo Products Consumer product Lenovo Thinkpad Edge 11	Beijing Country China	Beijing Olympics bid on Bidding city Paris	Lenovo Product lines Product line ThinkPad Edge	Lenovo Computer Models Lenovo IdeaPad Yoga 13
em	5295826848	Titanic Film Collections AFI's 100 Years...100 Movies	Titanic Primary language English Language	Titanic Gross revenue Currency United States Dollar	Titanic Featured Song My Heart Will Go On	Titanic Quotations I'm King of the World!	Titanic Film format Super 35	Titanic Dubbing performances Language German Language	Titanic Things named after this Titanic Barbie Doll	Titanic Appears in ranked lists List The Movie List: the first 9200	Titanic Subjects Tragedy	Titanic Estimated budget Currency United States Dollar	Titanic Set Decoration by Michael D. Ford	Titanic: Music from the Motion Picture Buy or download Web page .	Titanic Casting director Mali Finn	Titanic Rated PG-13 (USA)	Titanic Production design by Peter Lamont	Titanic Production companies Paramount Pictures	Titanic Art direction by Charles Lee	Titanic Distributors Film distribution medium DVD	Titanic Costume design by Deborah Lynn Scott
em	685776674948	2002 Cannes Film Festival Festival Cannes Film Festival	Aki Kaurismäki Influenced By Jean-Pierre Melville	Aki Kaurismäki Film Story Credits Leningrad Cowboys Go America	2002 Cannes Film Festival Films Spider	Aki Kaurismäki Films edited Historic Centre	Aki Kaurismäki Films appeared in Type of Appearance Him/Herself	Aki Kaurismäki Film writing credits Ariel	Aki Kaurismäki Films Produced Ariel	2002 Cannes Film Festival Instance of recurring event Cannes Film Festival	Aki Kaurismäki Siblings Sibling Mika Kaurismäki	Aki Kaurismäki Spouse (or domestic partner) Type of union Marriage	Aki Kaurismäki Films directed Ariel	Aki Kaurismäki Film music credits Juha	Aki Kaurismäki Education Major/Field Of Study Media studies	Aki Kaurismäki Country of nationality Finland	Aki Kaurismäki Place of birth Orimattila	Aki Kaurismäki Awards Won Winning work Le Havre	Aki Kaurismäki Film Story Credits I Hired a Contract Killer	2002 Cannes Film Festival Films About Schmidt	Aki Kaurismäki Films edited Juha
em	5578775448	Full Metal Jacket Songs Performers The Rolling Stones	Stanley Kubrick Structures Owned Structure Childwickbury Manor	Full Metal Jacket Soundtrack Full Metal Jacket	Stanley Kubrick Place of burial Childwickbury Manor	Full Metal Jacket Estimated budget Currency United States Dollar	Full Metal Jacket Adapted From The Short-Timers	Stanley Kubrick Fictional Characters Created HAL 9000	Full Metal Jacket Subjects Vietnam War	Stanley Kubrick Influenced Robin Williams	Stanley Kubrick Influenced By H. P. Lovecraft	Full Metal Jacket Appears in ranked lists List The Movie List: the first 9200	Stanley Kubrick Things named after this Kubrick	Full Metal Jacket Casting director Leon Vitali	Stanley Kubrick Quotations You're free to speculate as you wish about the philosophical and allegorical meaning of the film—and such speculation is one indication that it has succeeded in gripping the audience at a deep level—but I don't want to spell out a verbal road map for 2001 that every viewer will feel obligated to pursue or else fear he's missed the point.	Full Metal Jacket Set Decoration by Barbara Drake	Full Metal Jacket Story by Gustav Hasford	Full Metal Jacket Rated R (USA)	Full Metal Jacket Costume design by Keith Denny	Full Metal Jacket Distributors Distributor Warner Bros. Entertainment	Stanley Kubrick Religion Judaism
em	7057716748	Richard Burton Dedications Work Dedicated Nineteen Eighty-Four	Richard Burton Representations In Fiction Richard Burton	Richard Burton Theater Roles Play Camelot	Doctor Faustus Appears in ranked lists List The Movie List: the first 9200	Richard Burton Service Military Force Royal Air Force	Doctor Faustus Set Decoration by Dario Simoni	Doctor Faustus Distributors Distributor Columbia Pictures	Richard Burton Religion Presbyterianism	Richard Burton Ethnicity Welsh people	Doctor Faustus Art direction by Boris Juraga	Doctor Faustus Production design by John DeCuir	Richard Burton Cause of death Cerebral hemorrhage	Richard Burton Films appeared in Type of Appearance Him/Herself	Doctor Faustus Music by Mario Nascimbene	Doctor Faustus Edited by John Shirley	Richard Burton Starring TV roles Series Ellis Island	Doctor Faustus Produced by Richard Burton	Doctor Faustus Screenplay by Nevill Coghill	Richard Burton Place of death Céligny	Richard Burton Siblings Sibling Ifor Jenkins
em	7176525248	Jacques-Yves Cousteau Dedications Work Dedicated The Life Aquatic with Steve Zissou	Jacques-Yves Cousteau Ships owned Ship RV Calypso	Jacques-Yves Cousteau TV episodes produced Role Executive Producer	Jacques-Yves Cousteau Hall of fame inductions Hall of fame Television Hall of Fame	Jacques-Yves Cousteau Belongs to Order Order Legion of Honour	Jacques-Yves Cousteau Inventions Aqua-lung	Jacques-Yves Cousteau Participated in conflicts World War II	Jacques-Yves Cousteau TV regular appearances Appearance type Him/Herself	Jacques-Yves Cousteau Things named after this Jacques Cousteau National Estuarine Research Reserve	Jacques-Yves Cousteau TV programs produced Producer type Executive Producer	Jacques-Yves Cousteau Organizations founded EarthEcho International	Jacques-Yves Cousteau Governance of Organization National Association of Underwater Instructors	Jacques-Yves Cousteau Ethnicity French people	Jacques-Yves Cousteau Films Executive Produced Cousteau: My First 85 Years	Philippe Cousteau Cause of death Aviation accident or incident	Jacques-Yves Cousteau Films appeared in Type of Appearance Him/Herself	Jacques-Yves Cousteau Film writing credits The Silent World	Jacques-Yves Cousteau Films directed The Silent World	Jacques-Yves Cousteau Awards Won Award category Academy Award for Best Documentary Feature	Philippe Cousteau Place of death Lisbon
em	8387675748	Mars Meteorites Black Beauty	Mars Planetographic coordinate system Areographic coordinate system	Mars Orbit Type Heliocentric orbit	Mars Artwork on the Subject Twenty-eight Views of Mars	Phobos Discoverer Asaph Hall	Mars Star system Solar System	Mars Orbits Sun	Mars Orbited by Deimos	Mars Named after Mars	Phobos Category Natural satellite	Mars Missions sent here Mars Exploration Rover	Mars Fictional Characters Born Here Jeffrey Sinclair	Mars Fictional Works Set Here Doom	Mars Works Written About This Topic Mars	Mars Contains Tharsis	Mars Locations Beagle	Phobos Star system Solar System	Phobos Orbits Mars	Phobos Named after Phobos	Mars Category Planet
em	7876784948	Cameroon Multi-event tournaments participated in 2010 Commonwealth Games	Cameroon GDP (nominal per capita) Currency United States Dollar	Cameroon Beers from here 33 Export	Cameroon Subject of Poets of the Past and Present in 2014 Spotlight	Cameroon Olympics participated in 2008 Summer Olympics	Cameroon Government bodies Senate	Cameroon Agencies Cameroon Ministry of Justice	Cameroon Internet TLD cm	Cameroon Partially contains Congo River	Cameroon Partially contains Partially contains Congo River	Cameroon Military expenditure as percentage of GDP Source Military expenditure as percentage of GDP, World Development Indicators and Global Development Finance, World Bank	Cameroon Flag Flag Flag of Cameroon	Cameroon Electricity consumption per capita Source Electricity consumption per capita, World Development Indicators and Global Development Finance, World Bank	Cameroon Energy use per capita Source Energy use per capita, World Development Indicators and Global Development Finance, World Bank	Cameroon National anthem Anthem O Cameroon, Cradle of Our Forefathers	Cameroon Currency Used Central African CFA franc	Cameroon Athletic performances Medal Gold medal	Cameroon GNI per capita in PPP dollars Currency United States Dollar	Cameroon GNI in PPP dollars Currency United States Dollar	Cameroon Internet users as percentage of population Source Internet users as percentage of population, World Development Indicators and Global Development Finance, World Bank
em	8372755048	Eritrea Athletic performances Medal Silver medal	Eritrea Multi-event tournaments participated in 2012 World Mountain Running Championships	Eritrea Internet TLD er	Eritrea GDP (nominal per capita) Currency United States Dollar	Eritrea National anthem Anthem Ertra, Ertra, Ertra	Eritrea Olympics participated in 2008 Summer Olympics	Eritrea Flag Flag Flag of Eritrea	Eritrea Currency Used Eritrean nakfa	Eritrea Official Language English Language	Eritrea Electricity consumption per capita Source Electricity consumption per capita, World Development Indicators and Global Development Finance, World Bank	Eritrea Military expenditure as percentage of GDP Source Military expenditure as percentage of GDP, World Development Indicators and Global Development Finance, World Bank	Eritrea Internet users as percentage of population Source Internet users as percentage of population, World Development Indicators and Global Development Finance, World Bank	Eritrea Teams Eritrea national football team	Eritrea Energy use per capita Source Energy use per capita, World Development Indicators and Global Development Finance, World Bank	Eritrea Partially contains Nile	Eritrea Partially contains Partially contains Nile	Eritrea Languages spoken Hejazi Arabic	Eritrea Form of Government Presidential system	Eritrea Capital Asmara	Eritrea GNI per capita in PPP dollars Currency United States Dollar
em	80837248	Apollo 11 Destination Moon	Apollo 11 Launch site Cape Canaveral Air Force Station Launch Complex 39A	Apollo 11 TV programs British television Apollo 11 coverage	Apollo 11 Musical compositions about this topic Man on the Moon	Neil Armstrong Music video performances Music video character Astronaut	Neil Armstrong Peers Peers Buzz Aldrin	Apollo 11 Quotations That's one small step for man, one giant leap for mankind.	Neil Armstrong Subject of Arthur S. Flemming Award	Neil Armstrong Hall of fame inductions Hall of fame Aerospace Walk of Honor	Neil Armstrong Representations In Fiction Neil Armstrong	Neil Armstrong Member of Organization American Philosophical Society	Apollo 11 Films On This Subject The Dish	Apollo 11 Included in event Apollo program	Neil Armstrong Influenced Steve Fossett	Neil Armstrong Things named after this Armstrong	Neil Armstrong Participated in conflicts Korean War	Neil Armstrong Quotations That's one small step for man, one giant leap for mankind.	Neil Armstrong Cause of death Complications from cardiac surgery	Neil Armstrong Space Agency NASA	Neil Armstrong Religion Deism
em	8478554948	Seattle Metropolitan area Seattle-Tacoma-Bellevue, WA Metropolitan Statistical Area	Seattle Tour operators San Juan Safaris	Seattle Government Government and politics of Seattle	Seattle Local transportation Sound Transit	Seattle TV shows filmed here The Night Strangler	Seattle How to get here Mode of transportation Bus	Seattle Contains (Fictional Places) Seattle Grace Mercy West Hospital	Seattle Climate Month November	Seattle Characters that have lived here Niles Crane	Seattle Government bodies Seattle City Council	Seattle Fictional Works Set Here Frasier	Seattle Fictional Characters Born Here Cody Martin	Seattle Structures Owned Structure Benaroya Hall	Bill Gates Belongs to Order Order Order of the Aztec Eagle	Seattle Teams Seattle Seahawks	Seattle Partially contains Elliott Bay Marina	Seattle Partially contains Partially contains Elliott Bay Marina	Bill Gates Subjects Jiba	Bill Gates Representations In Fiction Bill Gates	Bill Gates Episode appearances Appearance type Him/Herself
em	877070565548	J. K. Rowling Blog jk_rowling	Harry Potter literary series Exhibitions created about this subject Harry Potter: The Exhibition	J. K. Rowling Fictional universes created Harry Potter	Harry Potter literary series Part of fictional universes Harry Potter	J. K. Rowling Books illustrated The Tales of Beedle the Bard	J. K. Rowling Languages English Language	Harry Potter literary series Fictional universe Harry Potter	J. K. Rowling Appears in ranked lists List The 50 greatest British writers since 1945	J. K. Rowling Things named after this 43844 Rowling	J. K. Rowling Influenced Emma Maree Urquhart	J. K. Rowling TV programs produced Producer type Consulting Producer	J. K. Rowling Organizations founded Lumos	J. K. Rowling Quotations If you want to know what a man's like, take a good look at how he treats his inferiors, not his equals.	J. K. Rowling Fictional Characters Created Harry Potter	J. K. Rowling Film Story Credits Harry Potter and the Order of the Phoenix	J. K. Rowling Influenced By Stephen King	J. K. Rowling Films appeared in Type of Appearance Him/Herself	Harry Potter literary series Awards Won Award winner J. K. Rowling	J. K. Rowling Films Produced Harry Potter and the Deathly Hallows – Part 2	J. K. Rowling Employment history Employer Amnesty International
em	77848153825048	The Big Bang Theory Theme song Big Bang Theory Theme	Johnny Galecki Romantic relationships (with celebrities) Celebrity Kaley Cuoco	Johnny Galecki Celebrity friends Friend Sara Gilbert	The Big Bang Theory Recurring writers Writer Chuck Lorre	Johnny Galecki Theater Roles Play The Little Dog Laughed	Johnny Galecki Ethnicity Irish people	The Big Bang Theory Program creator Chuck Lorre	The Big Bang Theory Awards Won Award winner Bob Newhart	The Big Bang Theory TV Producer Producer Chuck Lorre	The Big Bang Theory Languages English Language	Johnny Galecki Awards Won Winning work The Big Bang Theory	Johnny Galecki Siblings Sibling Nick Galecki	The Big Bang Theory Award Nominations Award Nominee CBS	The Big Bang Theory Original network Network CBS	The Big Bang Theory Seasons The Big Bang Theory - Season 1	Johnny Galecki Parents Richard Galecki	Johnny Galecki Romantic relationships (with celebrities) Celebrity Laura Harris	The Big Bang Theory Recurring writers Writer Bill Prady	Johnny Galecki Theater Roles Role Alex	Johnny Galecki Ethnicity Italian people
em	546675674948	Boris Becker Sexual orientation Sexual orientation Heterosexuality	Boris Becker Hall of fame inductions Hall of fame International Tennis Hall of Fame	Boris Becker Romantic relationships (with celebrities) Celebrity Sandy Meyer-Wölden	Boris Becker TV regular appearances Program Piers Morgan's Life Stories	Boris Becker Leader of Role Owner	Wimbledon Current frequency Yearly	Boris Becker Starring TV roles Series They Think It's All Over	Boris Becker Awards Won Award category BBC Overseas Sports Personality of the Year	Boris Becker Spouse (or domestic partner) Type of union Marriage	Boris Becker Children Amadeus Benedict Edley Luis Becker	Boris Becker Sports played Sport Tennis	Boris Becker Parents Karl-Heinz	Boris Becker Places lived Location London	Boris Becker TV episode performances Episode Katherine Jenkins	Boris Becker Tennis Titles Tournament The US Open (Tennis)	Boris Becker Romantic relationships (with celebrities) Relationship type Engaged to	Boris Becker TV regular appearances Appearance type Celebrity guest	Boris Becker Leader of Organization Völkl Tennis	Boris Becker Awards Won Ceremony 1985 BBC Sports Personality of the Year Award	Boris Becker Spouse (or domestic partner) Type of union Marriage
em	57865383535048	Michelle Obama Animals owned Animal Bo	Michelle Obama Family Family of Barack Obama	Michelle Obama Member of Organization Alpha Phi Omega	Michelle Obama Appears in ranked lists List Time 100	Michelle Obama Government Positions Held Basic title First Lady	Michelle Obama Religion Protestantism	Michelle Obama Ethnicity African American	Michelle Obama Party Party Democratic Party	Michelle Obama Films appeared in Type of Appearance Him/Herself	Bachelor of Arts Honorary degree recipients Recipient Nelson Mandela	Michelle Obama Works Written About This Topic What Death of Osama Bin Laden Indicates About Barack Obama's Leadership	Michelle Obama Siblings Sibling Craig Robinson	Michelle Obama Awards Won Winning work Let's Move!	Michelle Obama Spouse (or domestic partner) Spouse Barack Obama	Michelle Obama Children Natasha Obama	Michelle Obama Parents Fraser C. Robinson III	Michelle Obama TV episode performances Episode Michelle Obama	Michelle Obama Animals owned Animal Sunny	Michelle Obama Appears in ranked lists List Maxim Hot 100	Michelle Obama Government Positions Held Office position or title First Lady of the United States
em	9078665448	Europe Weather Service 3BMeteo	Russia Belongs To Combatant Group Allies of World War II	Russia Coat of Arms used Coat of Arms Coat of arms of Russia	Russia Multi-event tournaments participated in 2012 World Mountain Running Championships	Europe Contains major portion of Spain	Russia Force Deployments Resource Infantry	Europe Versions released in this region The Legend of Zelda	Russia Casualties Military Conflict Battle of Kulikovo	Russia Athletes Competitor Russia national football team	Russia Athletic performances Medal Gold medal	Russia Places imported from Imported from Uzbekistan	Russia Places exported to Exported to Uzbekistan	Europe Contains (Fictional Places) Eurasia	Europe Universe Mortal Engines	Russia Internet TLD ru	Russia National anthem Anthem National Anthem of Russia	Russia Currency Used Russian ruble	Russia Flag Flag Flag of Russia	Russia GDP (nominal per capita) Currency United States Dollar	Russia Capital Moscow
em	5153485448	Paris Olympics bid on Olympic games The London 2012 Summer Olympics	Paris Conferences DD4D	Paris Olympics hosted 1924 Summer Olympics	Paris Art Series on the Subject Le Pont Neuf	Diana, Princess of Wales Celebrity rivals Rival Camilla, Duchess of Cornwall	Paris Region Île-de-France	Paris Chef-lieu Paris	Paris Major exports Industry Tourism	Paris Accommodation Hôtel de Crillon	Paris Programs with this subject Paris: From Oscar Wilde to Jim Morrison	Paris Local transportation Paris Métro	Paris How to get here Mode of transportation Bus	Paris Climate Month February	Paris Characters that have lived here Daphne Millbrook	Diana, Princess of Wales Celebrity friends Friend Elton John	Paris Fictional Characters Born Here Glass Joe	Diana, Princess of Wales Romantic relationships (with celebrities) Celebrity Theodore J. Forstmann	Diana, Princess of Wales Condition Bulimia nervosa	Paris Awards in this discipline Rastko Petrović Award	Paris Partially contains Seine
em	5788825148	Isaac Asimov Products Endorsed Endorsee RadioShack	Isaac Asimov Fictional universes created The Foundation Universe	Isaac Asimov Dedications Dedicated To H. L. Gold	Isaac Asimov Periodicals edited Periodical Asimov's Science Fiction	Foundation Setting Solaria	Isaac Asimov Condition AIDS	Isaac Asimov Hall of fame inductions Hall of fame Science Fiction Museum and Hall of Fame	Foundation Quotations Never let your sense of morals prevent you from doing what is right.	Foundation Translations Cronache della galassia	Isaac Asimov Works edited Atlantis	Foundation Part of fictional universes The Foundation Universe	Isaac Asimov Series Written (or Contributed To) Black Widowers	Foundation Previous in series Foundation's Triumph	Foundation Next in series Foundation and Empire	Isaac Asimov TV programs Created Probe	Isaac Asimov Fictional Characters Created Hari Seldon	Isaac Asimov Things named after this Asimov's Science Fiction	Isaac Asimov Film Story Credits I, Robot	Foundation Part of series The Foundation Trilogy	Foundation Original language English Language
kl	487680894948	Mary Todd Lincoln Spouse (or domestic partner) Location of ceremony Springfield	Mary Todd Lincoln Gender Female	Abraham Lincoln Profession Politician	Abraham Lincoln Works written Abraham Lincoln	Mary Todd Lincoln Children Robert Todd Lincoln	Mary Todd Lincoln Place of birth Lexington	Abraham Lincoln Parents Thomas Lincoln	Abraham Lincoln Places lived Location Illinois	Abraham Lincoln Place of death Washington, D.C.	Mary Todd Lincoln Siblings Sibling Elizabeth Edwards	Abraham Lincoln Works Written About This Topic Abraham Lincoln	Abraham Lincoln Employment history Title President	Abraham Lincoln Party Party Republican Party	Abraham Lincoln Ethnicity Americans	Abraham Lincoln Cause of death Assassination	Mary Todd Lincoln Religion Catholicism	Abraham Lincoln Government Positions Held Jurisdiction of office Illinois	Abraham Lincoln Film Story Credits Lincoln's Gettysburg Address	Abraham Lincoln Gender Male	Abraham Lincoln Profession Lawyer
kl	88677448	Heinrich Friedrich Weber Academic advisees Albert Einstein	Heinrich Friedrich Weber Academic advisors Ernst Abbe	Albert Einstein Education Degree PhD	Albert Einstein Recordings Einsteins speches and broadcasts: At the Royal Albert Hall, London [1933]	Albert Einstein Works written Isaac Newton	Albert Einstein Employment history Employer Leiden University	Albert Einstein Profession Writer	Albert Einstein Gender Male	Albert Einstein Place of birth Ulm	Albert Einstein Awards Won Award category Nobel Prize in Physics	Albert Einstein Country of nationality Germany	Heinrich Friedrich Weber Place of death Zürich	Albert Einstein Places lived Location Germany	Albert Einstein Things named after this Albert Einstein College of Medicine	Albert Einstein Children Hans Albert Einstein	Albert Einstein Influenced Karl Popper	Albert Einstein Parents Pauline Einstein	Albert Einstein Departments School of Mathematics, Institute for Advanced Study	Albert Einstein Spouse (or domestic partner) Location of ceremony Bern	Albert Einstein Siblings Sibling Maja Einstein
kl	956886885148	Beijing People born here Faye Wong	Beijing Contains Peking University	Beijing Tourist attractions Beijing National Stadium	Beijing Newspapers People's Daily	Beijing Events 2008 Summer Olympics	Beijing Nearby airports Beijing Capital International Airport	Beijing Featured In Films Hero	Beijing Governing officials Basic title Mayor	Beijing Time zone(s) China Time Zone	Beijing Contained by China	Lenovo Headquarters Country China	Beijing Works Written About This Topic The Interior	Beijing Organizations with this scope Beijing Ultrasonic Co., Ltd	Lenovo Child Child Motorola	Beijing Adjoins Adjoins Hebei	Beijing People born here Ai Weiwei	Beijing Contains Renmin University of China	Beijing Tourist attractions Forbidden City	Beijing Newspapers Global Times	Beijing Events Tiananmen Square protests of 1989
